PostDate,Content,Author,RelativeDate,Likes,Dislikes
12 days ago,Rich Power have 8.000.000 million shares in ACDC/CRYBF. DAYMAK have 10.000.000 million shares in ACDC/CRYBF and ACDC have equivalent amount of shares in dollar value in Daymak (less amount of shares but priced at 5.56) CEO Bryson Goodwin holds 20.000.000 million shares of ACDC/CRYBF. 9.000.000 million of those shares where exercised in march 2021 and he havent sold a single share since then. 3 companies heavily invested in eachothers futures and wellbeing. NR.1: One of the companies have existing and operating factories that already produce state of the art lithium batteries and have since april 2020 worked and invested millions of dollars to be able to produce bigger quantities then they already do in the 2 existing factories. There is also another 2 existing factories but i dont have full knowledge if they are used for Rich Power battery production but they are in the same conglomerate. That would make the total 4 factories plus One new factory that should be built and operating by now or soon. Company NR.2 is already one of the biggest EV vehicle company in Canada. And have a vast network of stores and chains all over North America that already sell their products that includes Wall Mart!They also have a new line of EV vehicles that already have reached a presale value of 781.000.000 million dollars and most of those sales are to wholesale companies and not retail, wich makes the sales more solid than retail orders.That company Daymak will soon be a even bigger player in the EV market in north America with their own factory.Dont focus to much on the Trilogy/Spiritus car ACDC will be the provider of all the batteries for Daymak products, and those products are becoming more and more popular for both recreational mobility and for comuting to work. For example in Scandinavia that includes 5 countries, its very normal to take use/take your bicykle for meeting friends and also for going to work. When i was young i bicykled to and from work every day all year around for 5 years straight (i really hated comuting with other people on buss LOL) Even when it was minus -15 degrees! Some people even change their tires to spike tires for the winter...Company nr.3 Extreme vehicle batteries technologies inc. OUR company last week finished and produced the first smart homewall battery and will soon start to send out the product to avaiting preorder customers. The smart homewall is better than equivalent product from Tesla in every way and cheaper. Soon the RV freedom battery will also start going out to avaiting customers aswell. When the news for that battery was released it crashed the website and CEO Bryson Goodwin have said that the demand have been very big. More products coming in Q4 of 2021. With a possible merger with Daymak the future of all these companies are looking very bright. I think thats enough for today. Even though i could continue for hours...Please like and comment so we can get the recognition we deserve. Thank You. 🐘More,Noiz,,0,0
12 days ago,Mathieeeew likes to post memes cause he is mathieeeeeeeeew the terd face,Jesse,,2,0
12 days ago,Last chance to buy at these levels before we have LIFT OFF!,The Stink Bug,,6,4
12 days ago,Whatever, anyone who says that someone is going to be eating out of a dumpster on yahoo finance chat board need a smack in the face. Dumb terds that tell people they are gonna lose there money on a chat forum are a fart in the wind,Jesse,,7,1
12 days ago,Enough children. I’ve muted so many lately,Mikey,,3,0
12 days ago,Mathiewwwwwwwewww, hahahaha, your like a bad sneeze you little wee wee #$%$ bucket,Jesse,,2,1
12 days ago,I'll be seeing Jesse digging out food from a trash can by the end of Q3.,Matthew,,0,11
12 days ago,Matthew is like the biggest terd name I've ever heard,Jesse,,3,2
12 days ago,All Matthew can think about is taking loads to his face,Jesse,,5,2
12 days ago,Getting real close to a bull run now🤝,jesse,,7,2
12 days ago,Down down it goes, going back to 2-5 cent range.,Matthew,,3,9
12 days ago,I am absolutely ready for lift off. Let’s get it going.,The Stink Bug,,8,2
12 days ago,Hey, maybe the Universe is listening? I know you're out there somewhere ... somewhere ... somewhere .... (ooopppss, I just channeled Justin Hayward ... my apologies).,Steven,,5,0
12 days ago,Maybe a Chant, or a ... Mantra would WILL this to happen sooner! We want what we want when we want it!  NOW!  What do you think team?,jmclbos,,3,1
12 days ago,This stock could change your life if you are patient,The Stink Bug,,12,2
12 days ago,There they go again building a wall trying to scare people to sell, we got all the time in the world people, let it build and build and build and build till it bursts!!This is how we get rich!,Jesse,,9,2
12 days ago,To short a stock like this is insanity, so I don't believe itI think there are a couple of people on this board that are just playing around with the positive crowed Just to get a reaction The mute button is the best, saves a lot of timeMore,Kees,,0,0
12 days ago,They can play with themselves they've been doing it there whole lives,Jesse,,7,2
12 days ago,We're in it to win it!,Jesse,,11,1
12 days ago,Nobody sell these shorters 1 god dam share!,Jesse,,9,0
12 days ago,LETS LAUNCH BABY!We got the people, we got the products, so many catalysts coming up!!!!,The Stink Bug,,12,2
12 days ago,I think the share price is stuck at 0.26 cents lol,AboveEnergy,,5,1
12 days ago,We choose to go to the Moon. We choose to go to the Moon...We choose to go to the Moon in this decade and do the other things, not because they are easy, but because they are hard; because that goal will serve to organize and measure the best of our energies and skills, because that challenge is one that we are willing to accept, one we are unwilling to postpone, and one we intend to win, and the others, too.,The Stink Bug,,10,5
12 days ago,Please also remember that the ETF Hans-Gins tech Megatrend is not the Institutional investors that filled the Private Placement at 0.50 CAD so we have even more intrest from "smart money" then just the ETF.,Noiz,,0,0
12 days ago,Good morning fellow shareholders.I can see that some "fellow" investors are talking about other stocks on the board since yesterday for ex: Apple ticker APPL, Google ticker ALPHABET.Tesla ticker: TSLA, so lets explore :) The institutional money that have invested SO FAR in ACDC/CRYBF = ETF FUND HANS-GINS TECH MEGATREND This ETF is managed by a very big financial institution that have several other successful funds, the fund ACDC is placed in is up 10% in the last 3 months. The NAI 500 said in their article about ACDC/CRYBF being picked up by the ETF and i quote: ACDC press release also announced that the company was included in the TECH MEGATREND ETF. While the company have no trouble getting attention from retail investors, having institutional investors become shareholders may be a signal that EV battery tech is being taken seriously by institutional "smart money"  The article also mentions that Daymak already placed a RECIEVED purchase order of 2 million dollars worth of battery systems. I will post article in the comments. So what about the huge companies i mentioned in the beginning of this post? Well it just so happens they are also included in the same ETF = Hans-Gins tech megatrend.So we are in very good company. The NAI 500 article also shows that there is a Asian intrest in the company and that is not strange when you think that we are partners with a huge company RICH POWER a part of the RITAR conglomerate corporation. I repeat myself: You are buying a part of ASIAN industry when you invested in ACDC/CRYBF a very important industry. Thats why we are being manipulated so hard. I beg everyone here lets start to be as serious as they are. We will not be able to stop them with words its just giving them more attention. If they post fudd dont give it attention. If they post things that are not factual let one other member answer that with facts and the rest of us can like that comment. I apologize to all investors here for falling in that trap myself in the past and will better myself. Please do this for me and your own investment. Lets also cut down on feelings and rockets until we acctually launch everyone EXEPT THE STINK BUG he has earned his place as supreme leader of positive enforcement and i would miss the daily reminder that this is one day going to make me and all of the other investors alot of money. God bless you, God bless Canada, God bless America and God bless ACDC/CRYBF!More,Noiz,,0,0
12 days ago,Why would you invest in infrastructure to build a prototype ? That’s exactly why it’s being built in someone’s garage because it’s a prototype. Assuming it works, Then you figure out how to scale up etc,The Stink Bug,,8,3
12 days ago,I heard about ACDC.CN the other day on (http://Stocks-tracker.com). It’s looking like an interesting play.,andonov,,3,4
12 days ago,What do you think apples first prototype is that box built of pine or oak  Ola?,Damond,,5,1
12 days ago,Google tesla building cars in tent,Damond,,1,0
12 days ago,if you look at the pic of the go-kart you can see a HAND holding the door. (hiding it's face) most probably because no hinges are fitted. This is how amateurish this is.,Ola,,0,0
13 days ago,You can be sure Daymak will get the funding from the banks to build the factory in Ontario now to produce all these vehicles, this is going to explode like rocket sauce!,Jesse,,9,1
13 days ago,Daymak $786 million + pre sales!,Jesse,,19,1
13 days ago,This is going back to 2 cents,Matthew,,3,24
13 days ago,Well stated Stink Bug👍,David,,3,0
13 days ago,Let?s just all get along. Are we here to make money or what???? Aren?t we all here because we are invested in a kick #$%$ company????? If you don?t believe in ACDC then why are you here????????,The Stink Bug,,24,3
13 days ago,Was able to grab another 12,000 shares today. 😜 . Hodl'ing,John,,13,1
13 days ago,Closed in the green. Praise be to Bryce. Let's GOOOOOO,Ian,,16,1
13 days ago,Does any off you guys know how it feels to manage a business, if course not, you're too busy minding other poeple's business. ...,Jeremie,,0,0
13 days ago,@Stinker Bug ... so just to be clear, was this the MASSIVE DAY or LAUNCH you predicted yesterday? Or was this another miss? Just so your fans know how you score the day ...,jmclbos,,8,2
13 days ago,The dump went on little Russell's face,Jesse,,8,0
13 days ago,Little Russell is a wee wee,Jesse,,7,0
13 days ago,Closed green. Solid day. Great news this morning. Awesome.,The Stink Bug,,19,3
13 days ago,LOOK at blink he says!!!! hahaha. Why not just look at Tesla genius????,ton,,2,8
13 days ago,Look at Blink SP…this is what we will look like down the road….,David,,19,0
13 days ago,it is.....in reverse though ! that gear shift lever was R for race right?,Jim,,1,1
13 days ago,It will launch.,The Stink Bug,,7,3
13 days ago,This is a reverse split in the making like 200-1,Look out,,0,7
13 days ago,Really this is the great news what a joke.,Russell,,1,1
13 days ago,Warning ⚠️ Major dumping coming .,Russell,,2,8
13 days ago,Maybe we need to cut Mr. Stink Bug some slack. He is one thing if nothing else ... he is persistent. Unfortunately, his persistence is always coupled with being persistently wrong. Can you focus more on being right? Your followers seem to like your posts, even with the 100% inaccuracy you enjoy. Maybe you’d get more followers with an occasional correct post?  I’m just spitballing here.,jmclbos,,8,0
13 days ago,We are still heading in the right path…just a little slower than most would like…This will be bigger than life…,David,,8,1
13 days ago,Time is coming. Hold tight.,Dreamer,,8,0
13 days ago,So....is this like a reverse launch ? Noiz ?....through the roof guy ? the toddler with the pink pants comments ?,Jim,,4,2
13 days ago,Easily the most undervalued stock in Canada,The Stink Bug,,12,2
13 days ago,Get your buy orders in at 25.5 in case our benefactors decide to gift us a last minute dump like they did yesterday,Rick,,13,0
13 days ago,Jeff bezos launched Amazon from his garage. U expect ACDC a start up compnay to have a fancy facility😂🤦🏿‍♂️,jesse,,15,1
13 days ago,Ignore the static. All the puzzle pieces are there. It’s just a matter of time. PP at 0.50 don’t forget. Keep your eyes on the prize. We going to the moon.,The Stink Bug,,11,5
13 days ago,Immature comments funny,Russell,,1,2
13 days ago,Little Russell is back!,Jesse,,3,1
13 days ago,This is b/s  look at pictures  one home made charger and go kart.,Russell,,1,5
13 days ago,@Stinky Bug … you are awfully quiet. Did it launch yet?,Steven,,3,4
13 days ago,Idk why yall stressing abt price doesn't matter it gonna be $1 end of year,MOLE,,5,2
13 days ago,SUPER PUMPED  SCAM UP 2,500 % in 12 mouths timber .,Russell,,1,6
13 days ago,0.19 today based on this news.,Ola,,0,0
13 days ago,I think the certification and delivery of products will make this stock fly. For now, let’s just hope that it will happen soon.,Tyche,,7,2
13 days ago,What I really want to see at this point is updates for Smart Wall and approvals. Pre-sale numbers for smart wall and other products. I know pre sales for Daymak series will not be out until that pre-sale event is officially closed.Great to see the prototype, pictures are not that professional but is OK from the timeline perspective as they said before that prototype will be available in 2022.,J.S,,9,2
13 days ago,yikes this will go down to .25 again or low. i have no more money to add. this is sad,Scammaz,,3,5
13 days ago,I don’t care if a prototype is made at the elementary playground if it sells. Ignore the fluff… things are moving along and Daymak is clearly happy with the partnership. The rest is fluff. Baseless bashing on anything that can be picked out. None of it matters. Will continue to add when I can at these levels.,Chicken Man,,3,1
13 days ago,the CEO speaks from the bedroom. The "sneak peak " looks more like a garage..#$%$..they are making a fool of all of us...I don't trust them a bit...last we heard $450 mil Daymark order...nothing in the revenue column ever since...they have a BIG 0 production capacity...I have lost half of my investment on this already...unless someone has a reasonable argument...I say we should take the rest and run....,Vivek,,1,6
13 days ago,Bryson, time to stop the fluff BS and release some revenue/profit projections!!!  Do something for your shareholders!!!!,Winning2021,,6,1
13 days ago,Don’t be discouraged boys, remember that 30% profit from daymak coming soon, understand that Acdc is a startup company, Rome wasn’t built in a day!!! Smart wall is waiting for approval so that’s more money for us, ev chargers, Titans, trilogyev etc etc Be patient and we’ll all get paid not now but in the future coz Acdc is the future!!! Hold strong!!!,rujohn,,0,0
13 days ago,,Jimmy,,2,1
13 days ago,https://equity-insider.com/2021/02/09/red-hot-battery-technology-space-poised-for-great-disruption-with-new-ai-based-tech/In case you are new here,Rick,,11,1
13 days ago,this was by far the most amateur post I've seen. #$%$ embarrassing,Ola,,0,0
13 days ago,Well 36k volume, no one was really impressed by the low quality photos ! C'mon acdc you can do better !  😎😎,AboveEnergy,,6,1
13 days ago,Good news but horrible photos. Looks very amateur,adrian w,,12,0
13 days ago,Ugh is that cardboard cutout taken in Steve’s garage?,Scott,,6,1
13 days ago,trending on yahoo right now too!    VERY BULLISH!!!,Shawn,,3,1
13 days ago,I'm long on ACDC, and love the news of the prototype. Still don't think it will move the SP very much. hopefully I'm wrong,Justin,,6,0
13 days ago,“This collaboration has been working in perfect sync and we are moving forward way ahead of schedule,” stated Daymak CEO, Aldo Baiocchi. “This progress is so exciting to see, and it speaks volumes to what this partnership means and what we can achieve together.”This is my favourite part.,Chicken Man,,10,1
13 days ago,@CheerSquad and @Stinky Bug ... so good news, but what closing share price today would represent a "Massive Day" or a "Launch". I want to be ready to celebrate.,Steven,,3,1
13 days ago,,The Stink Bug,,1,1
13 days ago,I,m long but the picture of the prototype looks like being put together in a person's garage.doesn't look very professional,Keehn,,4,1
13 days ago,"The Contest is open to all residents of the United States and Canada (excluding Quebec)"Me who lives in Quebec:,AboveEnergy,,12,0
13 days ago,MASSIVE day ahead!,The Stink Bug,,11,4
13 days ago,LETS GO!!!!!!!!!!!!!!!!!!!!!!!!! Love to see the prototype in the news release!!!,The Stink Bug,,12,4
13 days ago,Breaking: EV Battery Tech Provides ‘Sneak Peak’ at the First Trilogy Vision,ARKS,,0,0
14 days ago,ACDC….once in for all you can chat and chirp all you want on this board….I get it…there are people who are ill informed and there are people who know what’s going on with this company with that being said this isn’t happening overnight….this is a long term investment.All the DD I have done tells me that…hopefully this will enlighten some people on this board….if not well you have not completed your research of the big picture….”Best of Luck”Hopefully I have not offended anyone didn’t mean too….🍺,David,,13,2
14 days ago,Look at OLA today..."i  have a feeling this will be 0.19 tommorow" 😂😂😂  i told you guys not to motivate me with your talking. Every time i just go dig up more facts and realize what your up to. Pride BEFORE fall. Do you Still have a feeling people will sell tommorow when you sell shorts? Or are we gonna buy? So you can squeeze us to the moon on wendsday and thursday LOL. CHECK, your move! But dont run around like a little empror without clothes. Its already CHECK MATE! 🐘🐘🐘,Noiz,,0,0
14 days ago,Just realized that competiotion winner will be announced on Wednesday exactly the time market close. Can someone from Canada please confirm this in the comments, i live in very different time zone... The company have historically released news on wendsdays before... and many times after market close. Thats why shorters started to push end of trading day today. They only have 2 market days left before news and are in panic. They will continue their attack tomorrow (well maybe not since we know the plan now LOL) so no matter what happens chill and hold. On wendsday last hours before close they will start to buy back! All actions and facts are pointing towards this. Iam gonna watch... hope they short and sell and pick up more free money :)  🐘🐘🐘🐘More,Noiz,,0,0
14 days ago,Not only did we already have the catalysts to be at 1 dollar. We also have millions upon millions of shares that need to be bought back. Because of all the shorted shares this will go more insane than it already should. Imagine when even more news comes, and its not really more news we need. We just need more new people to know/understand  the company. The low volume of the last 2 days are helping them get what they want a low share price when we get more volume they will melt like ice in the sun. I bought MMAT metamaterials inc for weeks the cheaper it got the more i bought. Last week it finally turn around and i got in the green. Today i made some really nice profits. Same will happen here. It wasnt fun when i was losing money on MMAT but i held on and bought more. The money i wilm make in these 2 companies will pay for a new house or a rental. What are you going to do with your profits? Tell me in the comments. :) 🐘More,Noiz,,0,0
14 days ago,So Another day with the exact same volume like friday until the shorters dumped over 500.000 shares. Nobody is selling exept shorters. I Said it before they want to start covering from 0.21 CAD where they got trapped with 50 million shares in January anyone can see this for themself on shortdata(dot)ca. Borrowing fee on ACDC ticker didnt appear until 27 january. Thats the only new proof i have and the data everyone can see on shortdata(dot)ca. They have been waiting for low volume to be even able to breakthrough to a lower price hoping you will sell, so they can cover. Thats why we see them barking so loudly lately. I think new short data will be presented on august 31 or it wont be able until September 1. We already have the data fro. millions of shares shorted on USA ticker CRYBF since Trilogy news.  New margin rules will be in effect for shorters on September 3 in USA. I realky think this could be the week we start see some really intresting things. They can sell shares to themself lowering the shareprice but they cant buy shares from themself! Only from us :)  The tantrums and mocking they have been exelerating last couple of weeks...Think about it... who does normally show this kind of behaviour?? Think about it... Answer: Children and teenagers. What i want is not happening! therefore you are stupid and iam angry. Normaly this behavior is directed towards the parents. Well guess what we are the parents! The parents of the shares they want! :) and that boys and girls is why they are angry. I mean the do anyone here honestly think that if you have the money to buy 500.000 shares that you are so nervous when everyone just find out about bullish news Trilogy and first shipment of smart homewall battery and more news coming. That the logical thing is to dump those 500.000 at the last minute of the market. Thats desperation and people with the capability of buying 500.000 shares are not desperate, specially when everyone is waiting for big gains... 🐘More,Noiz,,0,0
14 days ago,Stink bug and chicken senses are tingling.,Chicken Man,,0,0
14 days ago,It’s official we launching tomorrow.,The Stink Bug,,13,6
14 days ago,Haha, lots have a good feeling for tomorrow, lets see your psychic power tomorrow, dear!,*DOGE*,,8,0
14 days ago,Nooooooo!!!! I Missed that short dump 😭😭😭 wanted to buy 🤠 congratulations to the Ones that got some! 🐘,Noiz,,0,0
14 days ago,Last time I had this feeling I called the smart wall news. Tomorrow we will get update on another product 😎 if not I’m happy either way but I got this feeling.,Chicken Man,,0,0
14 days ago,0.19c here we come. embrace your losses. tomorrow will be a big loss day, I have a feeling.,Ola,,0,0
14 days ago,Can this bashing each other stop now?Its really annoying now,J.S,,8,1
14 days ago,should be able to buy a bigger box tomorrow !,Jim,,1,1
14 days ago,WOW this stock is LAUNCHING !,Jim,,3,1
14 days ago,one of the stink bugs crew got a new condo !,Jim,,2,1
14 days ago,,Jim,,2,1
14 days ago,The 6 Best Up &amp; Coming Stocks To Buy Right Now!  For more info https://youtu.be/UyYUmQW9WJU,bretting,,2,3
14 days ago,Who is ready for lift off?,The Stink Bug,,0,0
14 days ago,You know ... maybe ... Bug just needs more Monkeys in his cheering squad, ALL LAZER FOCUSED on ACCURATE launch predictions. Maybe NASA has some help to offer, or Musk! The BUG clearly needs help!,jmclbos,,6,4
14 days ago,Let’s roll ACDC lots of Great things to happen in the near future…,David,,15,2
14 days ago,This thing going to be HUGE...its gonna blow...the stink bugs at it again....HaHaHa.....what a maroon !,Jim,,2,4
14 days ago,The infinite monkey theorem states that a monkey hitting keys at random on a typewriter keyboard for an infinite amount of time will almost surely type any given text, such as the complete works of William Shakespeare.  We just need to give Stink Bug more time. Yet, I remain bullish on the stock, just not the cheerleading.,Steven,,0,0
14 days ago,no one buys daymaks.,Shah,,0,0
14 days ago,Let’s launch!!!,The Stink Bug,,6,2
15 days ago,I think this week is gonna be huge,The Stink Bug,,17,4
15 days ago,Bryson GoodwinCEO: Extreme Vehicle Battery TechnologyRecommendation : Kirk Strassman              “In working with Bryson - one of his best qualities is his ability to see what others don't see. His visioning is clear and executable.  With the right team and supporting environment he has the ability to both select and create the right solution. The net result delivers sustainable value to all shareholders and stakeholders alike. He will also roll up his sleeves and undertake whatever task needs undertaking to get the correct outcome. His mentorship and innate leadership skills will drive results in his teams and generate positives returns. An exceptional person in all regards!”  https://vm.tiktok.com/ZMRkpptcG/More,Satv,,15,0
15 days ago,The biggest positive factor nobody talks about. Not too long ago this company had offering to the investors where the investors paid about 50 cents a share at a time where the company was trading at around 25 cents a share. Yes double!,snow,,11,0
15 days ago,Let’s go! Bell rings in 12 hours.,The Stink Bug,,12,3
15 days ago,🤞🤞🤞 for some ground breaking news! Really,  I don't mind accumulating more but I feel that I have enough and ready for some real excitement to begin for us longs!,John,,20,3
15 days ago,I think this week is going to be massive we probably can expect news on the RV battery soon. Massive massive week ahead !,The Stink Bug,,18,4
15 days ago,Hey guys don’t listen to Steven. This is supposed to be a place of positivity and to celebrate getting rich on ACDC. I am not sure what is wrong with Steven. He is very angry at strangers he doesn’t even know anything about. Hope he’s ok.,The Stink Bug,,7,5
15 days ago,Just thinking what would the sp be after approval? I wonder how much Aldo would give us after September 30? Is our revenue gonna be high? Please let me know Thanks Acdc longs!!!You guys think we’ll have some rally this week or more news?,rujohn,,0,0
15 days ago,We are gonna launch this week. First week of September. It’s gonna be huge. End of Q3 baby!!!,The Stink Bug,,10,5
