PostDate,Content,Author,RelativeDate,Likes,Dislikes
6 days ago,How many units in production ? What’s the expected output to be sold ? These companies giving little tid bits of information is ridiculous . All that news release tells me they are a small time company hoping to retrofit some more of their friends with a unit . ￼,Rob,,1,9
6 days ago,Some serious action there eod .. scare tactics in full force,Tony,,9,1
6 days ago,Almost double volume, can’t wait to see short data 😎,Chicken Man,,0,0
6 days ago,A shorter just said to me if you bought every time you said you would own half of the company by now :) he just helped me to prove to you guys iam real! I dont have to post pictures on Facebook... i Will put up some of my shares i dont want to risk ro many and my broker Only allow me to set it no higher than 1.50. I Will put up a part of my shares now and tomorrow at 1.50 come look for yourself :) if you have the option from your broker to put whatever  price you want... from now on put all your shares for sale at 100 dollars every day. Thank You!,Noiz,,0,0
6 days ago,Read the news release headline it says “TO BE INSTALLED “,The Stink Bug,,10,1
6 days ago,Okay everyone sayin it was a box on the floor. This was just shippedFrom China last week. It hasn’t been installed yet. Perhaps the NR was a bit ofJumping the gun and they should have waited for it to be installed and showed the functionality but big deal just because it’s not installed doesn’t mean it doesn’t work. TLDR the news release was maybe pre-mature. I’m sure they are just excited the product is in Canada.,The Stink Bug,,10,1
6 days ago,Just put another order in. Buy and hold people buy and hold. 🐘🐘🐘🐘🐘,chris,,6,0
6 days ago,well I'm done, #$%$ acdc,Robert,,0,0
6 days ago,Obviously investors are seeing  through the #$%$ If this company was legit.. do you guys not think bigger companies would of invested already????,ton,,1,10
6 days ago,No grinding here...just factual observations....nice logo'd box though !,Jim,,2,2
6 days ago,Grind harder Jim Boy! I am not a Trader but I am an Investor so i don't settle for pennies like you do...you can get my shares at least 3yrs from now...😄,ape,,8,0
6 days ago,,Jim,,0,1
6 days ago,is all you can do is give the facts a thumbs down ...you know who you are !,Jim,,1,7
6 days ago,another 47k @ 0.255..... i can hold 3yrs or more and i'm not sure if shortist can go along with me...😉,ape,,11,0
6 days ago,CRYBF isdown as well....guess the boxes on the floor didn't live up to the hype !,Jim,,0,3
6 days ago,You would think for this big NR they would have showed the installation, not a box on the floor. They cannot even show basic schematics .....NO INFORMATION WAS GIVEN !!! A box on the floor !,Jim,,0,4
6 days ago,What’s with this barcode trading,The Stink Bug,,0,0
6 days ago,On the move.. Start buying into Lithium as well !!!!!,Rick,,0,0
6 days ago,Picked up another 10,000 shares @ .255. Gives me 110,000 now at a average of .2680!Let’s ROCK!!,Mikey,,11,0
6 days ago,Can someone help me with details about the NR today? 1. Was the Smart wall purchased from EV Battery Tech or was it just installed for testing?2. Why was the home owners not interviewed? 3. why did they just show the box, they should have showcased the App and done some kind of Demo...I really hope there is more clarity to the NR and hope to see positive effect on price action. I hold 3500@0.32, planning to add more but not sure if its worth the risk... Need better quality NRs.More,Madhav,,0,0
6 days ago,Bought Another 9.900 shares at 0.26 just now... I mean cmon 😅 it was already ridiculus. Now its just beyond anything i can describe... Did they short the whole companies sharefloat with doubble the amount of shares that exist? Is MMAT really gonna buy up the company and someone know and a bit out is imminent. I dont know i dont care anymore. I/we have more then enough evidence this is not even mathematicly possible anymore. Every time we get Good news = BIG volume and then down to 0.255 and alot of screaming and crying from shorts.... Ok shorters you are right it cant go up because you have endless credit? Well they dont and the cost to borrow shares going up everyday... My shares are Free, i own them and i dont owe anyone any money to own my shares. Therefore it doesent cost me anything to hold... i just buy more until YOU cant afford to pay the intrest or get margin called because of to little liquidity. Bought my daily and now iam going for a Walk :) see you guys at the close of the Trading day 👍🏻🐘More,Noiz,,0,0
6 days ago,Good volume for the past 6 months, stock is churning through the float day by day until there is a big squeeze and boom straight to dollar land.,Tony,,0,0
6 days ago,im waiting for a massive news then a big squeeze that will let us go to 1$ and up!!!! im waiting patiently,Scammaz,,16,1
6 days ago,4k more at .255 ..... so sweet,allenandyvrsl,,14,1
6 days ago,I don’t believe that people sell it for pennies. It must be some sort of manipulation to keep it down.  but I guess they can’t keep it down for long.,Pratik,,0,0
6 days ago,The cost to borrow ACDC shares to short the stock went to Another all time high 15.68% its showing on Ortex and that data is not updated since the end of August. We got this 🐘,Noiz,,0,0
6 days ago,Picked up another 15,000 😁,John,,9,1
6 days ago,Markets seem to start to calm down Nasdaq is on plus now 🤠🐘🐘🐘,Noiz,,0,0
6 days ago,So bitcoin just flashcrashed to 43.000 dollars now at 47.000... Did i sell? No i bought more :) i dont even know what price i bought bitcoin, went so fast... bought Ethereum under 3.100 bought XRP under 1 dollar. What i didnt do is follow the normal human psychology= its going down i must sell. Think about that some People sold or had a stop loss at 43.000. Next time they look at their crypto it Will be gone and if they want it back it Will cost them alot more. Be like the elephant move with the herd but be prepared to stand your ground Alone. ACDC is looking extremly well with the crazyniness and extrem volatility on the markets today. So we are looking Good and i Hope People find their heads during the day and markets stabilizes and i Think it Will. Se are still going to the Moon dont forget to pray for Rick :) 🐘More,Noiz,,0,0
6 days ago,,Jim,,1,1
6 days ago,See I luv VikKings post below, nothing but FACTS.,Jim,,2,5
6 days ago,I always take financial advice from people with handles like "Chicken Man" or "The stink slug" because.... you know its just so mature .  The people you are calling bashers are just bringing up FACTS....HMMMMMM.....,Jim,,0,3
6 days ago,Truth be told, these bashers would just leave it alone and not live on this bird saving us from “the fraud”. If it was truly dropping on its on or it was inevitable they wouldn’t be here.Know what you hold.Daymak presales at $760+ mil. Ends 30Sept, at which point I expect them to ramp up going public efforts.No one is here to save you money. Ignore their FUD.Love to see the product, targeted video for prospective investors. More is coming you better believe it. This company is changing before our eyes. Congrats to the kings on today! 2 hours into the session and we are barely under avg volume, trending on yahoo where a new investor would be drawn to that amazing looking product.Shorts days are numbered and it’s clear, news brings volume. It’s only a matter of time.Good luck to the quartet of clowns on this board, you’re gonna need it!More,Chicken Man,,0,0
6 days ago,Damn! It wasn't even worth putting new short position. Can't pump this piglet properly any more.,Srdan,,0,0
6 days ago,Keep holding on to your dream Noiz, the good news is xmas is coming...there should be lots of new cardboard to add to your appliance condo on blackberry street ! Haaaa !,Jim,,1,2
6 days ago,https://twitter.com/daymak/status/1435257085961375744?s=21,rujohn,,1,1
6 days ago,Lol. Announcement Means nothing again. I could go buy a battery at Home Depot and install it at my house. Funny how ACDC does not mention the solar panels, inverter, etc etc needed. Oh, and the App to control this unit? This announcement only says what’s not happening. And you can bet this ACDC battery is being installed at one of Goodwins friends house. Just more smoke and mirrors.,I luv VikKings,,1,6
6 days ago,Its simple,  buy and hodl!,John,,9,1
6 days ago,Considering that the Dow Jones, Nasdaq, US 500, and US tech, are down this morning, acdc is doing great. All US stocks down.,Bill,,8,1
6 days ago,I run a content studio. I’m reaching out to these guys ASAP. Love the product but that video didn’t give us the “wow” factor it deserves.,V,,12,1
6 days ago,I’m hoping for atleast a .30 close today after this news. With the interview from the CEO on YouTube and the product being delivered and installed this should be intriguing and promising to new investors GLTA 🎈,Nicholas,,13,1
6 days ago,Wonder why they never installed it and showed it working. Poor editing as well. If they can’t afford proper editing equipment for their pump videos what’s the chance of this thing working?,Scott,,0,9
6 days ago,Grabbed another 5k for good measure lol,Feelya,,10,0
6 days ago,Huge volume too!!! Congrats guys. Video looks 🔥,Chicken Man,,0,0
6 days ago,,Harpal,,13,0
6 days ago,Just a Word of advice, what my advice have Always been dont sell! We might go straight up... but if we also have millions and millions of shares that need to cover it Will normaly happen in Waves until pressure become to big and ACDC will fly and pop like the champagne bottles we will drink for breakfast in the future... Hold buy Hold Buy! See you soon at 5 dollar 🚀🐘🐘🐘,Noiz,,0,0
6 days ago,BUY &amp; BUY MORE!!! It's all written on the wall...,ape,,16,1
6 days ago,,Ricky,,0,0
6 days ago,What happened to that Viking dude?,Giuseppe,,9,0
6 days ago,,The Stink Bug,,12,1
6 days ago,awesome preview video of ionix pro.  I love the design and the size of ionix pro won't take up to much space at all.  this is amazing.,Jason,,20,1
6 days ago,https://ca.finance.yahoo.com/news/ev-battery-tech-unveils-first-110000121.html,Mat,,0,0
6 days ago,OHHHH YEAHHHHHHH BABY BIG NEWS DROP TO START OFF THE WEEK YOU GOTTA LOVE IT,The Stink Bug,,12,0
6 days ago,https://ca.finance.yahoo.com/news/ev-battery-tech-unveils-first-110000121.html,Matt,,9,1
6 days ago,Breaking: EV Battery Tech Unveils First SmartWall to be Installed in Canada,ARKS,,0,0
7 days ago,MMAT mentioned ACDC? And MMAT finally on the run back up. Hope we have a good run for ACDC this week!,a,,15,0
7 days ago,12 hours to lift off! You gotta love it!,The Stink Bug,,20,1
7 days ago,@Stink Bug Lot's of enthusiasm, and predictions ... massive momentum, lift  off, typical stuff. I have a large number of shares and would love to see it all come true. I will look forward to Friday afternoon to see if and how all the predications panned out,Steven,,8,0
7 days ago,Mmat peeps are going in!!!They’re buying tomorrow, let’s get ready to rumble!!!Watch from 4:20https://youtu.be/WLskZB9qAhIMore,rujohn,,0,0
7 days ago,Looks like signs are turning extremely bullish again, akin to the February parabolic rally. Can we expect $0.50 by next week?,Tony,,14,0
7 days ago,Just watched the Sept 2 update from Mr Goodwin Nothing about approval and stamps from the government for the productsThat is the news we are waiting for to start moving the stock and has been the holdupNow he is talking about selling the product alreadyHe is confusing, did we get approval without a Press releaseBought another 40K last week because the approval should be close, right? or do wehave the stamps already?More,Kees,,0,0
7 days ago,Huge huge huge momentum headed this way next week,The Stink Bug,,16,3
7 days ago,Norway huh!!!https://www.facebook.com/109015327948178/posts/212621467587563/?d=n,rujohn,,0,0
7 days ago,https://www.canadianmanufacturing.com/manufacturing/ev-battery-tech-signs-exclusive-ev-infrastructure-agreement-with-automall-development-271568/,JT,,11,0
7 days ago,Word is there is out-of-this-world momentum coming this way again.,Tony,,0,0
7 days ago,Don't stop now what else the market gonna do today, maybe confer with the other two you know curly and Larry (you know who you are)anyhow I have some fish in a barrel to shoot after all more difficult than than you 3,Damond,,1,2
7 days ago,0.24 today?,Ola,,0,0
8 days ago,To the people who were saying that short volume is not too much and all this short shares chatter is over blown, please check shortdatadotca for this ticker. As of Aug31, the short volume is higher than ever, higher than after Feb runup?Whats missing?,J.S,,3,0
8 days ago,THIS WEEK IS GONNA BE INSANE!!!!!!!! MMAT, Daymak and battery certification around the corner.  Consolidation at 0.25 just a damn spring ready and loaded to launch so many potential catalysts any moment now this is just too good can’t wait,The Stink Bug,,9,0
8 days ago,MMAT, Daymak, ACDC this stock is about to go damn crazy!,The Stink Bug,,16,0
8 days ago,Load up !,The Stink Bug,,13,1
8 days ago,Tuesday people are loading up!,Jesse,,11,0
8 days ago,MMAT Are loading up Tuesday Volume might go crazy on Tuesday Watch from 7:55https://m.youtube.com/watch?v=_-sJDwL98A4&amp;noapp=1More,rujohn,,0,0
8 days ago,I’m just two more days we have LIFT OFF bullish on next week baby!!!,The Stink Bug,,8,0
8 days ago,Elon tweeted about ACDC before...Georgpe P. this time..I own Tesla, ACDC &amp; MMAT/MMAX so this gonna be awesome....😉😎,ape,,10,1
8 days ago,I really like ACDC and MMAT works togather as both are from Canada and become a major player for Clean tech Energy.....thats my take.,letmebehonest,,0,0
8 days ago,picking up shares tomorrow.  like that mmat connection,Jon,,0,0
8 days ago,https://nai500.com/blog/coverage/warren-buffetts-betting-big-on-ev-battery-technology/,rujohn,,0,0
8 days ago,Barcode trading last month. MMAT buyout? Heard the ceo tweeted about ACDC?,The Stink Bug,,5,0
8 days ago,I just found out that one of our comunity members RICK is fighting for his life and he will be at the hospital this week on Thursday. To have a tumor removed from his brain. Please post #PRAYFORRICK in the comments and like the post so Rick and his family can feel we support him. Lets make this the number one post in the history of the forum! IAM very bullish on Ricks health!  🚀🦋🐘💝,Noiz,,0,0
8 days ago,Posted on the Facebook group, conversation about Acdc in mmat https://www.reddit.com/r/MMAT/comments/phj5zx/georges_acdc_tweet_tin_foil_hat/,AboveEnergy,,9,0
8 days ago,Is there any connection between Metamaterial inc and ACDC??...some romourse going but i am not sure.,letmebehonest,,11,0
9 days ago,Daymak presales at 794 million,Jason,,19,2
9 days ago,Numbers are in and i was wright! shortvolume and shortvalue both doubled since 15 august on ACDC and in the same period shorting went down on ticker CRYBF! 🐘🐘🐘,Noiz,,13,1
9 days ago,If you check the Short positions have consistently been doing downhttps://m.canadianinsider.com/node/7?menu_tickersearch=ACDC+%7C+Extreme+Vehicle+Battery,Giuseppe,,5,0
9 days ago,Walking around and just saw a Daymak scooter. It’s a sign!,The Stink Bug,,18,4
9 days ago,seems about right !,Jim,,8,1
9 days ago,found a picture of The stink bug and Jesse paddling to their ACDC riches !,Jim,,4,0
9 days ago,I cant wait for Tuesday! I hate long weekends. Oh yeah baby we got this! September is gonna be huge for ACDC investors.,The Stink Bug,,13,5
10 days ago,my preseption is a lot more buying than anything judging from some data ... are the shorts setting themselves up for a failure 🤔,allenandyvrsl,,6,0
10 days ago,I think next week will be a crash. Autumn is coming. Battery certification news will fail.,Ola,,0,0
10 days ago,Wasup pumpers?...,Srdan,,7,2
10 days ago,I think next week will be massive. Summer is over. Battery certification news imminent.,The Stink Bug,,19,6
10 days ago,another day, another cent down 👎,Ola,,0,0
10 days ago,Hopefully Jesse finally gave up on this dud.,Scott,,5,3
10 days ago,There has been a lot of attention this week on the EV prototype but people forget the EV is a NICE TO HAVE. It’s a bonus product for this company. Don’t forget this company’s bread and butter is BATTERY MANAGEMENT SYSTEMS not electric vehicles! Even if the EV prototype doesn’t work out it doesn’t change the fact that ACDC has a competitive advantage in the BMS sector.,The Stink Bug,,27,4
10 days ago,Ladies and Gentlemen! Today is my birthday! Make it count! Iam gonna celebrate with 10.000 shares atleast :)If you buy some shares for my birthday let me know 🤠🥳🐘🚀,Noiz,,0,0
10 days ago,CRYBF up 8 % Do you guys remember when i Said they changed between the ticker they short and that it could end soon because of New regulations on naked shorts in the US from what i know today those rules are supposed to be enforced. Also iam still waiting for short data on Canadian side that goes to 31 August didnt show up yet. Short volume went down on Crybf after 15 August when the last report was made probably because they know they can short ACDC for 16-18 days without anyone getting that data...this is all theory offcourse... but its intresting exactly today CRYBF shoots to plus 8%,Noiz,,0,0
10 days ago,CRYBF up 2 cents. Wow,Bill,,3,2
10 days ago,RSI has been holding steady @ 44.75 most of this week. Chailkin money flow was positive all of August, but is on the line going negative. Pivot point is 26.8. MACD is holding steady @.005. Has the "Big Sleep" started or is the stock in a Coma. ?,Bill,,5,0
10 days ago,Heading into the long weekend knowing certification is around the corner and multiple catalysts on the horizon!,The Stink Bug,,0,0
10 days ago,Worst stock in my portfolio.,papa,,6,6
10 days ago,Get ready for the new @stink bug prediction...probably in a hour or so ....here is a preveiw......"Massive massive week ahead !" this going to take off....we gonna be rich !"  Every day for thee months.........,Jim,,8,1
10 days ago,CEO of Metamaterials George Palikaras just tweeted about ACDC the rockband... he have been tweeting last weeks ala Elon Musk style with cryptic messages like: Bravo 6 going dark... Metamaterials is also a Canadian company that are growing and have said they want to grow organic and not organic by buying up other companies. They recently bought a Nano tech company... Iam not trying to get People exited by making stuff up its just something i noticed. And Most of us agree we are being manipulated one way or the other. either by shorters or accumilators. Hopefully its both 🚀🐘,Noiz,,0,0
10 days ago,At this point, unless you have been long long you are down holding this, no way anyone is in the green with this death by a 1000 papercuts...disclosure I have 40000 at .036 average,Stephen,,10,1
10 days ago,ACDC….still rocking forward… Nice long weekend ahead….Enjoy 😎,David,,8,1
10 days ago,@Stinky Bug ... so 5 days ago, this was your prediction:"I think this week is going to be massive we probably can expect news on the RV battery soon. Massive massive week ahead !" ... and, 8 hours ago:"I don’t expect much tomorrow but after the long weekend… look out."So with a full day of trading left you are throwing in the towel? The stock is down a half cent or more on the week, your prediction for this week so far has been WRONG, yet you slide right into a new prediction? You are really something Bugman. I'm just not sure what, other than consistently WRONG!More,Steven,,8,0
10 days ago,Matthew if your really concerned sell your shares I'll buy them,Damond,,4,2
10 days ago,Can anyone please explain why the financials report has not been released since April? I thought it was mandatory for public companies to release ever quarter? Thanks.,Matt Man 0424,,4,0
10 days ago,Ola pola why don't you slither back to polar power and continue your lame #$%$ pumps,Damond,,5,2
10 days ago,0.19 before weekend? I have a feeling it will crash.,Ola,,0,0
11 days ago,I don’t expect much tomorrow but after the long weekend… look out.,The Stink Bug,,5,2
11 days ago,They had some interesting insights about ACDC.CN on (http://Multistockalerts.com). Definitely made me think twice about the company.,cassella,,2,1
11 days ago,I hope most of my fellow ACDC holders have MMAT/MMAX too... I know a few who has it... Still love ACDC all the way...😉,ape,,3,1
11 days ago,FORGET ACDCABBA JUST RE-UNITED DONT BE A LOOSER - SELL.ITS A SIGNMore,Ola,,0,0
11 days ago,Good things its not falling . Developing a strong support here and volume picking up and time to fly soon.,Dreamer,,15,1
11 days ago,Impressive volume, near or more than average daily which means this is consolidating nicely for the next leg jump.,Tony,,0,0
11 days ago,load while its still cheap,Stella,,15,0
11 days ago,21000 held. Can’t wait for next pay day!,Matt,,0,0
11 days ago,$ 200 million estimated revenue for ACDC over the next two years just from the Daymak deal alone. That should be reason enough to load at these prices.With those numbers alone this would be a easy $2 stock,Goldrush86,,0,0
11 days ago,The 8 Best Stocks Under $10 To Buy Right Now!  For more info https://youtu.be/1Ibm_-0H8Eg,killgo,,5,2
11 days ago,This price is a steal. Thanks for 30k. The reason why this is sideways is because there are no sales numbers - yet. Once there is some real dollar figures we won’t see these prices again,Aaron,,19,2
11 days ago,Are Steven and JMC the same person? They always post in unison.,The Stink Bug,,6,3
11 days ago,0.2550 IM SO EXCITED. AND I JUST CANNOT HIDE IT.,Ola,,0,0
11 days ago,Or how about a LUNCH and LAUNCH!...  C’mon Team! Let’s win this one for the Gipper!,jmclbos,,8,1
11 days ago,Hey ... today is NOT over! How about an afternoon rally?  Or:- To the MOON at NOONor ...- We go PUBLIC at ... uh ... urrr ... Ah snap, what rhymes with Public?More,Steven,,8,1
11 days ago,I like to trade what I see, meaning the charts so I’m going to stick to that since we have already fundamentals tossed all over the place.If you didn’t already and for those who don’t look at charts that much, pull up the weekly chart which should give you an insight on a broader picture. Add the 20 and 50 moving average and you will see the triangle being formed since June 21 and we are now almost at the narrowest end of that triangle. The SP never dropped below the 50 since it’s also acting as a very strong support. IMO breakout will happen in the next couple of weeks… glta,Ivan,,28,2
11 days ago,Tomorrow or Tuesday when everybody back from summer holidays looking to load up,Damond,,8,1
11 days ago,Big financing coming, YOU CAN FEEL IT!  ACDC needs lots of cash to execute on all cylinders and to allow the last PP investors an opportunity to average down substantially.,Niagara Hemp,,0,0
11 days ago,Let’s roll….ramp up the revolution!!,David,,12,1
11 days ago,Will today be our big day??,The Stink Bug,,8,7
12 days ago,0.19 in near future as 0.26 support soon is gone.,Ola,,0,0
12 days ago,Did they announce,The Stink Bug,,3,1
12 days ago,Trilogy EV winner to be announced in 6 minutes,J.S,,7,1
12 days ago,The longer I can add at $0.26 the longer I can prolong Olas suffering. Man will this ride be fun! Coiled up and ready for blastoff 🔥💥,Chicken Man,,0,0
12 days ago,Awesome recap Noiz…say no more this is the future and it will be Bright for all ACDC stock holders 😎👍,David,,8,1
12 days ago,I just looked at the orders 😂 2500 shares for sale at 0.26...565.000 bids at 0.255 and the price is still at 0.255 and minus 3 % today. I mean come on hahahaha. I couldnt buy today my bank demands that i send in the contract for real estate that i sold because i have been moving suspicious amounts to my broker LOL. Congratulations to everyone that got some today 👍🏻🐘,Noiz,,0,0
