PostDate,Content,Author,RelativeDate,Likes,Dislikes
15 days ago,Do any of you followers, like @STINKY BUG and @OLA ever look back at your childish posts and feel any shame? Were you brought up this way, or perhaps you are still being brought up? Your mommies and daddies must impose a lot of timeouts for your behavior. Why not let the grownups use this board to try to make money, and save the fighting for when grade school starts up again?,Steven,,3,2
15 days ago,Well well well, Ola, Ola, Ola unfortunately for you  with regards to class it can't be bought borrowed or taught I to conquer add everyday and will continue to prevail especially among ugly sask of #$%$ such as yourself and the others who go out of their way to share their obviously miserable existence (averaged down from .50 diamond handing over 300k),Damond,,8,0
15 days ago,Thoughts on how high the SP will go once solid news is release…,David,,5,0
16 days ago,,Mathieu,,5,0
16 days ago,Daymak $771 million +,Jesse,,15,2
16 days ago,I think an other management update would be welcome We shipped the first powerwall, that was great newsIt was stated there were delays because of Covid and material shortageThe question is when this wall is installed successfully and in Demo, do we start selling and delivering  Looking at the pre-sales from DAYMAK and we supply the battery and Powerwall can they be delivered on time Reading the article yesterday that we are strong competition for Tesla we should get the ball rolling Sales, projected Sales and delivery estimates will start moving the stock, Money coming in $$$$$$$More,Kees,,12,0
16 days ago,End of august next week. Massive things ahead. Ola doesn’t get it.,The Stink Bug,,10,2
17 days ago,https://m.facebook.com/EV-Battery-Tech-109015327948178/?refid=13&amp;__tn__=%2Cg,jesse,,17,0
17 days ago,10 k,chris,,10,0
17 days ago,I sold most of my Apple Stocks to Rock on with some ACDC !,Aaron,,29,0
17 days ago,Well, didn't manage to pick up any today! Have a great weekend everyone! Next week could be huge! Ask the stink bug! Lol. Cheers all longs,John,,19,0
17 days ago,,Jim,,6,4
17 days ago,Even Ola giving up saying his buying shares… shorts are quitting. Should go on our trademark Friday close run today 😎 happy Friday 🐘,Chicken Man,,0,0
17 days ago,Close .28🤝,jesse,,8,1
17 days ago,I like that ... the Bull Squat......seems like a fitting name for your crew !,Jim,,4,1
17 days ago,Watch out ...the Bull Squad is coming....but its more like what comes from the backside of a bull though !,Jim,,5,0
17 days ago,The 6 Best Up &amp; Coming Stocks To Buy Right Now!  For details https://youtu.be/UyYUmQW9WJU,chavous,,6,0
17 days ago,Break out soon.,The Stink Bug,,9,1
17 days ago,1 month chart 50 day moving average switch with the 200 day moving average🚀🚀,MOLE,,9,0
17 days ago,101K shares @ a good price.,Ola,,0,0
17 days ago,Daymak deal as of now alone should have the market cap at minimum 400 million dollars.  Just saying. All the literature is there!,John,,11,0
17 days ago,Did you notice that on the daily chart the 20 50 and 100 moving averages are almost aligned with each other and they are sitting between 0.265 and 0.286,Ivan,,8,0
17 days ago,Average was finally brought down to $0.275 today which was my goal. Might be able to crack my goal if we stay at these levels. My average was originally $0.42,Chicken Man,,0,0
17 days ago,How much are you guys holding? Im at 60k shares diamondhands,Scammaz,,0,0
17 days ago,I don’t understand the incentive of shorts to be bashing the stock. If it’s a bad company, don’t say anything and people will be more prone to buy in without your negative opinions. I question the genuineness of you takes.,Giuseppe,,5,1
17 days ago,Jesse, Noiz, Stink bug, Tony and my other bull squad membersKeep up the good work,J.S,,10,0
17 days ago,0.25 here we go,Ola,,0,0
17 days ago,super happy I get to collect shares at 25¢. even if this stock takes a few years to break out, it's still a good early entry point into the future of Electric products. not as expensive as some as well, so still a good opportunity to make some money here long term.,Dustin,,9,1
17 days ago,.28 close end of day. Have a good weekend y'all,Tony,,8,2
17 days ago,How many short shares need to be covered Noizz?,Jesse,,5,0
17 days ago,Viola, Jimmy pink pants, lill Russell, scott empress, your times up you lose, go start s boy band fools,Jesse,,7,0
17 days ago,https://equity-insider.com/2021/02/09/red-hot-battery-technology-space-poised-for-great-disruption-with-new-ai-based-tech/,matt,,15,1
17 days ago,Intrest rate to borrow ACDC/CRYBF shares is over 15% since yesterday all time high. I just spent 30 mins writing a post about it and it disappeared! 😖,Noiz,,0,0
18 days ago,We had a good august. Launch of Trilogy EV and delivery of first smart wall prototype. Honestly that’s a lot for one month. Hope the share price moves soon.,The Stink Bug,,19,2
18 days ago,Gold Mine Stock ACDC.CNImagine when Extreme Vehicle Battery will sign contract with any city in USA, Europe, South Africa, and in Canada. I think City Of Vancouver, British Columbia will be first target for Titan Energy Core ESS .Tesla files to become an electricity provider in Texas https://www.cnbc.com/2021/08/26/tesla-files-to-become-an-electricity-provider-in-texas.htmlExtreme weather events are pushing consumers to solar and residential storage https://www.cnbc.com/2021/08/25/extreme-weather-pushing-consumers-to-solar-and-residential-storage.htmlMore,Satv,,15,0
18 days ago,What does all this data mean??,David,,1,0
18 days ago,CEO Bryson Goodwin have 20.000.000 shares in ACDC/CRYBF and havent sold. If he can hold 20 million then i Think we can hold as well. The intrest to borrow shares and short is 15% went up from 13% yesterday. That is a very high number. Shorters (Ola,Vikeking,Srdan, Jim...) what iam i gonna find when i buy fintel? You want to tell me now or should we talk tomorrow? 🐘,Noiz,,0,0
18 days ago,feeling 0.25 coming again tomorrow.,Ola,,0,0
18 days ago,Maybe ACDC can develop a product to harness all of the hot air that Ola and the other shorts like VikeKing or Scott blow out of their respective mouths. Certainly there would be enough hot air to power the electric grid for months, easily.,The Stink Bug,,16,1
18 days ago,The asks are retreating they are scared,Jesse,,12,2
18 days ago,Volume on par, looks good to me.,Tony,,6,0
18 days ago,Sad to see that ACDC is not attending Battery Show 2021. Would have loved to see them there!,Chicken Man,,0,0
18 days ago,My crystal ball is telling me a large purchase is coming up. 😉,John,,10,2
18 days ago,So CRYBF is up 4% with 27 % higher volume then 65 day average. ACDC is down 3.64 %. USA passed regulations to stop naked shorting... Canada did not and have big issues with naked shorting. Iam not gonna put a date... but this will absolutely explode. 🐘,Noiz,,0,0
18 days ago,Feeling a .26 close.,Scott,,1,4
18 days ago,Like for ACDCDislike for Ola,The Stink Bug,,26,2
18 days ago,Thanks to who ever sold,  another 13,000 hodl'd away till next year!,John,,2,0
18 days ago,Is she getting ready to go here people,Jesse,,4,1
18 days ago,Feeling a .29 close,Jesse,,7,2
18 days ago,,John,,6,1
18 days ago,Us ticker up 5%,MOLE,,7,2
18 days ago,Right from Remax. The deal ACDC supposedly made with Glenhalla estates to install chargers at an automall in Hope BC. Well, Glenhalla was foreclosed on by bank over 90 days ago. The NR was a month ago. Glenhalla doesn’t have control of the property but ACDC made an agreement? Too funny.   *COURT ORDERED SALE. 19 acre C-2 Commercial Development site at junction of three major highways: Hwy 1 (Trans-Canada), Hwy 5 (Coquihalla) and Hwy 3 (Crowsnest). Can be subdivided into multiple lots. Master plan for hotel and convention center, seniors housing, condominium, retail CRU's, drive thru, and auto mall. Opportunity to acquire a highway oriented gateway development site in Hope, BC at the eastern entrance to the Fraser Valley. Contract Listing Agent for a Confidentiality Agreement (CA) to receive access to the data room and form of offer. ALL OFFERS TO BE SUBJECT TO COURT APPROVAL.  How can anyone trust these people?More,I luv VikKings,,5,5
18 days ago,WOW! ACDC must be legit!! finally have a prototype but yet no outside investment or interest! LETS GO!!!,ton,,11,2
18 days ago,Youtuber: Dummy boy finances, released his latest stock picks and predictions. He is basicly saying what i said in my latest post. Just in a less stupid and complicated way LOL 😂Small breakout retest of 0.27 and he thinks its looking Good. Iam joining his Patreon and so should other People in this forum he is the Only one consistingly talking about ACDC/CRYBF 🐘🐘🐘,Noiz,,0,0
18 days ago,atleast all the money I've lost in acdc I'm making back on nbm,Robert,,1,1
18 days ago,Let’s get it halted.,The Stink Bug,,6,1
18 days ago,Takeover Chatter !!!!!In my knowledge most of energy storage companies are patched with Solar Panel companies either by merger or takeover bids. Tesla is also developing their own Solar Panels and trying to force buyers to have entire package combined or STFO. If ACDC or any Solar company are looking at each others. What Solar company might take over or merge with ACDC ?,Satv,,8,0
19 days ago,Big day ahead,The Stink Bug,,11,3
19 days ago,Hey guys don’t listen to Scott Toiler Paper brand,The Stink Bug,,9,0
19 days ago,Let’s go ACDC…lots of great things happening…,David,,22,1
19 days ago,I dont think ur sllowed to install anything unless its csa approved. Correct me if om wrong,Yolo,,5,1
19 days ago,exro has 3x outstanding shares as us and is 2.50 you multiple .27 by 3 acdc would be equivalent as getting exro for .90 and acdc has way more potential,MOLE,,10,3
19 days ago,More product update in the coming days.. hint hint***,Tony,,8,0
19 days ago,She is churning boys. Churning!,Tony,,4,1
19 days ago,Don’t lose hope,The Stink Bug,,9,1
19 days ago,And another 9000 today.  😁,John,,8,0
19 days ago,Noiz remember this? Lol,Tony,,0,0
19 days ago,Usually when someone sells into the ats bid they get pulled right away..  it seems they want as much .265 as possible which tells me it won't go much lower,Tony,,2,0
19 days ago,We are due for an update on the RV freedom.. guessing before the week is over.,Tony,,5,0
19 days ago,Consolidating near the 200 and 50 day ma.. very bullish for what's coming ahead,Tony,,0,0
19 days ago,To everyone that is worried they responded to one of my emails and Stated there private placement Investors have no concern about the company nor price stop worrying the private placement places at .50 is discounted right now it’s .27,jesse,,5,0
19 days ago,When we had the 50% run up on June 10. The foundation for that run was layed on June 2. SP went from 0.225-0.27 and had a volume of 5.7 million. The 5 Trading Days after we had around average volume 1 million shares and traded around 0.25 CAD. On the 6th trading day (10 june) news of P.P at 0.50 CAD was complete and a volume of 18 million took SP to 0.40 around 50% increase in one day. Since then its just been more and more bullish news. Now the news that took SP to 0.95 CAD in february are starting to materialize and actual Product is on the way to customers, Daymak have presales of 750 million  wich will be revenue for ACDC soon. I dont get it... it feels like we are on a Island and no one can find us... When they do they are not gonna belive we had Bahamas to ourself... Anyway yesterdays news was offcourse amazing and puts to rest the bashing we had to deal with last months, where is the factory it doesent exist, they will never make a battery bla bla bla...I said last week we are repeating the pattern/consolidation after the february/june run. Well what iam getting at is that before june run we had a little spike, just like we had yesterday with 5 trading days after that also started like today 5% down and then sideways 4 days before it absolutley sky rocketed. Hopefully it is just following the pattern like it did so far. I know i repeated the same thing twice in this post, i hope people will get the point. And also i bought today at 0.27.  🐘More,Noiz,,0,0
19 days ago,Rv freedom and smart charger update should come out next week. Rv freedom was being tested early June. I was expecting RV freedom before anything really.,Tony,,15,1
19 days ago,Huge influx of baseless bashing without anything backing any of it. That’s enough to get me to buy more. They’re here for a reason and it’s not to make you money. They know they have to be here as a last stitch effort.,Chicken Man,,0,0
19 days ago,Holding strong with 18K shares! For a college student, I think it's a pretty good position,AboveEnergy,,22,0
19 days ago,,Jim,,1,8
19 days ago,,Aaron,,7,0
19 days ago,this has held so strong mid .20s! if you sell or upset with what you own here you are brain dead! I bought at .18 and took profits at .90. Then bought again at .23 and licking my chops at another opportunity to buy if idiots sell again!,Aaron,,6,0
19 days ago,And down she goes !,Jim,,1,2
19 days ago,,Jim,,2,2
19 days ago,Does anyone have perspective if tested translates to certification?,Philip,,7,0
19 days ago,although I've been holding this stock too long to not continue holding it. I'm feeling like it's a pile of 💩,Robert,,3,4
19 days ago,The nr’s have dullled the market. Foolish pumpers who say things day in and day out in the boards assist with hesitancy.  For example - hoping gm uses acdc batteries……you need an approved product to begin with. And an actual product that is designed for the road car…news flash…which they don’t. Picture from a factory with one ——-one power wall. The market isn’t dumb that’s why you saw a 2 cent rise and now it’s falling back. Pumpers do your portfolio a favour and stop your idiotic posting.More,Scott,,2,5
19 days ago,buy, buy, buy,Chris,,0,0
19 days ago,just a pipe dream but wouldn't that be something if their batteries get used to replace the recalled batteries in the Chev volt now that would be a news release. again just a pipe dream lol,Darel,,8,1
19 days ago,The first device is destined for an owner in Canada.,rujohn,,0,0
19 days ago,Big big day ahead,The Stink Bug,,14,3
19 days ago,Let’s hope for positive news today folks…😎,David,,12,1
19 days ago,Another good news today??,yo,,7,0
19 days ago,$ACDC is my ride for a better FUTURE, never selling! Hello from Sweden 🙋🏽‍♂️,ZOULSNACK,,0,0
20 days ago,looks very promising,Kevin Van,,0,0
20 days ago,Like to see a unit installed, hooked up and the CEO turn the switch Does not have to be a long video, that will get a lot attention worldwideSend it to all social media and Boooom Anyone that works with electronics and installation on this board so we can vote that person in?More,Kees,,0,0
20 days ago,We need a few thousand of those smart wall batteries to be shipped to Canada and US then we will have revenue!!! That’s the only the beginning boys and girls!!! Rv freedom, Titans, ev smart chargers, n more!!! This will be one of those stocks to have right now people!!! Believe me, Acdc is the future!!! Let’s go get this,rujohn,,0,0
20 days ago,I bought shares at .75 cents, then it kept going down. Many investors bashed this stock to the fullest possible limit even calling it a scam. I too thought for a moment that it was true but then I let it ride. There was one news about Squamish multifamily developer wanting to use the technology that caught my attention. I am sure now that it is not a scam but a game changer. This technology will do a lot of good to the environment and the world. GLTA.,UC,,30,0
20 days ago,Validation the product is REAL!,The Stink Bug,,32,1
20 days ago,by this friday breakthrough .30👍,MOLE,,15,1
20 days ago,Why is the app’e stock app not picking up the news release, anyone?,michel,,0,0
20 days ago,Market Makers are coming back from vacation, this is just the beginning boys and girls!!! It’s all coming together!!! Y’all know they’re gonna be buying loads of shares before sp goes over $1!!! Like I said 50% off, buy more tomorrow, this week and coming weeks. Let’s go Acdc!!!,rujohn,,0,0
20 days ago,Some of you folks argue like you're 2-year-olds. Isn't this site for sharing information?? Read the posts you like, ignore the ones you don't. How much money do you think all the trolling and fighting will put in your pockets?,Steven,,0,0
20 days ago,Buy because not for the past even not for right now, it’s for the future!,zl,,22,1
20 days ago,probably made 1 prototype and are shipping it to themselves in Vancouver.,Audi R-10,,4,10
20 days ago,Close0.28,cameron,,8,0
20 days ago,Closing @.295,Pat,,11,1
20 days ago,Check out MIR guys, took some acdc profits there.. big bounce coming I think,Tony,,0,0
20 days ago,Extreme Vehicle Battery Technologies Corp. (ACDC.CN) have announced  announce that they have officially completed building, testing and have shipped the first of the SmartWall series to Canada!,Dreamer,,14,1
20 days ago,my AMC is squeezing... hold-on ACDC and I would be back shortly...🤣🤣🤣,ape,,5,0
20 days ago,Don’t waste your time with these goons.  Hold your shares.Doesn’t take much to see their character if they are regulars on this forum just to bash trash us and the company we believe in.BUY and HOARD those shares.,Pipe,,6,0
20 days ago,I emailed extreme this morning to inquire about the smart wall installation folks. It’s going into a home in Vancouver BC no exact address was shared. I’m sure there will be more to come.  Thanks,chris,,14,0
20 days ago,Ola is a troll,cameron,,6,0
20 days ago,Real big catalyst that will double the SP here is the EV charging station which is in the EV sector in it's own right. Once it is revealed and ready for testing, this will attract big BIG MONEY,Tony,,8,0
20 days ago,SELL SELL SELL.,Ola,,0,0
20 days ago,us stock up 20% and we are still at 7%,Robert,,2,1
20 days ago,Well the shorters got the best of everyone today,cameron,,4,0
20 days ago,Huge sell just came in,AboveEnergy,,0,0
20 days ago,0.29 was the top for today on that news 😂,Ola,,0,0
20 days ago,gotta get this trending. Build some momentum,shawn,,4,0
20 days ago,Rebuild that wall! 🐘 The only way is up!,Rick,,10,1
20 days ago,Just pasted 250K volume in the US still below 10day average of around 280KThat means the news is not traveling fast Let's spread the news,Kees,,10,0
20 days ago,Well as BTO says Let it Ride hang tight and hold.,chris,,8,0
20 days ago,If you flip your chart over to weekly, you will see that  .29 is 20 moving average which has been acting as resistance for quite some time now.. hopefully this momentum will allow us to break it and stay above it..,Ivan,,11,0
20 days ago,,rujohn,,0,0
20 days ago,https://twitter.com/daymak/status/1430216545817579520?s=21,rujohn,,0,0
20 days ago,,rujohn,,0,0
20 days ago,Today’s release is great but there’s a chance of pullback here until we hear what kind of demand and dollars exist for this product. Obviously EV and renewables are the way, just need those fundamental figures for this to make a purposeful move. GLTA.,V,,11,1
20 days ago,remember it is never too late to start buying and build up a core while this is still under the .50 pp.,Scammaz,,11,0
20 days ago,Shorts are going to finish covering later today we aren’t even CLOSE to done here,Chicken Man,,0,0
20 days ago,This is our moment guys. We cracking $0.30 today. Technicals are lining up incredibly. Going to start seeing huge volume buys here. Not to mention trending like crazy on yahoo and other places. THIS IS OUR MOMENT! Congrats longs!!!!,Chicken Man,,0,0
20 days ago,I’m so glad I loaded up,TTRecs,,0,0
20 days ago,Someone please sell me 11031 shares at .27 please?,Stonkykong,,2,2
20 days ago,0.30 let’s go,The Stink Bug,,6,0
20 days ago,Will end over 0.30 today.,BigDaddy,,8,0
20 days ago,Slow and steady uptrend- OK I like it.I don't mind if this goes 2 cents up everyday, that's healthy, right VikeKing?GLTAMore,J.S,,12,0
20 days ago,Time to start the marketing and sales campaign to make some money .,roscoe,,9,0
20 days ago,should be at least .30 by now...,Why Not,,6,0
20 days ago,Today is the beginning of a new trend for ACDC,  the product is real the contracts are real and the revenue is coming. The true investor know what they’re holding and are waiting patiently. Price drops are the manipulators and the impatient ones that will kick themselves next year. Don’t make that mistake.,Goldrush86,,0,0
20 days ago,Grabbed some more,  up to 254,200 now.  Let's get this moving!,John,,12,0
20 days ago,US side is up 12%,AboveEnergy,,8,0
20 days ago,BREAK THOSE WALLS DOWN BABY,The Stink Bug,,12,0
20 days ago,1.6m…lots buying now!!!,David,,10,0
20 days ago,https://youtu.be/Lg0izcEaEWwThis is literally happening now... I feel like someone figured out the mistake and trying to scare investors into selling cheap ... lol... the price will be corrected soon to reflect valuePs: people stocking are big players trying to take as much cheap stock as possibleMore,BEL,,0,0
20 days ago,This announcement is great and looking forward to this companies future. However this announcement is just that an announcement. Until we have real money exchanging hands and products being shipped out, we won’t be seeing any real momentum. If no news comes up shortly after this, don’t be surprised to see the share price fall some more. Remember this is a long term hold! Good things will comeMore,Michael,,14,1
20 days ago,so far 3 irrelevant comments on my question.. ill try again.. the have an actually working prototype now!! IF this was legit why haven't the big boys invested?? I want a informative answer please?????,ton,,0,2
20 days ago,I see Ola is back. The prodigal son returns.,The Stink Bug,,3,0
20 days ago,Smart walls ... renewable energy Ev Batteries Ev cars I still have the image of Jonah in superstore when he mistakenly priced the electronics at .25c This is so insaneMore,BEL,,0,0
20 days ago,#$%$ it, just bought some more at .28,Michael,,7,0
20 days ago,we just need more volume to push the sp up,Scammaz,,12,0
20 days ago,This company needs promotion for the stock to go up. For example, stock has mentioned on the youtube  platforms like Wall street reporter and a like.,sali,,0,0
20 days ago,the products are real! to all the haters,Tylor,,8,0
20 days ago,with news like this why is ACDC not moving? serious question?,ton,,3,0
20 days ago,Just added 5000 more.,World,,7,0
20 days ago,It broke 0.28 at 10:56 am!,AboveEnergy,,9,0
20 days ago,Name a company in Canada that is doing wat ACDC is doing?,Yolo,,5,0
20 days ago,This is all primed and ready for a breakout any day now!!!!!   SO BULLISH!!!!!,Shawn,,7,0
20 days ago,Let’s break 0.30,The Stink Bug,,8,0
20 days ago,RV freedom should be fully certified by now.,Tony,,5,0
20 days ago,The SmartWall stores energy captured by solar panels or from the grid and keeps it in reserve to enable owners to customize system energy usage. SmartWalls can be connected together for larger battery storage enabling the consumer to power their home completely independent from the grid, using 100% renewable energy.  LOL. So they are selling a chargeable battery. So? This is not new. Too funny. Not even approved for use in Canada.,I luv VikKings,,3,6
20 days ago,Just purchased another 17,500 this is going to be BIGGER than life….everyone hold on….,David,,8,0
20 days ago,So did everyone eat today? Are we gonna hold the wall? Can i start buying at 0.275 is it ok? TIME TO STOMP THE SHORTS! 🐘🐘🐘🐘🐘🐘,Noiz,,0,0
20 days ago,Nice... sales are being delivered. This should pump the stock to where it should be.,Douglas,,9,1
20 days ago,I gotta also say that’s a sexy looking smart wall, super sleek, love the logo. Outperforms Tesla’s smart wall, this thing is gonna sell like crazy.Not to mention, throw a small Daymak logo on there after the merger 😎🤔🤫,Chicken Man,,0,0
20 days ago,Imagine if this nr was in February when the market was manic. Would have hit 2$. A .02 cent increase today. How do you figure this out.,Scott,,3,0
20 days ago,There’s gonna be more product updates in the weeks for sure!!! This feels like back in January/February time, news almost every week let’s go Acdc,rujohn,,0,0
20 days ago,If government announces tax credit for these products, they will gain great traction in sales. This is the future my friends. You have solar panels charging these smart walls during the day while you are away at work and with that power stored you can charge the EV over night. So basically yes a little expense in the beginning but you never after to visit the gas station or a mechanic for a very very long time.,Tony,,13,0
20 days ago,No .275 break?,cameron,,2,0
20 days ago,LETS GO,The Stink Bug,,2,0
20 days ago,Powerwall APPROVEDAvenire series battery contract with 750m in pre ordersRv freedom battery approval coming soonWhat else do we need?More,Rick,,11,0
20 days ago,Bollies are tight up or dmwn,martin,,0,0
20 days ago,This is a right time to buy 🚀🚀,henry,,0,0
20 days ago,Noiz must have been excepted on the board of directors after a lot of votes yesterday Have not seen any responses from him anymore And today we got news I expected some more action but the day is just startingMore,Kees,,0,0
20 days ago,0.28 close….,cameron,,4,1
20 days ago,0.30 by noon,Rick,,10,0
20 days ago,Massive wall to break at .27HOLD those shares BoyZ,Pipe,,0,0
20 days ago,Not selling a single share there no point buying back in just hold ✌,MOLE,,7,0
20 days ago,Did the article mention where they shipped the units to?,Ahmed Reza,,2,0
20 days ago,Smart wall connect together for larger battery storage enables the consumer to power their home completely independent of the power grid. Using 100 % renewable energy. This will go ballistic and we are in on the ground floor. Congrats to us all.  🐘🐘🐘🐘🐘,chris,,6,0
