PostDate,Content,Author,RelativeDate,Likes,Dislikes
2 hours ago,Thoughts on the SP…by end of October?,David,,4,0
3 hours ago,In October, the Canadian small cap markets saw the entry of a new clean technology company that promised to revolutionize the growing battery and electric vehicles industries.  Armed with a massive patent portfolio and using the latest in artificial intelligence, Electric Vehicle Batteries Technology Corp., burst onto the Canadian Securities Exchange with a mountain of investor interest, averaging daily trading volumes in the millions.  ACDC is on the path to developing and commercializing a suite of battery management technologies that will revolutionize the Energy Storage Systems and electric vehicle market while also leading the battery industry with battery recycling technology.  With an exclusive partnership with one of China’s top battery technology companies, ACDC will be targeting the global market, including North America, South America, Africa and Europe to deploy its technology.More,Noiz,,16,0
3 hours ago,Let’s see if I can go 3/4 (I missed my “closing at .28 today” call a few weeks ago)News tomorrow, share price moving news. See you beauties tomorrow! Happy Monday!,Chicken Man,,0,0
4 hours ago,do they have any real products?,Stella,,0,7
6 hours ago,Way undervalued SP,J.S,,17,1
7 hours ago,Like a spring just compressed absolutely ready to explode upon CSE approval look out,The Stink Bug,,0,0
8 hours ago,We have a better solution at a better cost than our competitors!!!We are in this for the long run, so it is not just about revenue targets. We are here to make drastic improvements to battery technology and revolutionize the way ESS is manufactured!!!,rujohn,,0,0
9 hours ago,GOOOO!,The Stink Bug,,9,1
12 hours ago,https://stockhouse.com/news/newswire/2021/09/13/how-this-ev-stock-launching-everyday-commuter-into-futureNew article from stockhouse,Justin,,28,2
13 hours ago,Let’s LAUNCH! It’s MONDAY!!!!,The Stink Bug,,16,2
14 hours ago,Tell us about Jiangsu Richpower.  The company has a very impressive client list.  How was the company formed and who are the people responsible for its success?Richpower started doing lithium ion battery management system as early as 2010, and it has been the focusing field all these years. It first engaged in electric tools and electric bicycles, then into base station backup in 2011, electric vehicles in 2015, and R&amp;D for large-scale energy storage in 2015. The company currently has 250 employees, among them 70 are R&amp;D personnel. This year, 400,000 sets of products will be shipped in the field of base station backup power, 700,000 sets of shared electric bicycles, and a contract of 87 MW is signed in the energy storage field, and so on. At present, the company’s technical core team includes: CEO Han Jingke; Dr. Zhao, a Ph.D. of Harbin Institute of Technology, who engaged AI application in lithium ion batteries as early as 2009; Professor Lv,  a professor at Harbin Institute of Technology, who started the establishment and research of electrochemical models as early as 2010.More,Noiz,,22,0
14 hours ago,Ultimate Garbage stock. Only idiots will invest in this trash.,Faizal Mohammed,,3,24
15 hours ago,Massive week ahead!,The Stink Bug,,14,1
15 hours ago,Global EV Battery Market Doubles In July 2021. Chinese manufacturers note the highest growth rate year-over-year.https://insideevs.com/news/532437/global-xev-battery-market-july2021,Satv,,13,0
18 hours ago,They had some interesting insights about ACDC.CN on (http://Multistockalerts.com). Definitely made me think twice about the company.,chessmore,,5,9
yesterday,Trilogy Vision X is faster than most super fast cars, 0-60 in 1.8 seconds, wow!!! Let’s go!!!,rujohn,,0,0
yesterday,Daymak's EV has been included!!https://twitter.com/Daymak/status/1436708632914169860?s=19,Shawn,,14,0
yesterday,Who is ready for lift off?,The Stink Bug,,16,2
yesterday,Most of us here knows about the True Value of the Company...But for a few, they only knew about the Price...💪💪💪Price is Current... Value is the Future... 😉,ape,,0,0
yesterday,,Nick,,12,0
yesterday,Execution is the name of the game!!!So far Bryson and his team has been doing goodSeptember 30/Q4 here we come, we taking overLet’s make this happen!!! Let’s go!!!More,rujohn,,0,0
yesterday,Can’t wait for next Monday,The Stink Bug,,14,2
2 days ago,Did they finally get rid of that #$%$ Robert Abenente? He's not listed in the team members on the website.,Wesley,,2,2
2 days ago,Good evening,Wesley,,2,1
2 days ago,https://documentcloud.adobe.com/link/review?uri=urn:aaid:scds:US:d214839e-14ab-430b-97a3-f60e4e9faaa1,Benjamin,,2,3
2 days ago,I honestly think next week is gonna be massive,The Stink Bug,,18,3
2 days ago,We got THIS!,The Stink Bug,,12,2
2 days ago,On the list again!!!https://www.facebook.com/groups/766738593926772/permalink/905943423339621/,rujohn,,0,0
2 days ago,Keep up our sleeves fellas! We have all the ACES!.. BUY , HOLD &amp; BUCKLE UP..... Don't be swayed for a small movement or stagnant SP at this time...Harvest season would come when its due and WE are so ready for it! Won't be selling under 2 digits at all...Enjoy the weekend everyone and be glad you are a part of this process!... We will be rewarded...,ape,,0,0
3 days ago,https://www.reddit.com/r/AskEngineers/comments/pljoyr/what_happens_when_a_power_plant_produces_more/?utm_medium=android_app&amp;utm_source=shareThis is a good thread about the different aspects of managing a power grid and gives numerous points where acdc batteries could be used to help offset and distribute the load.,NwZ,,4,1
3 days ago,If Ionix SmartWall can  be lower than the expected cost of the Tesla Powerwall everyone will want a piece of the pie!Cost of Tesla Powerwall in Canadahttps://kubyenergy.ca/blog/complete-guide-to-tesla-powerwall-in-canadaMore,Benjamin,,10,0
3 days ago,i can definitely smell the cse approval very soon!!!,Scammaz,,11,0
3 days ago,Easily worth $5,The Stink Bug,,12,4
3 days ago,They had some interesting insights about ACDC.CN on (http://Thetraderguide.com). Definitely made me think twice about the company.,busse,,2,6
3 days ago,Guys check the corporate presentation it is so good they are getting it going!!,The Stink Bug,,10,3
3 days ago,Wow I am getting drunk looking at the updated EV battery tech website and DAMN it looks good I wish the market was open so I could buy more shares RIGHT NOW,The Stink Bug,,10,2
3 days ago,Anyone put in a preorder for the 3 wheel car?,david,,2,1
3 days ago,,papa,,1,6
3 days ago,love the updated website!,MOLE,,9,0
3 days ago,EV BATTERY.TECH official website was updated, with more up-to-date information, cleaner and more friendly to navigate more than ever!,AboveEnergy,,16,0
3 days ago,DaymakWe are expecting to have a prototype this year, and we will provide development updates this month as well!,rujohn,,12,0
3 days ago,evbattery.tech Check Acdc new and improve website!!!,rujohn,,0,0
3 days ago,Good news this week I hope going forward we can break this sideways cycle to the upside I like to see more proactive PR from management As soon as the unit is installed and running there should be a independent interview with the Owner And let us know why this unit? what does he see as benefits over TESLAWord of mouth is the best promotion and it will go wild People can not wait for competition against TESLAMore,Kees,,10,0
3 days ago,AMAZING week everyone. We got some MASSIVE news pertaining to what the future looks like for ACDC. All the pieces are coming together and we will LAUNCH and BLOW UP in the coming weeks. September 30 baby!!!!!!! Have a massive weekend CHEERS!!!!!!!!!!,The Stink Bug,,6,1
3 days ago,... it's so sloooow.,Ola,,0,0
3 days ago,Well, up to 350,000 shares now. I am done buying for now.  Going to focus on some other plays for a bit! Take care of our baby and let's make this explode! Have a great weekend everyone!,John,,15,0
3 days ago,There is no way Daymak just found acdc and thought of making an EV all of a sudden in Feb 2021. Then suddenly acdc bought rights from daymak to make their own EV.I am now starting to think ( especially with this barcoding) that acdc and Daymak is just a small part of a bigger play which is yet to be disclosed. We cant go wrong about this stock. Hold it and you will be rewardedMy 2 centsMore,J.S,,27,0
3 days ago,come on!... fill-up my order..still have a balance of 22.5k @ 0.255....😊,ape,,7,0
3 days ago,The 9 Best Stocks Under $1 To Buy Right Now!  For more info https://youtu.be/dBtR3sa2Th8,kotoff,,3,1
3 days ago,not much trading, why?,Supercalm,,3,0
3 days ago,Please, set my notifications for Massive, Huge, Launch, Moon, and OOOHHH BABY!,jmclbos,,4,1
3 days ago,Holy #$%$ it went to .2650 look out Stink she's gonna erupt....new fridge box condo on the way soon !,Jim,,5,2
3 days ago,Just started a new job and I'm ready to dump into this, I see it hitting $1.50 March 2022 with ease. load up the truck with these shares,sebastien,,9,3
3 days ago,Literally a pump and dumpers stock at this point,cameron,,2,12
3 days ago,$2.75 coming soon. Jump in NOW,Dr.M,,11,2
3 days ago,A new remodeling tip ... Heart Monitor Wallpaper!Just trying to lighten things up here gang!,Steven,,0,0
3 days ago,Two great news releases this week. So many potential catalysts over the next few weeks with the big one being September 30th when preorders wrap up with Daymak. This is just going to be  insane I can’t wait. We will hit $1 soon for sure. Just a matter of time.,The Stink Bug,,8,4
3 days ago,We will break from this holding pattern soon. Rest assured! It’s Friday baby and we got MASSIVE things coming up for ACDC !!!!!!!!!! Gonna be huge!!!!,The Stink Bug,,10,4
3 days ago,Its Friday! This one goes out to all my Canadian ACDC friends! https://m.youtube.com/watch?v=rtMR524m0BM,Noiz,,0,0
4 days ago,Just googled ”how to buy daymak stock” and found they were looking for a investor in Nov 2020, what if acdc is the investor they are looking for?,linlin,,2,2
4 days ago,New app for acdc,singh,,4,0
4 days ago,Almost launch time,The Stink Bug,,7,2
4 days ago,I sure appreciate the work Noiz puts in. I am getting pretty lopsided with Acdc in my portfolio. this company gets more intesting every month. like I may win a frigging car in a while .... that be cool ... I feel if they were not as serious as a heart attack about their products ( with Daymak helping ) they would not engage in a very precarious legally binding effort as a lottery.  this would be a weird way of pumping and dumping agreed. anyway  August was predictable and slow - as usual with most stocks - Sept is when peoples start getting serious about trading ... I hope the shorts see this as well - longs are as greedy as shorts no doubt and the world goes round and round .... but ACDC has some sweet ideas and 98% sure they got all their ducks in a row to .... oh ya - blast the frig offMore,allenandyvrsl,,22,0
4 days ago,They had some interesting insights about ACDC.CN on (http://Rightpicker.com). Definitely made me think twice about the company.,pascocello,,3,7
4 days ago,You know, I still think that Daymak may be completely partnering with acdc. Just a guy feeling. If they do I sure hope that they do it in a halt style rather than a pr. I love it when a stock halts!,John,,14,1
4 days ago,Almost time,jesse,,12,0
4 days ago,Wow, lots of despair and desperation out there ... this is National Suicide Prevention Week through September ... https://www.sprc.org/.  Hang on!,jmclbos,,8,2
4 days ago,I think if you have a sell order in for your shares, they can't be shorted. Just, set a 90 day sell order for 5 bucks. I remember that, working for other stocks I was in before like BES,Justin,,16,1
4 days ago,Forum member, Above Energy posted earlier today: i hope the 700.000 was not bought to further short the stock. What can be done about this from our side as the investors is to call the brokerage where you buy your shares and make sure or ask them how you can make the settings on your account to be sure your shares are not being borrowed out by your own broker to short this stock or any other stock that you own. I called my own broker today and made sure of that. 🐘,Noiz,,0,0
4 days ago,I don’t understand the 0.05 up and down we have been doing for weeks. Is this just computers swapping shares or what?,The Stink Bug,,4,0
4 days ago,HEAT jumped more than ACDC,J,,2,1
4 days ago,I guess story time? Because i dont know what else to say at this point...The MMAT connection and the possibility that MMAT are looking to buy out ACDC. These are not my thoughts, but have been brought up on Reddit MMAT forum because the CEO of MMAT George Palikaras posted a cryptic message about the rockgroup ACDC this theory was also brought up by Youtuber Terry Younker that thinks ACDC is a good match for MMAT and that it is a intresting company overall even without the MMAT connection. My THOUGHTS on this intensified today when we once again couldnt brake upwards even though we had nothing but good PR the last 2 months and keep repeating the sam barcode pattern. MMAT have this year merged with a company TRCH. The reason for this was that MMAT wanted a "shortcut" to be listed on Nasdaq. Another reason was that TRCH was heavily shorted and the CEO of MMAT seem to really dislike shorters and have publicly stated we are going to Torch the shorts. Since then MMAT have bought out a Nano technology company to incorporate into MMAT. I have heard that the nano company was also shorted but iam not 100% sure of this. Could this be the reason we are in this seemingly infinite cycle we have seen the last 2 month's? We are a company that is a good acquisition for MMAT and fit their buisness and as we all suspect are also heavily shorted. I have said before it feels/seems/look like we are being shorted and accumilated in the same time. I cant explain the endless cycle any other way. Is ACDC a part of CEO George Palikaras plan to torch the shorts? I dont know... and honestly i dont give a 💩 even tho i own alot of shares in both companies. Because at end of the day the result will be the same for both companies WE ARE GONNA LAUNCH, BRAKE THE STRATOSPHERE AND FLY TO THE MOON!!!! 🚀🐘More,Noiz,,0,0
4 days ago,Great announcement = nice bump...........NOPE,J,,1,1
4 days ago,The 8 Best Robinhood Stocks To Buy Right Now!  For more info https://youtu.be/kCI5aa2-CIo,schwendemann,,2,3
4 days ago,Get our FREE GUIDE today to help better protect your retirement!&nbsp;(http://Irsredalert.com),vandewater,,3,5
4 days ago,Sitting on the edge of my seat waiting for this one to skyrocket!,JG,,9,0
4 days ago,LETS GO!,The Stink Bug,,11,1
4 days ago,The company has to show Revenue.,Everton,,16,1
4 days ago,Nothing moves this stock ! Holding the bag over 6 months, 5000 @ 0.60 !!,Purvi,,7,3
4 days ago,So I'm thinking I should YOLO it on ACDC. What you guys think? I know, " thats not financially responsible" but hey whatever it could be fun lol,Feelya,,8,0
4 days ago,What is the point in the smart wall?,Diamonds Only,,0,2
4 days ago,they are building the hype,Mathieu,,0,0
4 days ago,Can’t believe how manipulated this thing is,The Stink Bug,,5,0
4 days ago,Closing at $0.28 today. Massive volume already.,Chicken Man,,13,3
4 days ago,Let's just hope the 700k shares wasn't bought to short the stock 🥺,AboveEnergy,,5,0
4 days ago,Anyone looking for price predictions, just take a really good look at the private placement. .50, $1.00, $1.50. Daymak pre-sales  pretty easy math  not including all other products and inked deals!,John,,15,0
4 days ago,Let’s launch!!!,The Stink Bug,,8,0
4 days ago,This is all in anticipation for the Daymak announcement of $1bn in pre orders. Watch this go KABOOM!,Tony,,0,0
4 days ago,Shorties better cover! Your wives are going to leave you for the winners ;),Feelya,,7,0
4 days ago,The same thing happened with the Tesla truck. All these nr’s but no actual product. Then delays. Then competition with actual products available ink deals with major companies. Continued nr’s with small tidbits will prove to be useless. Have your product out, on shelves and selling. Then do your massive pr on how great it is.More,Scott,,4,7
4 days ago,Interesting I didn’t post anything yesterday about big news or launching and we got news today. Maybe I should shut up,The Stink Bug,,13,0
4 days ago,On a licensed basis too!,Damond,,7,0
4 days ago,Sweet, another piece of our puzzle fits in:) good luck to all the real shareholders here👊,Jesse,,12,0
4 days ago,Almost every week there’s a PR and this is 2nd update in a week . Wow I really don’t understand why the price is 0.26 . So undervalued . If not more at least it should be $2-$3.,Arry,,28,1
4 days ago,"Smart Command'...........a patented product licenced to end users providing ongoing revenues. This and all the other products in the acdc suite and we're languishing at the ridiculous .26..........something must give and soon!!!,J,,9,0
4 days ago,Again... It's All Written On The Wall!...Too bad to those who can't see or try not look at it at all....,ape,,9,0
4 days ago,When is the 'big' money going to become convinced and begin thinking...........okay, dollars aren't rolling in yet BUT we've seen enough, this company has laid enough groundwork. this company's products are for real, this company is right in lockstep with the EV revolution. You reach a point where you wonder what does it take to get this thing flying?,J,,12,1
4 days ago,The Smart Command system and App will first be launched on the IoniX Pro ESS products and will then be offered on all ESS products on the market. EV Battery Tech intends to offer the Smart Command system and App on a licensed basis. This is what i have been talking about. Here you find the real profits. Selling and license TECHNOLOGY, BLOCKCHAIN SOLUTIONS, CRYPTO MINING CARS, Meta Data... confirmation of this is bigger then Product sales to me. Because this product/s are more profitable, cost effective with bigger profit Margins! 🐘,Noiz,,0,0
4 days ago,https://ca.finance.yahoo.com/news/ev-battery-tech-presents-smart-110000088.html,Matt,,6,1
4 days ago,You gotta love it!,The Stink Bug,,9,0
4 days ago,Breaking: EV Battery Tech Presents the “Smart Command” Blockchain System and Application for IoniX Pro Products,ARKS,,0,0
5 days ago,will they be opening private  distribution for some of their product - would it be regional or national - some of these products will be on the leading edge of a battery future,allenandyvrsl,,8,0
5 days ago,Well manipulation you just can’t beat unless you have a big pocket book…just saying!!,David,,2,0
5 days ago,Need more updates than that Chicken man,David,,0,0
5 days ago,Go take out a calculator and type $894,678,666 x 0.3. Explain to me how you can short or bash this stock.If you don’t know why that calculation is relevant, you shouldn’t even be investing here in the first place. Happy Wednesday ACDCians. It’s almost September 30 and I’m licking my chops.More,Chicken Man,,0,0
5 days ago,I have had enough of this manipulation. DailyChart looks like a heart rate monitor,The Stink Bug,,7,3
5 days ago,ugh cant get my .25 order filled,shawn,,2,0
5 days ago,ACDC: Your 2021 Year End Price Range Prediction? Comment below...,ape,,11,0
5 days ago,Actually iam to tired for story time right now... I Will tell the story later. I just leave some information right now... Got Fintel today, thanks to Jesse i finally did it... AUGUST 6 2021 AVAILABLE shares to SHORT 650.000. AUGUST 31 = 500 SHARES TO SHORT. And this is Only what i can see on Fintel. Fintel doesent have all the data... But since August 31 there is no more shares to borrow from big institutions and cost to borrow keeps climbing. I Will put this and more into perspective later, iam to tired.Think i bought 10.000 shares today... 🐘,Noiz,,0,0
5 days ago,ARE YOU READY!!! I SAID ARE YOU REEAAADY!!! ITS STORY TIME! :),Noiz,,0,0
5 days ago,jesse is manic today, so many posts. Meds are in the left cabinet Jess.,Scott,,1,2
5 days ago,This #$%$ looks like a heart monitor.,andrew,,6,0
5 days ago,Its a "RED " day all across the North American markets. Hopefully we hold even, if lucky. My portfolio is Bleeding red.,Bill,,3,0
5 days ago,If luminor still owns over 34 million shares then we are golden,Jesse,,2,0
5 days ago,rujohn they still own over 34 million and that info is up to date?,Jesse,,1,0
5 days ago,That's how many they did own, who can tell me how many they own now,Jesse,,0,0
5 days ago,Cmom people who can tell me how many shares luminor own,Jesse,,0,0
5 days ago,Anyone getting one of the cars when they come out? Or power walls?  I am leaning towards the car .  Just need a few technical questions answered and I will decide .,david,,2,0
5 days ago,They should be the majority shareholder,Jesse,,1,0
5 days ago,Can anyone show me how many shares luminor owns in acdc?,Jesse,,2,0
5 days ago,Beat advice I got was “ only buy stocks that will change and improve people’s lives. “. This stock fits the bill very well .  The management team has been very on point with their deadlines and promises which also points to a good team .  I will stay locked .  Hell if I can sit in a field for a weekwaiting for a perfect picture of wild life I sure as hell got the patience to sit right here .,david,,5,0
5 days ago,have they installed the BOX yet.....any more pics of the gocart ?,Jim,,2,1
5 days ago,Patience everyone,Brown,,6,1
5 days ago,Well i showed some of my shares... Iam real still got 100K at 1.49 cad to take away 200K it was making me uncomfortable for that to even be possible to lose at 1.49. Things are heating up and i just want EVERYONE to know... NO MATTER WHAT THEY DO IAM NOT LEAVING! NOT ONE SHARE THEY WILL TAKE FROM ME! I WILL BUY MORE! AND LET THEM SUFFER! WE WILL WIN AND WE ARE CLOSE! 700.000 SHARES AT 0.26 GIVE ME A BREAK... GO AHEAD AND SELL! BUT IF YOU THEY ARE IN SUCH A HURRY TO SELL 700.000 WE CAN DO THE DEED AT A LOWER PRICE YOU ARE GONNA PAY ME!!! IAM NOT LEAVING!!!🐘,Noiz,,10,0
5 days ago,Noizz i sent you a message,Jesse,,3,0
5 days ago,Price is going through the roof....,Jim,,2,2
5 days ago,They can’t hold us back much longer,The Stink Bug,,6,0
5 days ago,Picked up another 10,000 this morning.  Busy for the rest of the day! Good luck all,  keep buying and hodl if you can! Our time is near. Don't sell for under $1 and let your profits ride for a couple years.  This has the chance to change your life!,John,,10,1
5 days ago,Daymak preorders are 894,678,666.666 at the end some kind of a sign?,Tony,,5,0
5 days ago,So before Trading starts today, JUST remember they had to short 87% on the USA side yesterday to keep it down.😂😂😂 AND if you want to know if  Uncle Noiz is a shorter or not come såg hello at 1.49 today were some of my shares Will be on display 🤓🐘,Noiz,,0,0
5 days ago,Someone is deleting my posts,Jesse,,3,0
5 days ago,Noizzz how do i message you directly?,Jesse,,4,0
5 days ago,I can't,Jesse,,1,0
5 days ago,Who can find how many they own now?,Jesse,,2,0
5 days ago,They owned 34,704,000,Jesse,,3,0
5 days ago,They had around 27 million, I'd have to find the exact number,Jesse,,3,0
5 days ago,Those are the only shares that we need to keep track of for what is happening in the company. I'll tell you all why at a later date,Jesse,,1,2
5 days ago,Can someone please check how many shares luminor owns in acdc right now? I know what they owned a couple months ago and want to see if it's the same,Jesse,,2,0
5 days ago,Daymak Presales $894 million +,Jesse,,19,1
5 days ago,The time to reveal who i really am has come... Some of you might have figured out by now that my real name is not NOIZ... my real name is ALDOUS SNOW and i used to be a singer in a rock band... Unfortunately because of accident (tried to jump from a balcony into a pool...) and getting tinnitus from all the concerts, i was forced to quit music and started to trade instead. With everything going on lately with this stock i was thinking of a song that we opened our last performance that we ever played. Link to the video from that concert: https://m.youtube.com/watch?v=bGDQ-4uK6SE I think the first song really fits with whats going on with ACDC and i hope it will share you up ;) Thank You.More,Noiz,,0,0
6 days ago,https://stocktwits.com/Luckycloud9/message/377185560,NwZ,,4,0
6 days ago,We are gonna blast off this month,The Stink Bug,,10,0
6 days ago,So people really think Daymak or their CEO is stupid to make a partnership with a company that has nothing??? Daymak doesn’t do dd or see their products before making a deal ???,HC,,17,0
6 days ago,todays 90 % of the seller were house 001 who is anonymous and latimer house  have a look on your level 2  if you don t have it go on ceo acdc on the left you we see   most of the time anonymous is shorter      you can see the last mouth also  somebody works very hard to keep it low,yann,,11,0
6 days ago,I have patience!!!! ACDC will fly!!!!,Groot,,23,1
6 days ago,This is so manipulated it’s ridiculous,The Stink Bug,,16,1
6 days ago,If today wasn't manipulation, I'm not sure what is.,Feelya,,17,0
6 days ago,Phew, I'm getting to my wits end dealing with these day traders disguised as investors who ask silly and easily answerable questions like "what does the company do', or" what's the specs on the smart wall?", both of which are easily available information found on the website. It's tiring and insulting.,NwZ,,7,0
6 days ago,@Stink Bug - Hey Bug, think about it this way, you remember the phrase "Crying Wolf"? The boy in the fable only got away with it twice, on the third time people ignored him, he was eaten. Your credibility is no where near as bad as that. I guess that speaks more about your followers than it does you, but I am trying to focus on the positive here,. Maybe if you could just call one thing right ... well keep trying!,Steven,,3,5
6 days ago,,JT,,4,0
