PostDate,Content,Author,RelativeDate,Likes,Dislikes
3 months ago,New reseller agreement! Waiting on JK to post the link haha!,Big Don,,0,0
3 months ago,@Massimo, you’re correct. And for everyone else who doubts, here is my view &amp; why I invested. When I invested in this company several months ago, the company wasn’t profitable but I did my DD, read a lot about the company and liked their technology and what they do to make it profitable, so I invested in future growth. At the investor meeting, I believe, in August, Larry said they expect to become profitable by the end of this year and as early as September, and he was right, they had good Q3 results. Since then, they have done a great job and are rapidly expanding their customer base. Some of you know, and some may not, they have some big clients, but they have NDAs with them and for that reason they are not allowed to disclose or market some events in which their technology is used. You have to be patient with this company, they are on the right track, and if not earlier, I believe the price will start to rise after Q4, which I expect will be very good, it should be sometime in January. I agree that they should be more involved in marketing, but remember that just one event with proper exposure would make it fly.... I had the opportunity to sell it several times with a profit but I didn’t and I’m not selling because I believe in the company and I believe in their potential. It’s now sitting at my average &amp; even had some drops below my average but I’m thinking of buying more….This is my reason why I’m invested but if you are in doubt &amp; don’t believe in the company, just move to something else at the first opportunity….More,JK,,7,0
3 months ago,They did say they would be profitable in September however we have not seen anything let’s hope that the presentation will be over the top and people will be interested in their product￼,Massimo,,2,0
3 months ago,Join the stock fam discord! Positive investor conversation. https://discord.gg/Q6EtEXrS,Insight,,1,0
3 months ago,i hate to say but this is a dog and not going to move for awhile , at least until they have some good news come out and i mean good,Huey,,1,0
3 months ago,Wouldn’t it be nice if this thing up list to the TSX at some point,Massimo,,5,0
3 months ago,I say be patient this is an excellent product for corporations Stocks should at least be a five bagger soon￼,Massimo,,5,0
3 months ago,It's time for our sleepy gem to start waking up, let’s hope for good publicity at next week's WISeKey &amp; Arht Media event, and there's a third party as well…If anyone is interested, registration is freehttps://twitter.com/WISeKey/status/1334812103358599174,JK,,7,1
3 months ago,Absolute Dog Sh/t Stock.. Yea, only a matter of time before you lose 80%. Don’t waste your time or money on this debacle of enthusiasm. Not a word from the “INCREDIBLE” management team regarding why this stock keeps falling. Shorts controlling any gains of momentum. Really tired of Blah Blah Blah, move on to the TSX, NYSE or NAS.. why not reverse split and get on the proper exchange? I know a lot of investors who share the exact same sentiments.,Graham,,3,4
3 months ago,2021 will be big for this stock. Only a matter of time.,Big Don,,0,0
3 months ago,this seems to be set to stay at 30 cents for awhile, no volume no movement no promotion. means no money for stock holders. thankfully its only 30 cents,Huey,,6,0
3 months ago,What happens with this stock ? It looks like the same guy who’s buying and selling to himself,man,,1,0
3 months ago,Guys also check out ip.cn as its gonna skyrocket,Stock Analyst,,3,5
3 months ago,So tempting to Get 30k share with available funds. Or buy more EXRO.... hmmmmm bullish of both forsure. Not quite sure. Art is very interesting though,Donye Wump ||,,0,0
3 months ago,An interesting article on an up-coming first: The First-Ever WISeKey TransHumanCode Holograminar on December 14 at 3:00 pm CETThe event organized by WISeKey and ARHT Media will use holograms to connect speakers from Geneva, Toronto and New York to demonstrate the future of live events.https://www.wisekey.com/press/join-the-first-ever-wisekey-transhumancode-holograminar-on-december-14-at-300-pm-cet/More,Centro,,0,0
3 months ago,finally creeping back up to my average. can't wait to see proper gains!,Natalie,,7,0
3 months ago,This is gonna be about $3 dollars by the end of august next year.,Stock Analyst,,6,1
3 months ago,chart looks like a bat,DJ KINGS,,2,1
3 months ago,Just to update you with smth interesting that is a theme on another board. Our CEO Larry reached out to Bill Gates. Cannot post a link because its his direct comment on Bill's post on LinkedIn, but you can check it.,JK,,5,0
4 months ago,It smell like Wimi 🧐,gilles,,3,0
4 months ago,Ok I want to buy can somebody tell me what this is and where it’s going? Corey help me out. Also Check out EXRO.V,Donye Wump ||,,2,1
4 months ago,One day Will have this product at home ..  ( like computer),gilles,,4,0
4 months ago,I hope the company has patents... because China is going to rip them off.,This.is.me,,0,1
4 months ago,This will be one of the best investments in 2021!Drop the mike!,Corey,,4,0
4 months ago,Any star trek Next génération  fans ?:),gilles,,4,0
4 months ago,A history lesson on ARHT Media, if interested. I stumbled upon the biography of Paul Anka, singer &amp; actor. He is a co-founder of Arht Media &amp; in recent years he was on the Arht’s Board of Advisors (not sure if he’s still there, hope yes).  https://conandaily.com/2020/11/27/paul-anka-biography-13-things-about-singer-actor-born-in-ottawa-ontario-canada/,JK,,2,0
4 months ago,Finally,Younes,,0,0
4 months ago,,DJ KINGS,,4,1
4 months ago,Just bought in today.   This is going to be huge,  Holopod, Wow!Real time conversations hologram.Someone slap the moron basher who puts down an amazing investment oportunity like this.WOW, WOW, WOW!More,Corey,,5,0
4 months ago,We have another PR: ARHT Media and WISeKey TransHumanCode Holograminar will be held on December 14 (and again I can't post link).,JK,,5,0
4 months ago,Are these debenture extensions a good thing or bad?,larchwood23,,0,0
4 months ago,Here is another article published on Stockhouse that gives more details on how the Arht's Media HoloPresence Display will be used at universities in China. Like @max said in his post below, this deal has just opened a big door.ARHT Media’s HoloPresence enters Chinese universitieshttps://stockhouse.com/news/the-market-herald-news/2020/11/25/arht-media-s-tsxv-art-holopresence-enters-chinese-universitiesMore,JK,,8,0
4 months ago,This Company is getting drunk on dilution.    Normally, I like my companies to grow on their own.    But this company Is begging to be bought or merged.,Scott P,,2,0
4 months ago,This is, so far, one of my few loser stocks, normal to own few bags in a trading career, but I must admit, today's news is a very important and reassuring one.  It's actually a very big deal news.  A big door just opened, at last.,max,,8,0
4 months ago,This crazy board doesn't show my post, we have a new PRArht's strategic partners order six HoloPresence Dispalays for Universities in China,JK,,4,0
4 months ago,Picked up some more. Not worried one bit. Stop day trading this. Come back in a year.,SuperBro64,,6,0
4 months ago,I was right about some one shorting cuzz at 3:55 pm yesterday there was a buy order of 1.19 million and it was NOT filled so at some point today probably at end of day that order will try to go through again load up boys,Ride what,,7,0
4 months ago,Do something please 😦,Younes,,0,0
4 months ago,down 4 cents already, there is more going on here then what we are aware of. not good. good luck to you all as i am taking my losses and leaving,Huey,,0,1
4 months ago,I just now noted today’s volume of 1 mil., this is well above the average, any thoughts? We had a big drop today but than a sort of recovery,JK,,3,0
4 months ago,Finally got a buy order filled after trying for six days, thanks to whoever threw in the towel on 17,000 shares. Been here since the spring and have been adding every time there is a substantial drop. Got into nexcf at .47 and currently up well over 1000%, expect the same here if you can stomach the ups and downs,BBD‐WBN,,4,0
4 months ago,I smell a tax write off coming...disappointing stock,Patrick,,0,0
4 months ago,What is going arht media !!,Jay,,1,1
4 months ago,and First Holograminar organized by WISeKey and ARHT Media Inchttps://www.wisekey.com/wisekey-webinar-first-holograminar-organized-by-wisekey-and-arht-media-inc/,JK,,2,0
4 months ago,Almo is working hard to advertise Arht, this should be noticed very soon. There is another article published today, but I cannot post it (again). Just google: Can Hologram Technology Help Us Be More Present in 2020? Almo and ARHT Think So,JK,,2,0
4 months ago,ugh, earlier I thought it is just market rotation based on vaccine news. This drop is bad though :( I added some nevertheless. The reception of the black excellence awards was very good on twitter. The virtual stage and the Holopod are really remarkable products. GLTA,Tobias,,0,0
4 months ago,This is just short term noise. We'll have a much different picture after Q4. I envy those getting in at these prices.,Big Don,,4,0
4 months ago,Only have 2800 shares but still what’s going on?,OGG,,1,0
4 months ago,price dilution. to all the ppl shorting this dont forget to buy all the shares back,Ride what,,1,0
4 months ago,I?m down 50k on the #$%$,a,,2,0
4 months ago,Management needs to do a better job and also need to realize that their best potential might be to partner with a larger player with the resources that can take the company to the next level.,larchwood23,,5,0
4 months ago,hate to say but i think its going lower, tax season coming,Huey,,1,3
4 months ago,Down 30% but still believe in this long!,OGG,,1,0
4 months ago,Not sure what's happening, there is no real reason for the price to go down, maybe debentures and options are drawing it currently down.,JK,,6,0
4 months ago,What is with the share price dropping every day?Why doesn’t management chime in or provide some insight instead of lip service?,Graham,,2,0
4 months ago,This company is doing really well. Im surprised it keeps dropping. Needs a good catalyst and it can fly,Rafi,,2,0
4 months ago,something smells fishy. Are they losing money? or someone manipulating the price?,tyrone,,1,0
4 months ago,Whats wrong with this stock always red,DJ KINGS,,0,1
4 months ago,People gonna notice this little gem soon.  Priced right and huge catalysts coming via the way we work, conference etc,jon b,,3,0
4 months ago,Been trying to add to my position all week, no volume..we need fresh eyes on arhtf,BBD‐WBN,,5,0
4 months ago,maybe they should stop with the updates as the stock just goes down, when your at 30 cents and the market is booming its not a good sign,Huey,,0,1
4 months ago,@JK Thanks for your updates!  You are providing valuable information.  I'm just surprised this doesn't move at all.  The company is in a much better place than it was in July when the big spike in price &amp; volume occurred so it's confusing &amp; frustrating to say the least.  I'm ok with long term holds but not ok with keeping my money stagnant for this long.  Bloomberg BNN had a 2.50 price target on this which I find interesting...let's hope we start that journey up real soon!,larchwood23,,0,0
4 months ago,And we have a press release about the Black Excellence Awards but I am unable to post a link but I'll try to post tweet comments about it https://twitter.com/ARHTMedia?ref_src=twsrc%5Egoogle%7Ctwcamp%5Eserp%7Ctwgr%5Eauthor,JK,,5,0
4 months ago,Lol, I only see my posts here recently, but I don't mind providing updates. We might have a new partner https://www.meetingstoday.com/newsevents/industrynews/industrynewsdetails/articleid/34511/title/mind-blowing-holopresence-techand here is a video https://vimeo.com/477994628More,JK,,5,0
4 months ago,It's confirmed -  The 2020 Black Excellence Awards are happening online this year using ARHT Media's VGShttps://twitter.com/ARHTMedia/status/1328432866125025280,JK,,8,0
4 months ago,ARHT Media appears to be lobbying for a government contract. A new article was published today, but I can't post a link. Here are some paragraphs: "Toronto-based ARHT Media Inc. is hoping to get Ottawa to buy into its Holographic Telepresence Technology, a Star Trek-like innovation which allows people to attend meetings in-person as a hologram.""Working through an internal lobbyist, ARHT Media Inc. is pursuing a government contract for Holographic Telepresence Technology."More,JK,,6,0
4 months ago,Why isn't this stock trading? It's been frozen since Friday,T,,0,0
4 months ago,In addition to Nasdaq event, it appears ARHT's technology will be used for another event on November 17. I saw conversation about it on Stockhouse and this posted:Black Excellence Awards 2020 by JP Morganhttps://mobile.twitter.com/powerlistmag/status/1325970993500868609More,JK,,3,0
4 months ago,I just heard the news that children this year will only be able to have a video chat with Santa Claus so no pictures with Santa, and this made me thinking - ARHT Media would be a great solution for this (it's Friday evening but I had to post this). Here is a video they did with WestJet for last year Christmas. https://www.youtube.com/watch?v=ZGwT0lojFJY,JK,,4,0
4 months ago,Does anyone have any news about the Nasdaq event on November 17th. My search shows nothing but the September news release. I guess there should be some kind or registration for that? It's on Tuesday.,JK,,0,0
4 months ago,Wish I had more money left to buy at these prices again.,Big Don,,2,0
4 months ago,Hold. This is the future! 🚀📈👍🏻,Lawrence,,0,0
4 months ago,The investment advisor that I work for days this will be north of $10 in a year. I believe him. Bought some more.,SuperBro64,,6,0
4 months ago,@Anthony, it's not showing my reply, let's try this way. I would suggest you to watch a few videos before posting something like this, you can also check their website,JK,,3,0
4 months ago,"The HoloPod™ delivers the real life, two-way communication with no noticeable latency of our event HoloPresence™ display but in a plug and play cabinet that wheels into place and is operational in minutes.&nbsp;"  I'm sorry but this sounds like a special heavy wheeled computer with a screen we got rid of those 20 years ago. I hope the CEO knows what hes doing, maybe the reason Paul Duffy left arht and went to nextech,Anthony,,0,0
4 months ago,There is a new PR - HoloPod launch but cannot post a link, the board is broken today,JK,,2,0
4 months ago,ARHT Media Honoured as Best Use of Tech: Telepresence at Digie Awards at Realcomm 2020 in Coloradohttp://www.globenewswire.com/news-release/2020/11/10/2124015/0/en/ARHT-Media-Honoured-as-Best-Use-of-Tech-Telepresence-at-Digie-Awards-at-Realcomm-2020-in-Colorado.html“Other award winners included Microsoft, Amazon Go, Invesco and CBRE. In announcing ARHT Media Realcomm noted the innovative use of HoloPresence technology to virtually bring in speakers from around the world eliminating the challenges of time, distance and a pandemic – with a focus on doing so in a more user friendly and cost effective manner.”More,JK,,3,0
4 months ago,At least volume is up. A lot of investors averaging down today! Gonna take off soon,Ryan1,,4,0
4 months ago,stay-home tech down but AR has a big future,Koenraad,,2,0
4 months ago,What's going on here?,Big Don,,0,0
4 months ago,will open at 40cents on monday. Monday you will say I wish I loaded up on friday!!,Lawrence,,0,0
4 months ago,how does a stock continue to drop when the market has had 3 of the strongest days since April,Huey,,0,0
4 months ago,I thought the quarterly results were pretty good, company has good patents, and believe a huge wave of AR will propel business results.  Thoughts?,jon b,,5,0
4 months ago,One year hold from here. Let’s see where this goes...,Super Barrier,,0,0
4 months ago,I recently posted some Almo articles that might be of interest to new or potential investors in case they are wondering how ARHT technology works. There are three parts, but 2 were published at that time, so here is the third part:Part 3https://blog.almoproav.com/what-are-the-applications-for-3d-holographic-display-tech/and againPart 1https://blog.almoproav.com/now-is-the-time-for-hologram-technology-heres-why/Part 2https://blog.almoproav.com/wait-what-is-holographic-telepresence-technology-again/More,JK,,3,0
4 months ago,has this halted - no trades since 10;22 - est...why  no trading,Danny,,0,0
4 months ago,Are you guys ready for the meeting?,ALEX,,2,0
4 months ago,All this good news love it,Ride what,,3,0
4 months ago,New on ARHT Media Twitter - Property developer Tridel Condos recently used ARHT Media's Virtual Global Stage to launch one of their latest developments - MRKT(It's not allowing me to post the link.),JK,,2,0
5 months ago,Congrats to everyone for being here in the beginning, in the next few months apple should sell a ton of new iPhones, light a fire under the floundering nasdaq,  and we should rise with the tide,BBD‐WBN,,4,2
5 months ago,to bad we have good news but no movement, kontoor brands good news goes up 4 bucks this week. still like the stock,Huey,,1,0
5 months ago,In @.23 &amp; haven’t sold once...staying here Long time!,laurielg1967,,5,0
5 months ago,This product is so cool tho.,Terry,,3,0
5 months ago,I guess it would never cross .30 even after news,Karan karan,,0,0
5 months ago,To ART mgt: hey guys if you were selling product to China as your press release indicates, make sure you were not allowing them to reverse engineer and steal the technology.,Cale,,1,0
5 months ago,Excellent report.,Cale,,1,0
5 months ago,I am glad they finally mentioned the NBA interviews in their Q3 release"Continuing the growth of the channel sales strategy the Company added strategic partners in the US, Canada and Brazil, with the first activation from Digital Nation being the AT&amp;T 5G sponsored NBA playoff pregame interviews for both the East and West Finals on TNT and ESPN.",JK,,4,0
5 months ago,Q3 is out https://ca.finance.yahoo.com/news/arht-media-announces-q3-2020-123000181.html,JK,,7,0
5 months ago,Nice close today and volume spike at the end 😊,JK,,7,0
5 months ago,The whole market is down again and we are holding strong,JK,,3,0
5 months ago,Who needs Shatner?!! The five day chart looks like Batman!!,BBD‐WBN,,3,0
5 months ago,This technology is awesome !  Very excited for the near future. Yo, they should get William Shatner to show up like that at the next Trekker convention !  Could you even imagine !!!!,ian,,4,0
5 months ago,We are on the move, some larger buyings are happening for the last hour....,JK,,2,0
5 months ago,This is the standalone Holopod marketing video just posted by Arhthttps://vimeo.com/471512522,Sammy,,8,0
5 months ago,AGM on Nov. 4https://www.globenewswire.com/news-release/2020/10/26/2114299/0/en/ARHT-Media-To-Host-Annual-General-Meeting-And-Investor-Presentation-On-Nov-4-2020-Including-Live-Q-A.html,JK,,2,0
5 months ago,Link to the last Almo/Arht presentation high-res video. Enjoy!https://fast.wistia.net/embed/iframe/zmtli1dqzb,Sammy,,4,0
5 months ago,td ameritrade shows a news release after hours today that they have decided to extend the date of 2020 debentures by two months. what does this mean for investors and/or the companies outlook for the remainder of the year?,Aardvark Sherwin,,0,1
5 months ago,Here are some interesting articles for new or potential investors who may be wondering how ARHT technology works. There are three parts but 2 have been published so far. Part 1https://blog.almoproav.com/now-is-the-time-for-hologram-technology-heres-why/Part 2https://blog.almoproav.com/wait-what-is-holographic-telepresence-technology-again/More,JK,,2,0
5 months ago,I like that this board is not flooded with nonsense like Nextech and ImagineAR.  Very valuable information here!  As of now in the US, it is showing 500 shares traded?  Kim Bolton on BNN Bloomberg targets $2.5 so I hope he knows something with his discussions with management.  Also for some of the Nasdaq posts, I believe the minimum listing requirement is $4 so not anytime soon.  Unless of course they decide to do a reverse split to achieve the price.  Patiently waiting...,larchwood23,,0,0
5 months ago,shares will need to do much better to be on the nasdaq,Huey,,0,0
5 months ago,Any expectations on why they may apply to be uplisted on NASDAQ? I assume some time after Holopod is released, which is supposed to be within 30 days.,SuperBro64,,0,0
5 months ago,Here is the link - Kim Bolton discusses ARHT Media today at BNN Bloomberg https://www.bnnbloomberg.ca/market-call/kim-bolton-discusses-arht-media~2060728,JK,,4,0
5 months ago,Kim Bolton today on BNN Bloomberg - his 12 month target is $2.5,JK,,6,0
5 months ago,its about time, snail.,Pham,,1,0
5 months ago,who got the voting papers? what changed from previous board?,val,,0,0
5 months ago,268k on the bid12k total traded for the session so farDemand to buy is there, no sellers,BBD‐WBN,,5,0
5 months ago,If you missed yesterday's webinar, it's now available on demand at Almo's website. Next week we have another Almo's event - Fall 2020 E4 Evolution Oct. 27-29 in which ARHT media participates and is one of the sponsors. Scroll all the way down to see all the sponsors. https://e4evolution.com/,JK,,2,0
5 months ago,Senior VP Global Sales of Arht Media, Andrew Dorcas stated the following (rough transcript) during his Almo AV partners presentation:"as a matter of fact, we’ve had some really good conversations just on our outreach to various organizations. Ironically that we had CNN in for conversations and they were very impressed with our technology and what it could be. We are talking to different networks as well right now base on the success what we had done with the NBA ...",Sammy,,2,0
5 months ago,solid bottom, let's roll,val,,0,0
5 months ago,Almo is presenting ARHT in today's webinar. Here is another interesting article published on Oct. 20 about their partnership and ARHT's technology:“New Technology Sets a Higher Standard for the Virtual Experience Almo Professional A/V and ARHT Media, Inc. have an exciting new partnership and offering that could transform the landscape for digital meetings, events and hybrid/virtual learning. This new solution, in fact, could enhance almost any application in which a face-to-face interaction or presentation, prior to COVID-19, would have been the norm. The technology, developed by ARHT, is called Holographic TelePresence, and Almo is now the exclusive U.S. distributor for it. Through this solution, we can deliver a unique and highly engaging holographic display experience like never before.ARHT Media is the global leader in the development, production and transmission of high-quality, low latency hologram and digital content. Using proprietary technology, capture studios and standard projection equipment, Holographic TelePresence “beams” presenters into one or multiple venues simultaneously. You may also hear the technology referred to as HoloPresence, short for “holographic presence.” Presenters can be located anywhere in the world — they just need the equipment and access to the platform via the web. Along with a new hologram presentation platform known as the Virtual Global Stage, Holographic TelePresence enables hybrid events — with some participants attending remotely and some attending live.This solution completely amplifies virtual interactions, online presentations, and hologram services in a way that your customer has never seen. With it, organizations, advertisers, and event marketers can reach a proportionately larger audience and deliver a premium hologram presentation that goes well beyond the 2D video call. Meanwhile, presenters benefit by being able to use key aspects of natural communication, like body language, to deliver a more engaging message and experience to attendees.Even though we all miss that in-person interaction, it is no longer the only way we do business. The mass deployment of video conferencing solutions in early 2020 was a big step forward for AV — but video chat and 2D video conference software only scratches the surface of what’s possible. Holographic TelePresence brings prime-time to all of us and completely enhances the way we interact virtually.Read more about ARHT Media’s new Holographic TelePresence technology through Almo’s three-part blog series."https://www.commercialintegrator.com/communications/new-technology-sets-a-higher-standard-for-the-virtual-experience/More,JK,,6,0
5 months ago,$ARHTF $NEXCF Is Nextech uses Arht’s hologram technology?  Wonder if they will eventually merge with Paul Duffy being co-founder of the Arht hologram technology and currently President at Nextech.,larchwood23,,4,4
5 months ago,buy now before you miss the train... corona is not going away any time soon,val,,0,0
