PostDate,Content,Author,RelativeDate,Likes,Dislikes
5 months ago,Another article about Arht and Almo PartnershipVirtual Presence BY SVC STAFF PUBLISHED: OCTOBER 13, 2020According to Sam Taylor, “COVID-19 has taught us that even though we all miss that in-person interaction, it is no longer the only way to do business – and it has, in fact, given our industry the opportunity to tap into new technologies that increase the quality of the virtual experience and augment live events while improving productivity throughout the day.” He continued, “We have partnered with ARHT Media to bring this technology to our partners, specifically those focused on rental and staging as we know that ‘live events’ is currently one of the hardest-hit segments in the market. The technology is ready for prime-time and is poised to truly enhance the way we interact, both now and into the future.”Virtual Global Stage is a premium digital on-stage experience online that eliminates the need for a venue, travel or the gathering of presenters and attendees. With ARHT Media’s patented multi-point broadcast solution, multiple 3D presenters in lifesized proportions can be brought to a virtual stage, side-by-side as if all parties were physically next to each other while actually being in completely different locations around the globe. With Virtual Global Stage, panel discussions, fireside chats, training events, town halls, product launches and more can all be executed in a virtual environment like never before.https://www.svconline.com/industry/virtual-presenceMore,Sammy,,3,0
5 months ago,Any chance this could go up to $450? Need to pay off my lottery debt.,SuperBro64,,5,0
5 months ago,great to see articles but they dont seem to be to interested in moving the stock. July 27 hit 68 cents and then retracted to 54. since then it has sat in around 35 to 40.,Huey,,1,0
5 months ago,We'll see many similar articles, which is great for promoting ARHT.  Here is one - Founder and creative director of NorthHouse, Tom Bairstow about the Green Carpet Fashion Award https://www.lightsoundjournal.com/2020/10/16/northhouse-designs-revolutionary-show-for-the-green-carpet-fashion-awards-during-milans-fashion-week/,JK,,1,0
5 months ago,break out due, few more days,val,,0,0
5 months ago,1.25$ feels good after q4,Jay,,0,0
5 months ago,I found this video posted on the Stockhouse board - Backstage &amp; Interview with Livia Firth.She mentioned the use of holograms for their in person event next year.  https://m.youtube.com/watch?v=4CZVMenB5uc,JK,,3,0
5 months ago,Hi bagholders. Where is your $1 now bagholders,FluffMcGuff,,1,5
5 months ago,From the Stochouse article - Buzz on the Bullboards: Who’s Who in the Business of COVID "A newcomer to the top Technology Bullboards is ARHT Media Inc. (TSX-V: ART, Forum), a creator of digital human holograms (HumaGrams). In these times of social distancing, ART has developed a method to make programs like award shows go off like the large-scale spectacles that they are intended to be. ART announced recently that it had partnered with The Green Carpet Fashion Awards to help amplify the online awards show experience with holograms of celebrity presenters for their first-ever virtual awards ceremony that will be broadcasted globally.ART followed this up with news that it had captured The Mind Architect Peter Crone in ARHT’s LA studio and presented him holographically for a live fireside talk with Juniper Park\TBWA CEO Jill Nykoliation at Hotel X in front of a physically distanced select audience of the YPO Maple Leaf chapter (Young Presidents’ Organization)."https://stockhouse.com/opinion/buzz-on-the-bullboards/2020/10/15/buzz-on-bullboards-who-s-who-business-covidMore,JK,,4,0
5 months ago,i like you, but you're a snail.,Pham,,2,0
5 months ago,after today's rise in nexcf I am excited to be here,val,,0,0
5 months ago,I posted earlier that ARHT is attending  Almo's Fall Virtual E4 Evolution October 27-29, but in the meantime Almo is promoting ARHT technology on October 21https://twitter.com/AlmoProAV/status/1316015961938391042,JK,,2,0
5 months ago,Last chance to fill bag.,SuperBro64,,2,0
5 months ago,Volume a little bit higher but this didn't get the bump I was hoping for after the awards show.  Trying to be patient but feels like "dead money" for a while?,larchwood23,,1,0
5 months ago,Just did a segment on good morning america about the award show, no mention of the tech but any publicity that brings eyes to the event will help,BBD‐WBN,,1,0
5 months ago,Found a short video for the Arht Media Oct 8 Press Release. Not sure if it was posted before but I just saw it today on Linkedin. Happy to read all comments too!"Thank you, Peter, for “flying” to Toronto for a wonderfully provocative &amp; deeply compassionate talk. ""Thank you ARHT Media Inc. for your truly flawless hologram technology &amp; team, led by Andrew Dorcas.""Well this is the coolest thing I’ve seen in 2020 and so brave to move beyond the zoom shirt!.""Thank you, Kerry! I wanted to rise out of zoom. It’s a fantastic technology!""Exactly. People unanimously said they completely forgot Peter was not physically there. It’s wonderful to have another tool in our toolbox.""Very cool tech application that in itself opens up the multitude of ways to connect and communicate in a digital world."more ...https://www.linkedin.com/posts/jillnykoliation_tbwa-leadership-innovation-ugcPost-6720122972989997056-QLHwMore,Sammy,,6,0
5 months ago,So, did anyone watch the Green Carpet Fashion Awards?,SuperBro64,,0,0
5 months ago,Something is wrong with this board today, I tried to post a link to the Green Carpet Fashion Awards premiere several times today but my posts doesn't show, maybe someone else will be able to post. It starts in a couple hours,JK,,1,0
5 months ago,Someone I truly respect (based on decades of investment success) recommended this ticker to me. He said he expects this to jump in the coming days. I am assuming he thinks the Green Carpet Fashion Awards will be a boon for this stock. I won’t blame him if the price doesn’t go up but now my eyes are glued to this event and I’m dreading this long Canadian weekend.,SuperBro64,,5,0
5 months ago,Hi, I'm new here and thinking of starting a position. I like this company and technologies, especially during the pandemic.  Do you guys think this business can thrive post-pandemic? Any thoughts?,Nobody,,2,0
5 months ago,I wear jeans and tshirts everyday so I have no idea if this is a big event but hears hoping the celebrities appearing by way of arhtf tech are the level that get tons of media attention whenever they make appearances,BBD‐WBN,,1,0
5 months ago,https://www.globenewswire.com/news-release/2020/10/09/2106310/0/en/ARHT-Media-To-Beam-Holograms-Of-Celebrity-Presenters-To-The-First-Ever-Virtual-Green-Carpet-Fashion-Awards-On-October-10.html,Big Don,,3,0
5 months ago,https://www.globenewswire.com/news-release/2020/10/08/2105681/0/en/ARHT-Media-Beams-The-Mind-Architect-Peter-Crone-From-Los-Angeles-to-Toronto-to-Share-his-Insights-With-YPO-Maple-Leaf-Chapter.html,Sammy,,3,0
5 months ago,give us that body language!,Pham,,0,0
5 months ago,https://www.globenewswire.com/news-release/2020/10/07/2104931/0/en/ARHT-Media-Beams-CEO-and-Head-of-Sustainability-Integration-from-the-Netherlands-to-Spain-as-well-as-Online-to-Present-at-their-Sustainable-Investing-2020-Symposium.html,JK,,2,0
5 months ago,Sitting at 0.60 cents haven’t sold a share will be sitting on this one for a bit but I know it will pay out 🤷‍♂️,Jay,,3,0
5 months ago,I have learned to be patient with this stock. It's definitely not for people who aren't patient or can't have their money sitting somewhere without action. Just know that we are in at the bottom at a bargain and this company is doing big things. Hologram industry is growing and the management for this company is focused on long term growth. Recipe for success for those who are patient.,Big Don,,0,0
5 months ago,Ummm.. let’s stay high 30’s keep everyone happy 😃,Jay,,1,0
5 months ago,Hello.  Hello.  Hello.  Is there anybody in there ?   Just nod if.....Patience.,ian,,0,0
5 months ago,lets go ARHT,Pham,,4,0
5 months ago,Why cant this stock cross .30.,Karan karan,,0,0
5 months ago,New video posted Sep. 30, confirming launch of HoloPod (should be in October), see 3:40 markhttps://m.youtube.com/watch?v=KSrIy_Ws6kQ,JK,,4,0
5 months ago,If they want to keep the tech "secret " fine but at some point I'm going to put my money somewhere else. Been trying to add to my position for 2 days and can't get a full.  We need higher volume and that at&amp;t/nba story would have done it,BBD‐WBN,,0,0
5 months ago,Interesting read published today – Viewpoint: Sammy Andrews on the future for live music She shares her views on how the pandemic has advanced the use and reliance upon technology. She mentioned various events, but also said: "One is the forthcoming Green Carpet Fashion Awards on October 10. This truly pioneering show will combine cinematic footage with a fusion of augmented reality and visual FX, created using real-time game engines, and will have talent appearing as holograms. The companies behind this are no strangers to the music industry. Veteran show producer Kim Chappell has brought together an incredible team including UK music industry leaders NorthHouse for show design, visual FX and graphics and ARHT Media for holograms, a company I know many of you are familiar with for legacy touring."https://www.musicweek.com/opinion/read/viewpoint-sammy-andrews-on-the-future-for-live-music/081346More,JK,,3,0
5 months ago,Go arht go,kai,,2,0
5 months ago,moves like ntar,val,,0,0
5 months ago,Green Carpet Fashion Awards promotion is startingGCFA website confirming the world’s leading talent will appear as holograms courtesy of ARHT Mediahttps://greencarpetawards.cameramoda.it/invitationIt's also on all ARHT's social media, here is Twitter https://twitter.com/ARHTMedia?ref_src=twsrc%5Egoogle%7Ctwcamp%5Eserp%7Ctwgr%5Eauthorand we'll see much more in the upcoming daysMore,JK,,6,0
6 months ago,ImagineAR stock symbol IPNFF wants to take AR mainstream and I think they have a good chance especially if they continue landing pro sports deals, the general public usually follows, the website is next level, I honestly  feel like  this is the company to invest in for the next few years. No other company has gotten close with AR  and with 5G around the corner, The AR sector will Explode! GLTA,idris,,0,0
6 months ago,what happen to this company ? No trading ? what's going on ?,Mahesh,,0,0
6 months ago,I can see what the CEO was saying about companies wanting to keep their use of this tech a "secret" so they can maintain "an edge" on their competition. tough for constant PR's when this is often the case. soon enough, though, everyone will find out! I'm thinking the Green Carpet Fashion show is going to blow folks away,Aardvark Sherwin,,0,0
6 months ago,This company if any of you have even watched the interviews is insane. Just need lower prices!,kai,,0,0
6 months ago,This company was trading at $5300.00 in Sept 1996...what did they do back then?,laurielg1967,,0,0
6 months ago,Crazy.  Another day when my position size is bigger than the volume for the day.  I still LOVE this technology. And this company.   Very well positioned for a future move.  It's my little lottery ticket.,ian,,0,0
6 months ago,Check out that volume!!!,Ryan1,,0,0
6 months ago,ARHT Media Beams Research Professors from Greece, Australia and Germany onto the Virtual Global Stage for a Presentation at the ERS Online Conference 2020https://www.globenewswire.com/news-release/2020/09/28/2099887/0/en/ARHT-Media-Beams-Research-Professors-from-Greece-Australia-and-Germany-onto-the-Virtual-Global-Stage-for-a-Presentation-at-the-ERS-Online-Conference-2020.html,JK,,6,0
6 months ago,https://www.smarteranalyst.com/new-blurbs/echelon-wealth-partners-sticks-to-its-buy-rating-for-cloudmd-software-services-docrf/,Jimmy,,0,1
6 months ago,I agree with @larchwood except it doesn't need a little bit more exposure, it needs a lot more. Confident it will happen but this week it looks like ipnff sucked up all the ar money,BBD‐WBN,,0,0
6 months ago,where is the volume? my td ameritrade shows only 9,673 trades today - after a great PR! i'm hoping that the still-unnamed September event, as well as the fashion show bring us some great publicity....speaking of, whatever happened to that September event with TLC?,Aardvark Sherwin,,0,0
6 months ago,Just found this - Huge Demand of Hologram Entertainment Markethttps://prnewsportal.com/uncategorized/78891/huge-demand-of-hologram-entertainment-market-2020-2027-by-top-key-players-musion-das-hologram-ltdav-conceptseon-reality-inc-arht-media/,JK,,2,0
6 months ago,Why is the volume non-existent?  Great product, company, and leadership but needs a little bit more exposure to the investment community perhaps?,larchwood23,,2,0
6 months ago,In today's PR:  "As part of piloting the new initiative, the International Congress and Convention Association (ICCA) broadcasted the opening session of their 2020 Association Expert Seminar from Marina Bay Sands’ new hybrid event stage on September 23, 2020. Beaming in Mr. James Rees, President of the ICCA, from London to Singapore using ARHT Media’s HoloPresence technology to join a panel discussion on Digital Transformation."The potential exposure is so huge as ICCA membership comprises 1172 CONFERENCE/EVENT companies and organizations in 92 countries and territories worldwide! Here's a full list: https://portal.iccaworld.org/member-suppliersMore,Sammy,,0,0
6 months ago,https://www.globenewswire.com/news-release/2020/09/25/2099281/0/en/ARHT-Media-s-HoloPresence-Technology-Utilized-By-Singapore-s-Iconic-Marina-Bay-Sands-Hotel-As-Part-Of-Their-Innovative-New-Hybrid-Event-Stage.html,Sammy,,11,1
6 months ago,Should be a run up tomorrow !!,OGG,,1,0
6 months ago,Let’s go arht good to see green. Finally.,kai,,3,0
6 months ago,is this stock halted form trading?,B.,,0,0
6 months ago,Is it a buy today?,OGG,,2,0
6 months ago,https://www.cantechletter.com/2020/09/arht-media-stock-is-worth-a-look-this-portfolio-manager-says/,JK,,1,0
6 months ago,ARHT big short squeeze happening at ipnff right now!!!!!!!!! we need support to bury these lying shorts!!!!!,Ben G,,3,0
6 months ago,Why is arht tanking ?! #$%$ shorts,Jay,,0,0
6 months ago,Green carpet fashion show in Milan oct 10 2020 .  ART technology,D,,0,0
6 months ago,Still holding strong. Red across the board.,Big Don,,0,0
6 months ago,Why all the ipnff pump?  Are they going to issue shares or something?  Usually happens when theyre ready to dilute.,Sams,,0,0
6 months ago,Let's get back to Arht Media theme.... https://www.youtube.com/watch?v=7aPMEYTeZqg&amp;app=desktop,JK,,5,0
6 months ago,Check out ImagineAR ($IPNFF)!  I know most of you are in it already but its launching hard!  Big news Thursday!  They have enough cash, an incredible management team, and now big deals incoming!  Do your DD!!!  It's still a great buy even after this run up!,Danielle,,0,0
6 months ago,Want a cheap stock look at ImagineAR IP or IPNFF great company do Ur own DD you won’t regret it this stock is very undervalued,Zman,,11,0
6 months ago,Kim Bolton discussed Arht Media - Bloomberg todayhttps://www.bnnbloomberg.ca/market-call/kim-bolton-discusses-arht-media~2039905,JK,,8,0
6 months ago,Arht GOGOGO !,Matthieu,,0,0
6 months ago,Anyone here invested in ipnff? Im part of a discord group with lots of good info on the company not easily found in anywhere else and it looks like its going to take off this week.,Crypto,,17,0
6 months ago,Why no movement this afternoon? Is this dead or what? Different ticker symbol? What's going on?,Tim,,1,0
6 months ago,Get ready for tho boom 🤩,kai,,5,1
6 months ago,Art always amazed me ,come out from nowhere sometimes run .15c  in one day ,and then she quiet for while and then Boom again ,you have to be very patience and strong heart to holding her ! But in the long run she is a keeper 💰🤑🤑🤑,TONEKHAM,,5,0
6 months ago,New press release https://www.globenewswire.com/news-release/2020/09/18/2095840/0/en/ARHT-Media-Enters-into-Strategic-Partnership-with-Digital-Nation-Entertainment-LLC.html,JK,,8,0
6 months ago,Recieved a reply from Salman Amin at arht and confirmed everything @JK posted from stockhouse. He also said they are working with digital nation entertainment on approval of news release.,BBD‐WBN,,8,0
6 months ago,I would hope if it was arht technology that they would put out a press release. I sent an email for confirmation,BBD‐WBN,,4,0
6 months ago,ARHT media technology appears to have been used for the AT&amp;T &amp; NBA project. Someone just posted this on the Stockhouse board: "CONFIRMATION RECEIVED from ARHT's Sales and marketing team. Here is their reply to my inquiry about AT&amp;T's NBA Holo Interview project :"Thanks for reaching out!  They did indeed utilize our technology for this project.   ARHT Media's technology was deployed by our strategic partner, LA-based Digital Nation Entertainment. Thanks again!""More,JK,,7,0
6 months ago,Check this video: AT&amp;T creates first-of-their kind 5G holo interviews with the NBAhttps://www.youtube.com/watch?v=8JahsGrr1gY,JK,,6,0
6 months ago,not a good look. likely going down. too bad.,Pham,,0,5
6 months ago,Interesting read someone posted on the Stockhouse - Ontario technology event for the European market - Arht is participatinghttps://www.sourcefromontario.com/en/page/event/135052/ontario-virtual-broadcasting-technology-export-business-mission-europe,JK,,5,0
6 months ago,Anemic volume lately.  We need to get back to July levels!,larchwood23,,0,0
6 months ago,Wonder when we’ll get news on the TLC Virtual Stage event in September that was in the PR back in July when they partnered together!,larchwood23,,0,0
6 months ago,Hoping for another week up. Let's do this!,Big Don,,0,0
6 months ago,New YouTube video  - ARHT Media Partners with Matrix Video Communications https://m.youtube.com/watch?v=3vBvFXPVnPE,JK,,7,0
6 months ago,https://eresearch.com/2020/06/13/eresearch-reports/canadian-5g-public-companies/?fbclid=IwAR0jyzKgIr8QUrJpCBdFae9Gh0WDL4AChgJzwY8rich-0BYlP3aQKOynsoMArht is mentioned in the article, interesting !,Matthieu,,0,0
6 months ago,Good buy it will hit a dollar again,Jay,,5,0
6 months ago,IMO, Arht can only do better going forward. With all recent partnerships and reseller deals around the world, there will be plenty of pleasant surprises in Q4. It's quite interesting that the pandemic was the main cause of the business decline in Q1 &amp; Q2. Now, the pandemic will be the main reason for the huge revenue jump in Q3 and beyond! I have been buying with confidence. Go Arht!,Sammy,,7,0
6 months ago,Good buy in price ?,OGG,,4,0
6 months ago,Still a buy or pump and dump?,Zach,,0,0
6 months ago,Come join our community for up to date news and informative conversation, https://www.facebook.com/groups/701469393918942/?ref=share,jamie,,2,1
6 months ago,Still a buy?,OGG,,8,0
6 months ago,average .35, nice run,val,,1,0
6 months ago,Check Matrix Video twitter, posted yesterday afternoon https://twitter.com/matrixvideomvcc?lang=en,JK,,3,0
6 months ago,Haha of course the day I make a plan to sell all my ARHT it shoots up. Nice.,B,,5,0
6 months ago,Above average volume is key.  Regretted now selling when it went to .70 so hopefully we go back up and even beyond that!,larchwood23,,0,0
6 months ago,People are starting to realize the power of this precious stock ! Next couple months we will be covered in gold !,Matthieu,,0,0
6 months ago,t is interesting. I'm holding long as well. not sure what a realistic target is but we'll see when we get there.,Leni Gouny,,2,0
6 months ago,This stock is interesting and dangerous to trade because those moves come out of nowhere. So I will just stick to holding it for the big pop and might miss out on some shortterm gains. But I have the feeling that it needs one nice push and it could go to 1 dollar within one session and never come back down.Good luck to all! We have something special here, hopefully it pays out!,Tobias,,10,0
6 months ago,I had faith in you arht you gonna be paying me real soon. Holding 0.60 cents not looking to bad now,Jay,,0,0
6 months ago,Reasons for run up: WisEKey initiated as a buy, NTAR bought Amazon ECommerce platform , good news generally in the AR space in article as well  moving forward 2020-2024.,chelsea,,2,0
6 months ago,so is this surge all on rumors? cant be. if it is more rumors please😁,Leni Gouny,,0,0
6 months ago,,B,,1,0
6 months ago,We will be in the dollars soon and shorts will be toast,farm,,3,1
6 months ago,Nextech has acquisition of amazon E commerce, they are not buying arht,Enthusiastic,,1,1
6 months ago,Not sure if this driving the price, but there is a conversation about the Drew Barrymore new talk show on the Stockhouse board. In an interview she mentioned LA, life-like guests....... There is no mention of Arht.... but we can hope.....https://www.etonline.com/media/videos/charlies-angels-to-reunite-on-drew-barrymores-new-talk-show-152690,JK,,5,0
6 months ago,What’s the news .. ?,Baljit,,0,1
6 months ago,Lets gooo!,Big Don,,0,0
6 months ago,Arht on fire 🔥 !!,Matthieu,,0,0
6 months ago,next target by nexcf,val,,0,0
6 months ago,We are in very early.  But this company is designed to be acquired for its key patents,ian,,6,0
6 months ago,Just bought more of this. Heres to hoping! GLTA Longs! and all you short can well eat just that,.... my shorts!,Satman,,6,1
6 months ago,ARHT Media hologram technology will be used https://www.hollywoodreporter.com/news/green-carpet-fashion-awards-to-go-virtual-premiering-on-oct-10,JK,,8,1
6 months ago,Patiently waiting until Q4.,Big Don,,3,1
6 months ago,Good to see 😅,kai,,0,0
6 months ago,Holograms of the players talking live to the analyst,BBD‐WBN,,0,1
6 months ago,https://www.espn.com/tennis/story/_/id/29788649/what-looks-scenes-grounds-2020-us-open,BBD‐WBN,,1,0
6 months ago,It's amazing to see them closing so many reseller agreements. Now there are nine permanent installed sites more in Canada.Give or take two years and so many people are familiar with this technology. Arht is well positioned and it's awesome to see the progress of them since the outbreak of covid.,Tobias,,3,1
6 months ago,Really burning the sales!,Sams,,1,1
6 months ago,More news https://financialpost.com/pmn/press-releases-pmn/globe-newswire-releases/arht-media-announces-reseller-and-integrator-agreement-with-matrix-video-communications-corp-a-leading-national-av-provider-in-canada,JK,,2,0
6 months ago,I like when a company puts out their earnings report and tells you revenue is going to double next quarter compared to last year. 470k last year so close to a million this year. I don't know what the share price will be the day before but it will be a lot higher on that headline. Accumulate at these prices and be patient.,BBD‐WBN,,5,0
6 months ago,Let’s go arht we still got it,kai,,0,0
6 months ago,I'm still a believer. it's just going to take time.,Leni Gouny,,0,1
6 months ago,Arht is aliveeeee!,Jay,,0,0
6 months ago,Nice to see a heartbeat today!,Kyle,,7,0
6 months ago,rise is zoom driven,val,,0,0
6 months ago,This Nasdaq event will give Arht some serious exposure and this is on top of the other events they already have planned.,Big Don,,4,1
6 months ago,https://www.globenewswire.com/news-release/2020/09/01/2086560/0/en/WISeKey-and-ARHT-Media-Team-Up-for-the-First-Ever-Trusted-HoloPresence-Investor-Meeting-to-Be-Held-at-The-NASDAQ-MarketSite-in-Times-Square-in-NYC-on-November-17.html,Sammy,,9,0
6 months ago,news out,Omar,,1,1
6 months ago,Just wanted to remind everyone that Sept may very well be a record month and a Milestone for Arht according to CEO Larry O’Reilly during his most recent interview:"Although revenues doubled in 2019 to $3.3-million, it is not yet profitable, reporting a loss of $3.8million last year. Mr. O’Reilly says he expects the company to become profitable by the fourth quarter of this year and possibly as early as September.",Sammy,,0,0
6 months ago,yikes. why am I holding this still? glutton for punishment, i suppose,Aardvark Sherwin,,1,0
6 months ago,Just sold everything. Headed to TSLA,Jt,,0,2
6 months ago,These prices are a blessing. It'll distinguish the traders from the investors.,Big Don,,3,2
6 months ago,falling down.... hmmm let me switch to ipnff,invest,,1,2
6 months ago,Why did I buy holograms 🤦‍♀️,Jay,,0,1
6 months ago,I was excited to get into this stock but legitimately considering taking a small loss before this gets worse... Any reason to believe this can bounce back soon? The company is distant with few updates.,Kyle,,0,0
7 months ago,I’m getting out as soon as this hits 60+ NOT excited about the Future of  ARHT media anymore. Rather be safe with this one ☝️,Jay,,0,1
7 months ago,Man let’s not see this in the 20’s I’m sick of averaging down on this stock! Let’s see some green next week,Jay,,0,0
7 months ago,Wow $42,000 revenue. And projecting 100% increase next quarter!  Share price seems high for such low bars?,Tim,,0,2
7 months ago,Perfect time to buy an undervalued company. This will be big Q4,Big Don,,4,0
7 months ago,Why does the company never have PR?,Kyle,,0,0
7 months ago,Lol garbage,ares,,0,3
7 months ago,Still holding strong,Cale,,3,0
7 months ago,Thoughts on the financial results announcement?,Kyle,,1,1
7 months ago,I was thinking the exact same thing, 13k shares at this price should be one person. I know it's not easy being patient but this tech will only grow in demand in the next 1-2 years. We are lucky to be getting in on the ground floor at this price and as long as it sits here I will continue to accumulate,BBD‐WBN,,0,0
