PostDate,Content,Author,RelativeDate,Likes,Dislikes
16 days ago,I love being in relatively early and seeing calm days like this where I have a chance to think and add to my position lol. Now I just wait instead of chasing after stocks that are already past their heyday.,James,,15,0
16 days ago,Hope you loaded up. This was the last dip before some green days.,alexcata,,0,0
16 days ago,Bought more! Great deal at these prices,Cody,,0,0
17 days ago,Is reverse split followed by more dilution as per WSR interview still in the works?,Zorro,,0,3
17 days ago,I really beleive in this company. Great things on the way.,Youri,,8,0
17 days ago,Officially added to my position... I'll patiently wait for this to take off $$,Peter,,0,0
17 days ago,Not bad for thin volume.,Rod Mac,,7,0
17 days ago,https://finance.yahoo.com/news/peak-launches-cash-advance-financing-123000688.html,Jackie Dodson,,3,0
17 days ago,Today's announcement adds another step toward massive revenue for 2021. Some are mistaking this for a deal with JD.  However, this is a cash advancement benefit for Xiamen suppliers awaiting payments from JD. Perhaps it will open the door for signing with JD in the future.,HUY,,0,0
17 days ago,I'll be shocked if this isn't over 2$ here. Awesome value at these prices.,Cody,,0,0
17 days ago,,M,,3,0
17 days ago,This was one of their goals for 2021, and they did this within 5 weeks of the new year. Great job peak!!!!!,Aric,,19,0
17 days ago,what's the magnitude? The magnitude is long term guarantee revenue means long term growth and this company will continue to grow even more...just 2 months since new year and this company has already secured so much growth!,Haw,,0,0
17 days ago,Can someone explain the magnitude of this news? All I know is that it’s looking good,Joshua,,0,0
17 days ago,Can we go over $3 today?,Rod Mac,,6,0
17 days ago,Pinduoduo, JD, this is unreal. Anything under 5.00 is a joke, and once Nas hits, it will be life changing money. Congrats to the longs!,Richard,,9,0
17 days ago,This will be up 20% plus  today,money0811,,0,0
17 days ago,for those that stumble on here while it's low volume, better add before it picks up momentum!,Haw,,0,0
17 days ago,I love what #$%$ doing!!,Haw,,0,0
17 days ago,Heading back to the 3’s,Austin,,0,0
17 days ago,Looking for more DD on PKK/PKKFF?,MoonBeam,,5,0
17 days ago,ho hum now we got nda's beeautiful,Jim,,1,0
17 days ago,I am definitely adding to my 4K shares if this doesn’t gap up huge this morning,Peter,,4,0
17 days ago,Placed a limit order at 2.17 USD. Will it go through? Maybe not? lol. It’s for sure gonna shoot up today.,R,,0,0
17 days ago,Ya that’s big news 🤩🚀🌙🤯,Eric,,7,0
17 days ago,Massive news release boys !!! Get some fuel for that rocket 🚀🚀,Juju,,10,0
18 days ago,Guys get ready for a falling knife,Jason Gustavo Esperado,,0,11
18 days ago,One of my favourites to buy on the dip...holding long,Cdn Eastwood,,6,0
18 days ago,Pretty sure PKKFF isn't going to do anything until we get news. Volume is ridiculously low yesterday and today. No one who's holding wants to sell, and no one who's buying knows they want to buy this yet because it's still wildly undiscovered.,Angie,,11,0
18 days ago,when qtr ?,René,,2,0
18 days ago,Similar stocks you are following? Similar to peak and acuity ads?,Vincentheim,,0,0
19 days ago,bull flag forming in the chart.... it looks like this can sprint back to highs quickly once we get an upward turn.,Peter,,24,0
19 days ago,Peak/PKK/PKKFF discussed at 7:06 time stamp of STOCKFAM video. If you have any questions or comments for Sean or Hammy please leave them on the YouTube Channel or join the discord to get them answered.https://www.youtube.com/watch?v=60CMJG8ULj0,MoonBeam,,3,0
19 days ago,LSPD up 9% today. Started the rally for the ER on Thursday.,alexcata,,2,0
19 days ago,join us @Reddit... https://www.reddit.com/r/StockFamGroup/comments/l8xqlt/why_we_like_peak_fintech_peak_fintech_pkk_pkkff/?utm_content=post&amp;utm_medium=twitter&amp;utm_source=share&amp;utm_name=submit&amp;utm_term=t3_l8xqlt,Jasmin,,0,0
19 days ago,Warrants expiring this month. Keep some cash available for next dip.,alexcata,,3,1
19 days ago,This should make all confident in the share price: "Pursuant to the appointment of Ms. Ades-Landy to its board of directors, Peak issued 50,000 stock options to Ms. Ades-Landy. The options are good for 5 years, vest over a 2-year period and have an exercise price of $2.70.",Johnny,,0,0
20 days ago,I just checked out Sedar, and there are no news releases that speak on a reverse split. Can someone let me know where this information is coming from? Because this sounds like fake news...,Joshua,,0,0
20 days ago,Wow, an actual yahoo conversation room that is mature. Thanks guys for answers/advice/opinions, realy appreciated, think I’ll just hold and add the dips, Im planning to be looonnnggg on this one ..! Well, unless it goes parabolic super fast, a little profit taking never hurts !!!,Alex,,0,0
20 days ago,Why we like Peak Fintech...must readhttps://twitter.com/Hammy_1022/status/1355647270444806147,Hammy,,22,0
20 days ago,Of course there is a difference between maintaining price min and up listings.  It’s healthy to have discussions about the possible ways this company can uplist.,james,,4,0
20 days ago,can anyone give me the link to discord server for pkk?,Haw,,3,0
21 days ago,A R/S to uplist is quite different than a R/S to maintain price minimum to stay on an exchange. My guidance would be that if you believe in the company then hold or add to your position bc the market doesn’t always do what you expect. As Warren Buffett once said, “the stock market is a vehicle to transfer wealth from the impatient to the patient.”,Peter,,0,0
21 days ago,Holding or selling before a RS ..? What are you going to do ?! What is the best thing to do ? Never been in that position to ask myself these questions before.. Im super bullish on this one.. but.. what to do ?! Any SERIOUS advice.. ?Thank you, GLTAMore,Alex,,0,1
21 days ago,When a company does a reverse split, doesn't it affect the warrants also? i.e. in the case of 5/1 RS the warrants 28th of February would have the exercise price og 2.5 instead of 0.5?,Willing_Plastic,,1,0
22 days ago,I did buy Peak at 1.4 USD. How long are you guys going to hold Peak?,Nikolai,,7,0
22 days ago,,M,,3,0
22 days ago,i know long term is what matters. but with the positive news you would think we would have gone green,Anthony,,3,0
22 days ago,just added some more, 40k share long, let's go baby!,Haw,,0,0
22 days ago,This company is starting off great and fast to grow!  I expect at least $50+ by EOY,Haw,,0,0
22 days ago,this is definitely the right stock to hold long term!  Getting big clients to do business with will yield good revenue per quarter!,Haw,,0,0
22 days ago,And y’all thought I was crazy for suggesting it go back to 2.50 🤷‍♂️,Austin,,3,2
22 days ago,Peak Appoints Banking Executive Dana Ades-Landy to Its Board of Directors,M,,9,0
22 days ago,this feels like the bottom.... big red day and we are waiting for a buyer to take us green.,Peter,,3,0
22 days ago,Fantastic addition to the team! Extremely bullish and excited. These are the players you need when stepping into the big game. Adding more today!!!,Richard,,0,0
22 days ago,nice PR this morning.... great addition to the BOD,Peter,,2,0
22 days ago,They keep adding large numbers of retailers to their ecosystem.  There is good visibility on their big growth potential,Dennis,,0,0
22 days ago,CIDM is going to be the next big winner,Matt,,0,0
22 days ago,,Eric,,3,0
23 days ago,This is gonna fly soon.. if not next month .. in the coming months for sure .. easy recurring revenue 👍 easy money !!!,Lallipop,,8,0
23 days ago,I?m gonna be honest here .. I?ve been following this stock a few weeks now ( very patient person /investor) I?ve been very skeptic but in time this company grew on me and it is for real ? China is the biggest market.. and #$%$ now dealing with 3 companies .. moving quickly.. matter of time PKK will deal with hundreds,Lallipop,,4,0
23 days ago,If this still down tom. Im gonna sell,viel,,0,5
23 days ago,When did they apply for Nasdaq,Enthusiastic,,1,0
23 days ago,Just added 1k worth of shares :),NB,,0,0
23 days ago,Hey Everyone! I wanted to get opinions from anyone with thoughts on the following...For context, I'm long on Peak and I love what the company is doing. I currently have 7k shares and want to slowly expand upwards so I'm not trying to bash the stock. I do have one concern though and wanted to get opinions. From what I can tell the Cubeler lending app tried to launch in Canada but didn't get a foothold here at all but instead shifted focus entirely to China. I can't find any real information on what the Chinese app looks like, how users are responding to the experience, and whether it is being well recieved there. The China strategy seems to be working according to the CEO and financials so far but does anyone have concerns with the opaqueness of the business? And does anyone have any informaiton from Chinese language sites about how people are responding to Cubler there?Thanks to anyone who can share info!More,Yohannes,,12,0
23 days ago,A reverse split doesn't affect the market cap or the fundamentals of the company. It's one way to get us over the $3 USD requirement for Nasdaq. Getting on Nasdaq will open the doors to institution investors and retail investors.,waynec,,3,0
23 days ago,Dont you people notice when btc is down this was going up all last week and every day btc is up this goes down. Yes theres financials and market cap and volume so much to consider but when it comes to day to day chart behaviour thats what happening here with pkk very strange behaviour mentioned this last week wake up. When btc dips again this will start to rise,jake,,0,4
23 days ago,added 25k today, this will see 10 dollars, just a matter of time,Aric,,6,0
23 days ago,China said they will regulate Fintech same way as banks,howie,,0,0
23 days ago,With positive news of additional growth driver and the stock dropped?  Thank you...I added 2000 shares.,HUY,,0,0
23 days ago,seems like every time there is a new news release it dips considerably,manny,,2,1
23 days ago,Don't forget how many green days we've had in a row,M,,5,0
23 days ago,For those who don't like someone shorting your stock: Some brokers (TDAm/Schwab and others) actually have your written permission (in the fine print) to let shorts borrow your shares to short the stock against your interest as a long term investor.  TO STOP THIS, make out a "good until canceled" order to sell ALL your shares at some outrageously high price (say, $100/share here).  That way, with a pending "sale", the shorts cannot borrow your stock to short your stock.I am now doing it with all my holdings.Anyone see any downside here?  I'm open to criticism.More,R,,11,0
23 days ago,Yikes I bought the top at 2.35 USD, oh well, I'm still looking to by more all in this range.  Too much growth for this company,Dennis,,0,0
23 days ago,rough day today on PKKFF, but atleast this GME, AMC etc nonsense is coming to an end.,Peter,,3,0
23 days ago,Just added!!,waynec,,2,0
23 days ago,This is basically free money at this point,Richard,,2,0
23 days ago,Waiting impatiently for some of my cash to free up. Would love to buy some more shares right now 😤,Austin,,2,0
23 days ago,its freaking good thing this crash !!! all in guys!,Mathieu,,4,0
23 days ago,"Xiamen has over 1,100 retail clients" are now linked to Cubeler Lending Hub platform.BDC, BJC, and now Xiamen .....the bottle neck is on PKK tech team, they can add distributor like crazy.,dan,,4,0
23 days ago,http://peakfintechgroup.com/2021/01/28/peak-continues-expansion-of-retailer-financing-program-with-addition-of-3rd-distributor/,dan,,2,0
23 days ago,“Peak Continues Expansion of Retailer Financing Program with Addition of 3rd Distributor”. Great news for Peak!,Joshua,,0,0
23 days ago,Big news again! Revenue will be large 😀,Eric,,2,0
23 days ago,More news, Hasn’t been posted to yahoo yet.,kyle,,3,0
23 days ago,Morningstar has the fair value price at $3.42cdn today... still under valued in my opinion.,Eric,,2,0
24 days ago,This is way undervalued,YeahSure,,5,0
24 days ago,Where is the revenue money?Are we even able to get money out of China??  If we're making so much money, why aren't we doing a share buyback instead of r/s???,Zorro,,1,3
24 days ago,Market is fubar, wall street and main street are at war, cash is king,Jim,,0,1
24 days ago,A lot of stocks in all different sectors took a step back today. No big deal,Anthony,,0,0
24 days ago,Love PKK, but realistically, should we expect another red day tomorrow? Looking average down.,Joshua,,0,0
24 days ago,I think the r/s news is a fake one since the ceo  promise never to do r/s split on of the  December conference call.,agada,,1,0
24 days ago,Never ever thought I'd see this Buying opportunity share price again! Time to take advantage of this dip. 5000 more.,Floyd,,0,0
24 days ago,Closing above $3,Enthusiastic,,2,1
24 days ago,https://www.sedar.com/DisplayProfile.do?lang=EN&amp;issuerType=03&amp;issuerNo=00027164,dan,,1,0
24 days ago,I added 3000 at 2.69 today, sorry for who sold ow ..,Enthusiastic,,7,0
24 days ago,Now THIS is conviction. People obviously know what they own.,Richard,,4,0
24 days ago,could get interesting if this turns green today.,Peter,,0,0
24 days ago,Some whales just grabbed 500000 shares this morning. See you at $4 by Friday??,Eric,,6,0
24 days ago,Thankyou for that dump, now I have a big position,Dennis,,0,0
24 days ago,Already recovering,Anthony,,3,0
24 days ago,This dip is a great example of why Peak desperately needs to get off of the CSE. Way too many investors on this exchange who don’t do any DD and panic sell without having the slightest clue what is actually happening.,JLH,,6,0
24 days ago,Buy the dip 😀,Eric,,1,0
24 days ago,Its a healthy pull back as it seems Peak is also a part of the latest pump and dump frenzy caused by retail chat rooms.,Jim,,1,3
24 days ago,Funny watching the weak hands bail out! Reverse split can’t hurt this stock when we 10x, 20x or 30x our revenues this year!,kyle,,1,0
24 days ago,Pullback,M,,0,0
24 days ago,Please don't sell because of a anonymous rumour,Johnny,,0,0
24 days ago,Selling pressure mainly due to management planning to hold a referendum on a RS and the ratio.... investors who had went through some nasty RS dont feel right about it as all DDs have the SP heading to $10 or more, so, it doesnt make sense and want to ask why they want a RS, is it just for the Q1 listing? Is it to attract some MMs which will mean RS and then likely to followup with an offering for the MMs?But then, some who ride this since $0.20 from the 10:1 RS and see it boom 10x said it hasnt failed a bit.So, there is now a dilemma for investors to consider.More,Anonymous,,1,1
24 days ago,Could someone give me the symbol for PKK in Canada ? Thank you and good luck to all.,LP,,0,0
24 days ago,So, is this a screaming buy? Looks like it, no?,Burning_Cash,,8,0
25 days ago,That was profit taking. Then people buying back in,money0811,,9,0
25 days ago,The thing has barely dipped, there are lots of buy orders waiting for these dips,Dennis,,7,0
25 days ago,Last chance grab shares before we officially file the NASDAQ application!,kyle,,10,0
25 days ago,Some Whale 🐋  just nabbed 26,000 shares at 2.96cdn. Tasty deal that must have been.,Eric,,10,0
25 days ago,In my opinion and I’ve been looking to buy this for a while... this might drop a little more .. too much news in a very short period of time made this explode.. patients my friends .. this is a long term investment,Lallipop,,1,1
25 days ago,OUCH... is there a reason for this hit?,Anthony,,0,0
25 days ago,Anyone else see this going back to $2.50 for a bit?,Austin,,1,6
25 days ago,Some good talk about PKK for anyone interested. https://youtu.be/qemsX9Wo958,Eric,,5,0
25 days ago,I hold this and fco.v great results came out 100 bagger for sure,Tony,,3,0
26 days ago,It going up slow and steady. Looks like only bread crumbs available for the bid prices being offered.,Eric,,8,0
26 days ago,Fellas if Peak closes above $2.00 USD tomorrow they will have all the requirements met to uplist to the NASDAQ. There is much fake info out there stating they need a $3 or $4.00 USD share price to meet NASDAQ requirements its categorically incorrect. We are currently at $2.45 USD as I'm writing. Another very important news release was posted today. Peak closed their first transactions with BJC and in doing so logged 6% margins. compared to averaging 2% on previous transactions. This is the most important news they have posted this year. It basically triples their income going forward and shows they are executing. The institutions on NASDAQ will run with news releases like this. Enjoy the ride fellas!More,L,,16,0
26 days ago,Why did it drop after initial gain today,Anthony,,1,0
26 days ago,In for 1000 shares,in it to win it,Run Jewels,,7,0
26 days ago,after watching for a week or so, I'm in for 4k shares,Peter,,8,0
26 days ago,To the moon 🚀,M,,0,0
26 days ago,Peak Records First Transactions Related to Agreement with Packaged Foods Distributor "BJM",M,,16,0
26 days ago,Big day tomorrow. Going to add 3,000 shares,Austin,,0,0
27 days ago,Wait til the Pinduoduo gets official news release now... $4 USD will come a lot sooner than most think,Derek,,0,0
27 days ago,4th quarter profits will be amazing they anticipate this sow they are getting ready for Nasdaq listing when they hit 4 dollars I'm excited for the news coming next,Marco,,5,0
27 days ago,https://twitter.com/thestreet/status/1353462719605841923?s=21  PDD expected to have a big year!,Anonymous,,0,0
27 days ago,What I heard the Johnson Joseph say on Wall Street Reporter was that they intended to eventually list on Nasdaq.  He tended to down play the complexity and time required IMO.  One painful inflection point is that the stock would have to be trading over $4 for up listing to occur.  When I asked about a possible RS, Jack the moderator never addressed the question.  I don’t think up listing to Nasdaq is anywhere near happening by Q2.  A slow, organic increase in the share price will be necessary before this stock trades beyond the pink sheets  Moreover, it would be helpful if the company comes out with a clear earnings guidance for 21.More,james,,1,6
27 days ago,$5 USD by end of February,Derek,,0,0
29 days ago,And all those robinhood investors come in as well oh boy i am ready to fly,Marco,,4,0
29 days ago,this will be incredible when included in us and asian markets will explode buying more today us market by late March or early April and some more news by the end of Q1,Marco,,6,2
29 days ago,Gotta take a stab at this thing.  Seems like all the pieces are coming together right now.,Dennis,,0,0
29 days ago,Between PKK and IDK 2021 is shaping up for 🚀 like returns 😘,Johannes Finn,,4,1
29 days ago,I missed the dip yesterday ,but not missing it today,money0811,,0,2
29 days ago,Looks like the price will climb through the day now. Most asking prices are 2.95cdn and up. Look like a strong base being built. GLTA,Eric,,5,3
29 days ago,So NASDAQ sometime before the end of Q1? when is the end of Q1 and what is a realistic jump in share price when this happens?,Anthony,,0,0
29 days ago,Advice: If you want in, buy now,,Andrew,,12,1
29 days ago,Watch out!! Willy is after your shares!!,Willy,,10,0
29 days ago,JJ confirmed that we fulfilled the last requirement for the NASDAQ listing, which was $2 USD. This is like taking candy from a baby. FREE MONEY FOR EVERYONE :) (that buys before NASDAQ hehe),Tony,,15,4
last month,JJ never lies. Whatever he says, he delivers! He just said there will be another epic announcement before the end of Q1. I am getting ready for it.,waynec,,16,1
last month,I just can't wait for Nasdaq! Going to be mind boggling!,Johnny,,0,0
last month,$4 USD by Monday,Derek,,8,0
last month,i can’t even begin to synthesize how big this company willbe in 5 yrs. massive. long and strong,Greg,,13,3
last month,Not to put a damper on the party we are all part of here, but does anyone know why this shot up in March of 2017 and then tanked for quite a while after?,HJB,,0,1
last month,Yeah that was an epic interview. Man that guy is smart.,Trev,,18,0
last month,big news coming in Q1.... hints in the interview "will add a new dimension.,dan,,12,2
last month,From the DISCORD, do you own math:"With a fully diluted share count of 150 million, peaks market cap would need to be $15 billion to achieve a $100 share price. Which means that using a modest 10x earnings multiple, Peak would need to be generating $1.5 billion in revenue.Their Q3 earnings per business average with 30,000 businesses and $15 mil in revenue was $500/business. Peak now has around 6 million businesses with access to their lending hub. A 200x increase in potential clients.If Peak maintains their Q3 earnings per business average of $500/business, which actually doesn't seem far fetched, they would be generating $3 billion in revenue. And that number doesn't include data revenue, the social media influencers, or any future deals that have yet to be announced."More,Doug,,27,4
last month,just added, now 30k share...started 5k...what a ride this is...holding long!,Haw,,0,0
last month,Closing above 3.50 today?,Enthusiastic,,6,0
last month,JJ said that he full expects to be on Nas end of March early april,Richard,,14,4
last month,Is the WSR interview finish? Any takeaway?,Rod Mac,,0,0
last month,I know a couple people in IRL that are like some of the profit taking folks who to this day is kicking themselves because they sold some stock too early and thought they made profit.. 😂,Haw,,0,0
last month,what a roller coaster,manny,,0,0
last month,I hope you guys bought the dip at around $2.20's 😂...,Haw,,0,0
last month,Over 50 people waiting already for the live presentation!https://youtu.be/nH23AtO6f44,Juan,,0,0
last month,Closing above 3.50 ?,Enthusiastic,,7,0
last month,Hopefully everyone has noted the delay in the price quote here on Yahoo.  Price is currently trending back up and sitting at 2.32 right now as opposed to the 2.28 showing on Yahoo. Just FYI.,Angie,,2,0
last month,Relax guys, good stocks can’t go up in a straight line, we all know uplisting is coming, any pullbacks should be seen as a chance to add before a guaranteed event, JMHO 🤷‍♂️,Tony,,0,0
last month,Today is showing some healthy consolidation around 2.25 (USD) after an insane run up the past two days. Not a bad thing at all. Onward and upward!,Angie,,0,0
last month,people taking profit probably didn't read the latest news post on here.  "Our ability to control the timing of when accounts are credited and debited puts us in position to offer a number of value-added services, such as escrow services, for which demand is particularly high among supply-chain clients where having the ability to inspect goods prior to funds being released, or ensuring that payment has been made prior to goods being shipped, can be extremely valuable. Once again, I can’t say enough about our executive team in China, led by Liang Qiu, for what they have accomplished with this agreement. Today is a truly memorable day for all Peak stakeholders.”More,Haw,,0,0
last month,What’s everyone’s greatest fear with this company. Reading a lot of positive but it’s always nice to hear some things that may scare you. Just bought another 2200 shares.,Trev,,2,2
last month,thanks for the dip!,Haw,,0,0
last month,Anyone think we’re due to see a correction in the price? Love the company but I hope I didn’t get in too late at $2.78.,Joshua,,0,0
last month,2% Correction after a 65 % run-up, thank you !,M,,3,0
last month,And there she rest from 2.79-3.20 area today and onwards ..... wont do a hard run till more news from CEO.......and this company loves giving new news...... lets all just wait for itNASDAQ end Q1 will be a huge run ..... and new news will be another..... and revenue growth will be another run.... 5 bucks day it hits nasdaqMore,dan,,3,1
last month,Gonna get bumpy from here until nasdaq. If your good enough to buy on the dips that’s great! If your not (like me) just enjoy the ride,Richard,,2,0
last month,Anyone that's selling now,  does not understand this company,waynec,,4,0
last month,This is going to run like crazy after ther live presentation today!,Juan,,3,0
last month,Crossing 3.50 today? What do you think?,Enthusiastic,,2,0
last month,Who ever is actually concerned. Day trading and profit taking with healthy consolidation. This is normal. Get out if you can’t handle the market. Also. Look at the volume. It’s absolutely massive,Richard,,5,1
last month,#$%$ down while PKKFF is up.  Strange...,HUY,,2,0
last month,Adding.,Sven Erik,,6,0
last month,It is just a profit taking for short term and a chance to add up.. I added 1000 dhares,Enthusiastic,,5,0
last month,House of cards,Mad Mardigan,,1,2
last month,whoever is selling, yall are disappointing,JPat,,0,0
last month,She is not stopping !,M,,2,0
last month,Crossing 3.50 today,Enthusiastic,,3,0
last month,Just came across the company and find it really interesting what they are doing!Anoyone with insights on the insider ownership? Yahoo states &lt;5% which would be a red flag for me...,S8,,3,1
last month,I hear the CEO is doing a livestream today at 12:30 pm EST. Someone got a link to post?,Adam,,3,1
last month,Just heared about this stock. I'll be IN in 59 minutes! Let's have a good one everyone!,Youri,,3,1
last month,This going well north of $3cdn today :),Eric,,3,0
last month,There is so much I want to learn about this company with so little time.,Dan,,1,0
last month,$4 by end of January,Derek,,10,0
last month,That's a beautiful chart for the day. No wild swings, good volume, and steady climb all day after the big opening bump.,Adam,,15,3
last month,,Anonymous,,9,0
