PostDate,Content,Author,RelativeDate,Likes,Dislikes
55 minutes ago,When the resultat of vote (reverse split) ?,René,,0,0
7 hours ago,I don’t know why I feel as if this is going to explode this year.,TTOPP70,,5,0
18 hours ago,They are trading at 2x sales which is insanely low,Wildwest,,6,2
21 hours ago,I’ve had PKK since 2019, 10,000 shares at $0.47 average, believe me you don’t wanna sell this stock, 2021 is gonna be massive for this company, and this stock is undervalued and no hype, volume has always been low, so once they get on the Nasdaq and Hong Kong and European exchanges, way more institutions and big investors are gonna take notice and I get goosebumps thinking of where the SP will be 🚀,Sam,,0,0
23 hours ago,Get in now, cause when this takes off, you're only gonna see a flash!!,Willy,,11,0
yesterday,Next week: 2021, 2022, 2023 estimates and EBITA, can not wait!,Willing_Plastic,,14,0
yesterday,Hey people do you know when is Q4 ?,Jonathan,,0,0
2 days ago,We need some news. Nickolaiiiiii.,shayners,,0,0
2 days ago,This is time bomb!! New ticker will be TNT, confirmed!!,Willy,,10,0
2 days ago,I can buy a few more shares if anyone wants the price to drop some. I've got that figured out to a T. 🤣,Zakk,,0,0
2 days ago,Great result from first half of Q1 2021. A total of  CAD$15.7MM was financed through the lending hub, which translate into $125MM for the year, which is approximately CAD$3.7MM revenue for 2021 if you take an average 3% as the revenue. Since the first few months are slow months and we can expect that the adoption picks up during the year, so add 4 times to the $3.7MM, then we can expect CAD$15MM for the year.,real,,0,0
2 days ago,Love Tenet Fintech. Another $10K is coming in on Friday. Have now 13K shares.,hello,,0,0
3 days ago,THUMBS UP IF YOU STILL BELIEVE!!,RoninHoffmann,,0,0
4 days ago,Does anyone know the outcome of today's shareholder meeting?,@DonaldDy,,7,0
4 days ago,Excited for the future here!Here's a rocket for Alex haha,Cody,,0,0
4 days ago,It?s funny.. still no rockets gif in here.. completely unknown gem.. when reddit and robinhooders army aim this one, it?s gonna rocket for real.. ! Even without them it will, institutions will be buying a #$%$ ton of pkk.,Alex,,0,0
4 days ago,Are options available for PKK or if not, in the future?,Jonathan,,0,2
4 days ago,Bought  a little more today.With a lot of good news coming out and the share price not moving up, it leads me to think that nobody knows about this gem yet.  If you are a patient and confident investor there is a very high probability of big upside, especially as they scale up their platform (which should be easy for them to do),Dennis,,14,1
4 days ago,News was great, with basically close to zero adoption they still captured 400-800k of revenue 🤯,Frank,,3,0
4 days ago,I just spoke with Cathy of investor relations for Peak Fintech Group. She said todays news release was sent out today to show how well the new revenue streams are coming along and nothing more. She said what it shows is really phenomenal (her words). They are very excited about how things are coming along. She also said that JJ plans to release guidance by the end of the month with quarter by quarter projections as well as EBITA. They plan to be profitable sometime in Q4. I haven't embellished anything here and this came straight from investor relations. She also stated she doesn't believe they will take questions in the meeting today. This is not total Business or revenues in the news release today.More,L,,18,0
4 days ago,Operational Update !,M,,0,0
4 days ago,I think it will be very funny, if Peak will allow to trade with Crypto Currency :D,Casino007,,0,0
4 days ago,Hey Everyone, I wrote this to answer someone who was looking for a run-down on Peak. I'm reposting it here so everyone can see and hopefully it answers questions for anyone wondering what Peak is all about. (All the info below is from their website and CEO interviews/presentations)So Peak is a Canadian company which owns a bunch of subsidiaries that operate in the Chinese commercial lending industry centered around a fintech product called the Cubeler Lending Hub.Here are the basics:1)The lending hub pre-qualifies businesses that are looking for business financing and connects them with banks/lending institutions. When there is a match and a loan is provided Cubeler charges a fee. Imagine it exactly like Tindr but for people looking for money.2)Peak also has the ability to facilitate transactions between factories, manufacturers and small businesses. So let's say you are a pre-qualified business on the Lending Hub. For example, a home builder. You are waiting to buy new lumber but can't afford to buy it until one of your clients pays you. Through the Lending Hub, Peak can now loan you the funds so you can order your lumber. Peak will facilitate the transaction and settle the account once the client pays up.3)Another major recent development is that Peak will now earn daily interest on the funds in its "float". Meaning all the money in Peak's accounts waiting to be sent here and there will earn interest every 24 hours at approx 2% per annum. That will be 2% of billions every year.4)Peak currently operates in 12 cities and is expanding quickly with plans of starting up in India as early as this year.5)Peak is working towards a deal this year with the large e-commerce giants in China to provide their lending hub services through one or more of the e-commerce platforms. It's not guaranteed to happen yet, of course, but the CEO has said that is what they are working towards.6)Peak is uplisting to the NASDAQ in about 5 weeks. The fact that it is not yet on a major exchange is a major reason for why it is so undervalued.7)Their revenue for the first 3 quarters of 2020 has already been more than double all of 2019 and Q4 has not even reported yet.Please correct any mistakes I might have made. Otherwise, looking forward to making money with all of you :).More,James,,25,0
4 days ago,Placed an order for 1000 shares @ $2.90     Can anyone give me a basic rundown of what this company does? I’ve been told to buy from some pretty reputable people.... wouldn’t mind a run down of what I’m buying into though!,Carter,,6,0
6 days ago,PEAK FINTECH DUE DILIGENCE AND PRICE TARGET.Hi Everyone! I have been investing in Peak for a few weeks (I am at 39k share currently) and I am long on this one. I initially didn't do much research except&nbsp;for some light reading but was really sold by the CEO's presentation on WSR. Well, I suddenly&nbsp;realized how insane it is that I invested so much without doing better research so I decided to figure out a&nbsp;price target given currently available information in anticipation of Q4 earnings. I can't tell you how pleased I am with what I found. Here is the info. PLEASE correct any errors you might see, but I think Peak is currently a $11.35 stock trading for $2.9 and here is why:-Peak's revenue for all of 2019 was $11.7M. In the first quarter of 2020 Peak made $3.9M. Second quarter 2020: $7.26M. Third quarter 2020: $15.1M. So for the first 3 quarters of 2020 Peak made $26.3M (already more than double all of 2019).If Peak simply maintains their Q3 2020 earnings for Q4 2020 then their annual revenue for 2020 will be $41.4M. That means with a BACKWARDS looking revenue multiple of 10x Peak should be valued at a $410M market cap. According to Yahoo Finance the current market cap is $281M. That would mean the current share price should be $4.23 once Q4 gets released (assuming 0 growth for Q4).-Now, let's say they maintain $15M in revenue&nbsp;per quarter for a full year. That would mean $60M in revenue for 2021. At a 10x forward looking multiple the market cap should be approx $600M. That means the share price today should be approx $6.19.-Now, Peak announced a major revenue stream about a month ago. They now have the ability to charge interest on the entirety of their float used to facilitate&nbsp;transactions between their clients at a rate of 2%. The company has not released numbers yet BUT the&nbsp;CEO did say they had approx $1B in funds that traveled through their float in 2019. So if we did a very rough estimate and said that if they held $1B&nbsp;throughout&nbsp;2019 which resulted in revenue of $11.7M then their float will be approximately $5.1B for 2021 with $60M in revenue. The 2% fees they will collect will begin halfway through 2021 so 2% of $5.1B for half a year is $51M in revenue. Add that to the $60M then you can estimate 2021 revenue at $110M. At 10x forward revenue we are looking at a $1.1B market cap and share price of $11.35 today.&nbsp;Now, looking forward, I only applied their service fee to half the year. For 2022 they will have a full year of 2% fees- so $102M in revenue from that stream alone ($162M combined).Now, I am sure you noticed something. All of this assumes zero growth. These numbers are just if they MAINTAIN their Q3 2020 revenue while adding their float fee. Yet, as we all know, their revenue is growing at an alarming pace. So add that to the forward looking share price, with a full year of float fees, continued growth&nbsp;of SME lending, growth of their announced partnerships with web retailers and the upcoming NASDAQ listing...well the share price would just go up from $11.35. -Lastly, if NASDAQ investors value the company by estimated 2024 revenue at a higher revenue multiple like they do for most companies- we might be looking at a truly sky high share price this year.&nbsp;Please give me your thoughts.More,Yohannes,,37,0
8 days ago,You wonder why it Goas down ? It is a normal Prozess , daytrader goes when no news.,Casino007,,0,2
8 days ago,What happens with pkk when pkkff goes to the nasdaq?,Jeff,,0,0
8 days ago,Damn FTFT a juice man makes you look stupid,Rick,,0,0
8 days ago,Lame question but wanna know whether we can trust this Chinese company?,Nitin,,1,14
8 days ago,Management is making well thought out acquisitions and will soon be a complete lending ecosystem behemoth in China. Catalysts include Q4 and 2020 report, uplisting to NASDAQ (end of March/early April), their expectations to trade on both the HK and TSX exchanges by end of Q2 (maybe 3-1 or 2-1 split) and a forecast update at the end of February.. So much news flow over the next few months! Holding 500 shares until minimum $20 USD.,trevorthegreat,,0,0
8 days ago,Reverse slit or not, nasdaq listing + strong company like that... it doesn’t really matter, just buy the more you can and you’ll be happy when this hit’s 20$ sooner than later ..! ✌️,Alex,,0,0
8 days ago,what about the REVERSE SPLIT and name change being voted on ?????,ron,,2,2
8 days ago,Early retiring money to be made here ..!,Alex,,0,0
9 days ago,8400 shares at an average of $2.97. Good enough, time to sit back and watch this for a couple years.,Austin,,0,0
9 days ago,10 bagger in the making. Easily a 5 bagger in my opinion by Jan 2022. They were making 50m last year before any contract announcement and market cap is only 200m on what is a high high growth company.,Vincentheim,,9,1
9 days ago,joining the party, bought today will add if dips,aj,,9,0
9 days ago,,Neil Armstrong,,3,0
9 days ago,discount day I was looking for to add a bit more, thank you.,Haw,,0,0
9 days ago,every news bring it down 🤦🏻‍♂️ come on , in PKK we trust,Sébastien,,0,0
9 days ago,Stock should be soaring on this good news.,Vincentheim,,1,0
9 days ago,going down why?,manny,,0,1
10 days ago,I want this to hit 30$,Vincentheim,,17,0
10 days ago,What are the facts here?  Trying to get a better understanding of this company.  Who pays Peak -- the suppliers or the customers, and why the need for someone to put them together?  Thanks!,Budman,,0,0
10 days ago,𝐏𝐞𝐚𝐤 𝐒𝐮𝐜𝐜𝐞𝐬𝐬𝐟𝐮𝐥𝐥𝐲 𝐓𝐞𝐬𝐭𝐬 𝐅𝐮𝐧𝐝 𝐓𝐫𝐚𝐧𝐬𝐟𝐞𝐫 𝐏𝐫𝐨𝐜𝐞𝐬𝐬 𝐟𝐫𝐨𝐦 𝐂𝐡𝐢𝐧𝐚 𝐭𝐨 𝐂𝐚𝐧𝐚𝐝𝐚Montreal, Quebec--(Newsfile Corp. - February 10, 2021) - Peak Fintech Group Inc. (CSE: PKK) (OTCQX: PKKFF) ("Peak" or the "Company"), an innovative Fintech service provider to the Chinese commercial lending sector, today announced that it has successfully tested the process whereby the its Chinese operating subsidiaries will periodically send funds back to Canada once the Company becomes profitable and deems it appropriate for its subsidiaries to do so.Long before establishing its operating subsidiaries in China, Peak worked with business consultants, tax experts, legal and financial advisors specialized in helping foreign entities do business in China. Together they helped Peak create and put in place a corporate structure and file the necessary paperwork so that Peak's subsidiaries could eventually follow a government-established process to send funds to the Company's Canadian head office. Part of the exercise required a disclosure process with various government departments at the time of registration and creation of each subsidiary, and the continuous maintenance in good standing of prescribed regulations, all of which led to the first successful transfer of funds from Peak's Asia Synergy Data Solutions subsidiary to the Company."Today's announcement has been several years in the making," commented Peak CEO Johnson Joseph. "We've been following our advisors' advice from day one and were always confident that the process would work as described. But until recently we weren't in a position to test it or had real grounds to do so. However, given the path that the Company is currently on and the possibility of repatriating funds from China at some point in 2021, we felt it was important for us to test the process to ensure that it actually works. We have now validated that we have a clear path and process, endorsed and prescribed by the Chinese government authorities, for our subsidiaries to send funds from China to Canada. We're also very pleased with the amount we were able to transfer and how quickly the transaction was completed."The amount of the transfer was kept confidential as Peak has adopted an internal policy not to disclose the value of these types of transactions if and when such transactions are referred to in public communications.More,Vincentheim,,14,0
10 days ago,Come on... Wake up PKK,Cody,,8,0
10 days ago,this one dipped just enough for my limit order to be executed as I march towards my position keeping 2.5 average cost...,Owais,,8,0
10 days ago,Got my moon rocket attire on and packed a lunch, ready for launch.,JW,,0,0
10 days ago,Anybody here familiar with SHU Growth on Seeking Alpha? He is good at picking microcaps and he has a nice article on in PKKFFhttps://seekingalpha.com/article/4399939-things-are-just-beginning-peak-fintech,Dennis,,3,0
10 days ago,The stock will go to the moon and possibly Jupiter if Jay stops shorting it and Nick Peruvians it. $41 in 3 months. It’s happening!,shayners,,0,0
10 days ago,Looks like the only news that will move this beast are earnings and guidance at this point.,HJB,,0,0
10 days ago,Today Peak removed a lingering doubt from investors...adding fuel to prepare for a proper launch to the moon!,HUY,,0,0
10 days ago,Excellent news! This will be a 10x bagger sooner then people think,Cody,,0,0
10 days ago,Transaction has been approved!!,Willy,,12,0
10 days ago,Please fix the typo in the PR. It's so unprofessional.,hello,,0,0
10 days ago,this stock will be over $10 sooner or later remember I told you. Have a great day!,George,,16,0
10 days ago,Just bought more yesterday. Had a feeling about news coming soon. LOVE IT,Gustav,,0,0
10 days ago,News release : Peak Successfully Tests Fund Transfer Process from China to Canada,Juju,,0,0
11 days ago,I don’t like that idea for a r/s either, mess’s with our multiplier. But short term the exposure to the Nasdaq should take this from $15 to $30 quickly and maybe beyond. Good Luck😎,Cdn Eastwood,,0,0
11 days ago,great companies reward shareholders by being great companies, not by pandering to your expectations. for peak to scale at the rate they need to capture the massive market opportunity, they will need liquidity to do so. their cash balance is insufficient, practically negligible, to fund such an expansion. the R/S will allow them to source the the adequate amount of cash so it can be used to fund the companies growth... shareholders who are complaining about this either are too focused on their own wallets, don?t know #$%$ about scaling business, are micromanager, or are just plain dumb. if you don?t like it, sell your shares! if you can provide the company with adequate liquidity to scale their business then contact JJ. OR get over it, and know what you own.More,Greg,,3,0
11 days ago,we arent even trading fair value and people want a RS? it makes no sense... just to satisfy institutions who made their own rules... #$%$ em.. they WILL come regardless.. it about making money . so we don't need an RS especially to RUSH... longs have been here for years... 2-3 months wont hurt us at all! KNOW WHAT WE HAVE AND MAKE INSTITUTIONS PAY MARKET! vote no for the RS and let us grow naturally.. dont say MARKET SHARE... theres over 100 million SME and PKK addressed it isn't worried about competition ..SO NO NEED TO RUSH !,goat,,5,4
11 days ago,Hi Everyone, I've noticed quite a few people concerned with the possible reverse split and a few inaccurate statements made about it. Just to clear things up- a reverse-split is not a bad thing at all. If someone cuts a large pizza into 8 slices or 12 slices it's still a large pizza. Peak is an extra large pizza. In fact, it's the whole damn pizzeria. So chill. Why are people concerned about a reverse-split generally? Companies that have a share price trajectory going DOWN that have to maintain a minimum price to remain on certain exchanges might reverse split to meet minimum share price requirements. So a reverse split under that circumstance sends the signal that the company is having trouble attracting investors. In PKK's case the current price trajectory is UP, not down. And to speed things up, they are consolidating the shares. What is the net benefit? We will be on the NASDAQ. A Canadian FINTECH company serving the enormous Chinese commercial lending space will get irrational amounts of attention on the NASDAQ. So it's a win-win all around as a result of the reverse split. Context matters. Big money, institutional investors, and those willing to do their DD will know this.More,James,,0,0
11 days ago,Reverse split is a direct request from Several retail banks capital markets division. This will allow a big enough float for them. This is an institutional request not a bad one. As well this will also allow a direct Nasdaq listing,Vincentheim,,0,0
11 days ago,I said it wouldn’t start moving on discord yesterday, right before they kicked me out, until at least the 2021 projections are released and they prove they can get profits out of China IMO.  None of these cheerleading sites want to hear the truth or even discuss any concerns.  PKK will do very well once a few more pieces of the puzzle come together.,Johnny,,7,1
11 days ago,Seems like no one wants to give up their shares. Investors truly know what they own! That being said, I hope the reverse split doesn’t come because I wouldn’t like to lose any of my shares. Anyone think this will happen?,Joshua,,0,0
11 days ago,The stock is having trouble continuing to rise because of a possible reverse split !!!! Very bad decision .....,René,,2,4
11 days ago,$100 by EOY,Derek,,0,0
11 days ago,https://www.youtube.com/watch?v=E7iRcBkeuxMWatch toward the end with the analysts remarks of possibly going to $60,George,,11,0
12 days ago,,money0811,,7,1
12 days ago,,Willy,,12,0
12 days ago,Voted No on RS, not needed for listing, I believe we will get there on time!,Haw,,0,0
12 days ago,this chart looks nearly identical to NXGWF a couple weeks back when they were about $.55..... NXGWF is now $.77.... looking forward to a 40% move,Peter,,7,1
12 days ago,Sold my ACDC a couple weeks ago because it wasn’t moving and decided to buy PKK.  ACDC went up 200% today.  😭🤦🏻‍♀️,Dianne,,1,2
12 days ago,The terms diamond is really not applicable to fundamentally trashed stocks like gme or amc,  rather #$%$ where you want to put ur money in before it takes off.,Yves,,1,0
12 days ago,A green day is a good day. Don’t need to jump 20% to be a good day. We steady climbing. Once we’re on Nas we’ll see a few 20%+ days,Austin,,0,0
12 days ago,What will nasdaq do for the sp? Prediction?,Cody,,0,0
12 days ago,Had a NR today and it's doing the worst in my portfolio. So it goes.,Beth,,2,2
12 days ago,I was predicting $3.20 today. Still could happen !,Anthony,,1,0
12 days ago,Wooo Nasdaq! Before the decision for a reverse split even,Tony,,0,0
12 days ago,Stock should go up now. Some folks were trying to sell at $3.00 this morning instead of 3.50 or 4.00 Should start climbing now that people gave there shares away lol,Eric,,9,1
12 days ago,ya and just how does this app improve revenues / earnings, the Nasdaq does not pay companies to list, Market be crazy,Jim,,1,0
12 days ago,yea what happened with nextech they applied July 2nd still waiting. you guys won't be uplisted till late summer at minimum. glta,Anthony,,0,10
12 days ago,yes! yes! yes!!!! I told everyone I know that trades about this stock.... let's get this money!,latonya,,0,0
12 days ago,Ask 2.58 usd,money0811,,4,0
12 days ago,Massive news. Congrats to everyone who owns sharws,Richard,,5,0
12 days ago,Peak Officially Files Application to have Its Common Shares Traded on NASDAQ,M,,11,0
12 days ago,Montreal, Quebec--(Newsfile Corp. - February 8, 2021) - Peak Fintech Group Inc. (CSE: PKK) (OTCQX: PKKFF) ("Peak" or the "Company"), an innovative Fintech service provider to the Chinese commercial lending sector, today announced that it has officially filed an application to have its common shares listed on the Nasdaq Capital Market stock exchange ("NASDAQ").Peak expects the listings review process to last six to eight weeks and for its common shares to begin trading on NASDAQ in late March or early April 2021.,andrew,,0,0
12 days ago,$4 USD by end of February,Derek,,0,0
12 days ago,PKK Feb Monthly Report: As the Issuer continues to grow, and with the expectations of having its securities trading on the NASDAQ, TSX and Hong Kong stock exchanges by the end of the second quarter of 2021, it took an important step during the period to upgrade its board of directors with the addition of Ms. Dana Ades-Landy. Issuer’s management produce pro-forma financial statements and publish updated forecasts for the Issuer by the end of February 2021. The Issuer’s management also spent time during the period in discussionswith investment banking firms located in California, New York, Hong Kong and Shanghai related to the Issuer’s migration to the NASDAQ and Hong Kong stock exchanges. Those discussions also included the potential 3 to 1 or 2 to 1 consolidation of the Issuer’s common shares concurrently with the move to the senior exchanges. The Issuer’s management expects to reach an underwriting and advisory agreement with one or more of the investment banking firms before the end of February 2021.More,George,,19,1
13 days ago,Upcoming livestream 'Sunday Night Chat' by the StockFAM will definitely include some discussion on PEAK. Hammy and Sean will be joined by former NFL player and StockFAM member David Boston. So we will get not only some stock talk, but also a little bit of football conversation. https://www.youtube.com/watch?v=cEgxizIOsa8&amp;feature=youtu.be,MoonBeam,,8,0
13 days ago,looks like I missed the boat. Might dip below $2?,Mike,,0,2
13 days ago,Reverse split would be bad.At this stage we want as many shares as possible for the future, reducing shares is not what we want, and then the float will be smaller and the stock way more volatile.  GP did a reverse split, as you can see from the price action it moves erratically.But I'm sure management has their reasons.  Nasdaq will come regardless (if they add merchants and sign deals), I would rather not have the reverse split.More,Dennis,,5,2
13 days ago,What are your thoughts on the proposed name change to «&nbsp;TENET Group&nbsp;»?,Vincentheim,,0,1
14 days ago,did anyone else get mail of the reverse split?? I didn't get it and no one else i know got it,manny,,1,2
14 days ago,I am watcher.... Being at the mercy of Chinas regulatory system gives me nightmares 😳 .,Don,,1,0
14 days ago,100% not agreement, #$%$ if the company wants to consolidate while buying back its shares! (cgi (gib) always does that !!! it shows good management),René,,1,0
15 days ago,Anyone know another company  similar to peak? In my opinion peak could be a fintech darling one day and command a few billion in market cap . What are your thoughts?,Vincentheim,,5,0
15 days ago,20k shares and looking to add more!,jimmy,,2,0
15 days ago,Got the voting paperwork today in the mail. The meeting is on February 16th to determine if they will do a 2 to 1 or a 5 to 1 split.,Joe Z,,3,0
15 days ago,Now at 10,000 shares. I will however wait and hope for small pullback.,Vincentheim,,0,0
15 days ago,20k shares at 1.18 hoping to retire off this stock,Frank,,18,0
15 days ago,I'm 50k share large, glad I added more at $2.07,Haw,,0,0
15 days ago,Any thoughts for reverse split?,lili,,0,0
15 days ago,Those 1 month &amp; 6 month charts be looking beautiful!,Austin,,0,0
15 days ago,1000 shares strong!,C.Buckman,,5,0
15 days ago,Finally it's moving again :) Buy more, if you like#PKK.CN,Knolle,,0,0
15 days ago,9500 shares strong!,waynec,,6,0
15 days ago,7500 shares strong!,Vincentheim,,8,0
15 days ago,Is there any news on reverse stock split for this? I read it in a group but not able to find any source.,Owais,,0,0
