PostDate,Content,Author,RelativeDate,Likes,Dislikes
2 months ago,As of today 56% of american peak shares were shorted...... as of nov 30th 25% of canadian peak shares were shorted, its probably around 50% currently...it should have gone up on this news this morning by 5-10%.... instead she dropped 5% today......if your long and you want to fight the shorts put a very high long term sell order in.....say $10+ dollars at a good till cancelled time limit.....its such a high price it  locks your shares up so the shorts cant borrow....GL all!!!!!,Shannon,,0,0
2 months ago,Wow Red lol that's krazy anywho enjoy your weekends,George,,1,1
2 months ago,Did the pumpers buy today for profit next week. I hope not, real investors need this stock. Hope to see this past $2. Great News today has not sink in yet?,Rod Mac,,0,0
2 months ago,did not expect this to go negative today...,gabriel,,3,0
2 months ago,Peak is definitely moving past $2/share by EOY. This stock is a data play and will get the attention in 2021.,Tahir,,8,1
2 months ago,was just reading up on The DCEP this news is really big.,George,,4,1
2 months ago,I expected more rise!!!,manny,,7,0
2 months ago,My best holding and the one I’m most excited about as a growth company.,anthony,,5,1
2 months ago,Lol.. These guys are moving at a bullet pace. This is going to be a very different company in a year when all these deals start gaining momentum,anthony,,4,1
2 months ago,Part of currency backed by yuan... Um lmao are people dumb, this is spectacular news,Tony,,0,0
2 months ago,Not moving much yet,Sam,,0,0
2 months ago,Buckle up and prepare for lift off.,Andrew,,0,0
2 months ago,most underrated company. This 1 is my fav. Goodjob!!,George,,4,1
2 months ago,Super bullish. I feel we will have another 20% + today,Hugo,,6,1
2 months ago,kaboom !!!!,Jf,,3,1
2 months ago,Sit down tight, this thing shall fly today ;),gabriel,,2,1
2 months ago,Here we go.....Peak trying to get a piece of ALL lending transactions in China. I repeat.... ALL LENDING TRANSACTIONS IN CHINA (worth HUNDREDS of billions). As of today 48% of the peak stocks were shorted (OTCSHORTREPORT).... Shorts in real trouble now..... epic short squeeze coming......and remember my earlier post..... i expect Peak to pull in 45-50mil in revenue this year..... but i expect them to BLOW by 200 million next year.....could be much higher then that if their last 3 announced deals generate  revenues that none of us were expecting, these deals didnt even show up in 3rd quarter earnings but once they get rolling Peak will become money printing machine.... the CEO and upper management are well on their way to becoming billionaires, and they are gonna make me and many of us longs  millionaires!!!! 😳🤗🤑🤪 GL all!!!! (especially the shorts..... they’re gonna need it)More,Shannon,,10,1
2 months ago,Outstanding👌,Mad Mardigan,,3,1
2 months ago,$4 by EOY,Derek,,7,0
2 months ago,So confident in this as an investment, it is my largest holding.  What a great day to buy into the dip, normal with cheap shares from warrants being excercised and on the back of a 52 week high not long ago.   Do your DD and think about going long.,Nobs,,0,0
2 months ago,Maybe the algos fraked up and the rest of the day was repair mode, let see what happens friday,Jim,,3,0
2 months ago,don't call it a comeback,George,,2,1
2 months ago,Record volume,Nobody,,2,0
2 months ago,https://cdn-ceo-ca.s3.amazonaws.com/1ft4nlc-20201210_124457.jpg,GreedyData,,1,0
2 months ago,Might bleed a bit from here the rest of the week.  If so I'll be buying tomorrow near close,Nobody,,1,8
2 months ago,Quarterly Revenue growth (YoY) 236%, good business and quality financials....It is undervalued at this price...,BULL BULL BULL,,5,1
2 months ago,Something hot is cooking and ready to be served .. very soon!!,Pino,,8,0
2 months ago,What’s going on!!! ??,Anonymous,,6,0
2 months ago,I have a long hold position on this stock...but am I the only one who's like "the #$%$ happen actually"!?,Jason,,4,0
2 months ago,Yessir,Finance AP,,0,0
2 months ago,1 gap filled and busted through, second gap filled...now we'll see what's next,Nobody,,2,0
2 months ago,Interview postponed to next week. Don't you get the hint? Big news is coming.,Jordon,,9,0
2 months ago,Ok what the hell is going on?,Sumerian123,,3,0
2 months ago,Heeerre we Goooooo!!,Mathieu,,0,0
2 months ago,I highly anticipate major news Monday,Nobody,,7,0
2 months ago,That bid ask spread went insane....I keep thinking it's halted but then orders go through.Earlier the bid was above the last for a good while,Nobody,,2,0
2 months ago,,N2,,5,0
2 months ago,Bounced off support, interview cancelled and rescheduled for Tuesday....I bought back in at .85 right after I saw all the signs.,Nobody,,2,0
2 months ago,Told you to watch out, shorties!,Jordon,,3,0
2 months ago,the f.. is this? ahaha down 12% this morning now up 18%?,gabriel,,2,0
2 months ago,Is this a delay reaction from yesterday news?,Rod Mac,,1,0
2 months ago,,Sam,,5,0
2 months ago,People who thought this company was not solid, are people who have done no dd at all.. this is the queen of all gems!!!,Willy,,5,0
2 months ago,PANIC? Nobody is panicking, just loss more than 40%. Even with news of acquisition, price is going down. Will still hold. GO PKK!!!,Rod Mac,,2,0
2 months ago,what is the potentiel long time ? 5 year average ?,Jf,,0,0
2 months ago,Just bought more. Funny watching everyone panic,Frank,,3,0
2 months ago,Someone just said on Facebook that #$%$ cancelled on Wall Street today... is this true or a rumour,Geoff,,1,1
2 months ago,Will be interesting to hear what JJ says on the call at 12:30,N2,,6,2
2 months ago,Horrible stock, jeez.,gabriel,,3,5
2 months ago,this is disgusting.,gabriel,,5,1
2 months ago,Down almost 10k on this.... its a hard pill to swallow right now but I have faith this will come back. Might take longer than I hoped for, but I'm not selling a loss this hard. In for the long haul if I like it or not.,Johnathan,,3,0
2 months ago,1.05 bid,S,,0,3
2 months ago,,J,,0,0
2 months ago,As mentioned previously, you guys got pumped and rotated some of your stocks to PKK, when PKK does not yet have a solid foundation and fundementals. Now it got dumped.  Watch out of those WSR stocks. Only one or two of them are good, #$%$ not one of them (yet?).,#RealTalk,,0,0
2 months ago,For those of you who are panicking from the recent downtrend should know that this is considered normal and healthy. Stocks need to go through corrections and consolidate before another run up. Hold strong and hold long. Buy the dip. Know what you’re buying.,Chun,,13,0
2 months ago,I really got kicked out of the discord for saying I hold 10k shares at 1.6 average lmao, can someone link me,Tony,,6,0
2 months ago,Jj has kept true to everything he has said. The market will catch on sooner or later. Hate to see this fluctuation but being patient.,anthony,,4,0
2 months ago,Ceo interview tomorrow Wall Street reporter 1 pm,anthony,,4,0
2 months ago,down tomorrow?,Sam,,1,0
2 months ago,Its financials are good..... Q. revenue growth is awesome......it trading at very fair value....It is BUY here,BULL BULL BULL,,4,1
2 months ago,what is going on with this stock?,Sam,,2,0
2 months ago,So, do you guys reckon we will be falling a bit or falling a lot today? Seems to be the rend lately lol,gabriel,,1,1
2 months ago,The Data this company is going to have on the massive China business market will be astronomical.,anthony,,6,0
2 months ago,Big news guys. These guys are just flying.... holding strong and can’t wait for the new revenue projections,anthony,,3,0
2 months ago,More great news and progression. Lfg!,Plums,,4,0
2 months ago,Willy loaded the truck here!!! This is like a granade thrown in the bonfire.. It can blow anytime!!!,Willy,,7,2
2 months ago,95 cents per share with this share structure and revenue?!?! LOL. WOW. There are only 108M outstanding shares and we hold a 60M float. If you hate money keep selling this. Rocket is fueling up this week and will be above $3/share by Jan in my opinion. Hold onto your plums, we bout to triple up!,Plums,,0,0
2 months ago,why is down ??,Jf,,0,0
2 months ago,let's fall again today -_-,gabriel,,7,0
2 months ago,Alright im in now.. its dipped enough.  Time for a run.  Bulls on Parade,JP,,0,0
2 months ago,4th quarter revenues will give some deep insight into where this company will be at the end of 2021..... im expecting them to clear 20mil.... and may even reach 25mil. If they do then i believe this company will exceed 200mil in revenues next year..... these last 2 deals they announced, didnt even show up in the 3rd quarter numbers (15mil)... and these deals bring MASSIVE unrealized opportunities for this company to literally print money! Im expecting a slew of deal announcements from this company to 10x (minimum) this stock by the end of next year. GL all!!!!!,Shannon,,0,0
2 months ago,The price is going back down because it's suppose to. I'd like to see this stock get proper institutional support, and become legitimate before putting real money in. For now it's a PND pumped by WSR. Make your 3-5x and get out.,#RealTalk,,0,0
2 months ago,anyone actually think this is gna go up?,Pupa,,4,0
2 months ago,This will skyrocket eventually. Company had good base of influencers. Who is holding long here?,Rajat,,0,0
2 months ago,Looking for a run to Greenville, USA in power hour. STUPID CHEAP still, so it's possible.,Plums,,4,0
2 months ago,It is highly oversold. Will rebound very quickly in this week. If there is some positive news released, it will be a rocket.,Siming,,0,0
2 months ago,I'm long here,...but I would like to see a bottom.,aaronc,,2,0
2 months ago,should i eat this dip up,joseph,,3,0
2 months ago,Christmas came early,George,,3,1
2 months ago,just no sense dumping. cannot understand,Siming,,3,0
2 months ago,YES!!! back in with 82,000 shares at .89-.97 today. Some real dumb people dumped this for no good reason as far as i can tell.. I couldn't believe it. So happy to be back in.,Plums,,0,0
2 months ago,Is Peak getting lumped into this delisting effort that the government is creating with Alibaba, Tencent, etc. ? PEAK is not the same though it doesn't mean they will not be treated the same until some sort of press to the contrary.....,Elons Musk,,0,3
2 months ago,After 2020, PKK will never see these price points again — load up while you can my friends! Added 2,000 more shares to my holding.,Darth Vader,,0,0
2 months ago,Awesome buying opportunity!!,Pino,,0,0
2 months ago,Told you guys, get out when you can!!,jimmy,,1,11
2 months ago,What's happening here???,Chris,,3,0
2 months ago,Peak is trading at a sales multiple of 3.3x (peers at 12x). The CEO mentioned they will easily hit $40MM in revenue for 2020. For 2021, equity research is showing $90MM and may be more after any additional partnerships that haven’t been announced yet. Taking a more reasonable sales multiple of 8x on FY21 sales EV should increase to $720MM or 5.4x. This isn’t including pending news for the remainder of 2020 or monetizing data which the CEO is planning on doing over the next year or two. This company is set to scale up quickly and has the technology in place to do so. Potential 10x stock in the next 1-2 years if the company continues its recent history of outperformance.More,N2,,17,0
3 months ago,Guys I’m a potential long term investor.  I’m looking for China exposure with huge upside as a speculative piece of my portfolio.  One thing I’m a little stuck on is that Yahoo Finance is showing a debt/equity of 22.  It’s suggested 2+ is high.  Hoping someone can help me understand why it’s high and how you made sense of it.  Thanks!,jon b,,4,0
3 months ago,Next week.Big news coming $3 by EOY,Derek,,12,0
3 months ago,Great dips and healthy buys today🤩 I believe this beauty is just starting and I hope we all will buy more! Good luck everyone 😉,Georgi,,0,0
3 months ago,Any of you know where is the support on this one? Been following this one for a while, i'm anxious to initiate a position,gabriel,,3,1
3 months ago,question for you guys...where do you think it will stop falling and why ? Want to know your opinion,Jason,,0,0
3 months ago,Jumped in today. This can easily go back to $2 + and still on track to be up listed to TSX / NASDAQ,Madoff,,5,0
3 months ago,DOC and PKK are languishing in RED for a week!,Rod Mac,,0,0
3 months ago,Wait 1 more day before the bounce back!  I'm going to buy 665 maybe by end of day today or Monday.,Anon,,4,0
3 months ago,it is time to bounce back. already  touch 20MA.  Go!,Siming,,6,0
3 months ago,damn keeps dropping,manny,,0,1
3 months ago,this share price though,Phillip,,2,0
3 months ago,I sold at 1.53 simply because I was up 40k and wanted a chance to let this stock cool down. I couldn’t have timed it better. I’m seriously watching for my re-entry and I’ve got $70,00-75,000 going in. I’m looking for 60k+ shares around $1.15/share USD and will hold long. Should 5X by March/April 2021,Plums,,4,4
3 months ago,This pullback is typical on TSX Venture ans OTC. Doesnt mean this stock is not a good hold medium to long term. I did my DD and I am very bullish for this company. I beleive they will make 100M+ revenus in 12 months.,Serge,,7,0
3 months ago,Looks like 1.60$ is all the bargain you’re going to get on this beauty,steven,,4,1
3 months ago,Future is on a downtrend unless management announce something worthwhile.,Rod Mac,,1,12
3 months ago,Lots of speculation of this being a 10x bagger. I can see why, the fundamentals here are great and the CEO knows what he is doing. Question is, 10x bagger from what point? I entered with 12175 shares at 1.66,Johnathan,,7,0
3 months ago,I found this after a lot of research and I am sticking with it. Excellent future. Long. Regards.,Mahmood Hasan,,0,0
3 months ago,did anyone's cost average go up after the name change?,W,,0,4
3 months ago,Healthy consolidation &amp; profit taking going on — if you can look at Peak’s business model &amp; be bearish... I’ll pray for you.,Darth Vader,,21,0
3 months ago,Anyone still having issue seeing share info in account?,Robert,,0,3
3 months ago,What now? where are the gurus who are bullish on this stock?,Rod Mac,,0,0
3 months ago,Time to run folks. You all got played,jimmy,,0,0
3 months ago,I still can't see my shares in TD since the name change. anyone else with this issue?,Sonia Kiss,,1,0
3 months ago,I don’t know who trading this right now, I still can’t even get info on price w/ swab,Jill,,0,1
3 months ago,WTH is going on!!!! is this going to crash!!!,manny,,0,2
3 months ago,NO investor interest? mere 300K,Rod Mac,,1,0
3 months ago,My God,people are going to get a heart attack b/cos of this name change! you shouldnt be on OTC market if your heart is going to go through hell like this.The string of numbers you see will be replace with new ticker symbol within 2-3 business days.hope this saves someone's heart!!!!!!,JOBIX,,11,0
3 months ago,Couldn't see it trading all day then markets close and its in the green? #$%$ What happened to the ticker today?,Elons Musk,,2,0
3 months ago,Jumps to $1.77 from $1.70. Is it a case of typo error, buying using iphone? lol.,Rod Mac,,1,0
3 months ago,$15M Revenue in Q3??  Wow.....what a gem!!,Lyfe,,1,0
3 months ago,lets see tomorrow, if it dip below $1.50, surely I will add more.,Rod Mac,,1,0
3 months ago,Lvl 2 is looking good might even finish green!,DotCN-BULL-Trader,,2,0
3 months ago,1.60-65 is good time to buy.,hamzh,,2,0
3 months ago,FIXED!!,..my Td account is  corrected.,aaronc,,7,0
3 months ago,Some good news out on TSPN.....do your own DD. https://www.globenewswire.com/news-release/2020/12/01/2137564/0/en/HUMBL-Mobile-App-and-HUMBL-Hubs-Merchant-Solutions-Deliver-Successful-Pilot-Transactions-Between-United-States-and-Mexico.html,aaronc,,1,0
3 months ago,https://finance.yahoo.com/news/peak-signs-agreement-italian-retailer-123000747.html,Bentley,,3,0
3 months ago,Mt TD account shows a string of numbers for a ticker with zero "0" value in the "market value" area. It's like it is completely wiped out.,aaronc,,0,0
3 months ago,Any ideas as to what up with PKK as of right now the bid/ask price is zero. Sup with that?,Mo Money,,3,0
3 months ago,not what I was expecting today....I thought it was going to go the other way.,Matt,,1,0
3 months ago,So much for Friday’s profits :/,jimmy,,1,0
3 months ago,why is this dropping man,Sonia Kiss,,1,0
3 months ago,free fall. after good earnings. why?,Rod Mac,,0,1
3 months ago,this thing looks halted today,George,,0,2
3 months ago,Great support at 1.84 CAD,DotCN-BULL-Trader,,1,1
3 months ago,any particular reasons for this dip, or just following the rest of the market?,Sven Erik,,1,0
3 months ago,Nice Dip,DotCN-BULL-Trader,,3,0
3 months ago,Looking forward to starting a position first thing Monday. Happy investing!,Kazi,,10,0
3 months ago,How much cash on hand does pkk have currently? Thanks to whoever answers. This company looks very interesting at this price with such a low share float.,Amerigovespucci,,1,0
3 months ago,$5 by EOY,Derek,,10,1
3 months ago,Long and strong. Five years! Regards.,Mahmood Hasan,,0,0
3 months ago,5000 Shares in 🚀🚀🚀,Daniel,,4,0
3 months ago,PKK through that $2.00 wall,Jeff,,10,0
3 months ago,boom,Rod Mac,,0,0
3 months ago,,Thadius B,,5,0
3 months ago,come on...break that $2....now,Rod Mac,,0,0
3 months ago,Here we go, break 2 and we’re free,Tony,,0,0
3 months ago,ATH baby,Dhruv,,7,0
3 months ago,How high is this stock expected to go?,Richard,,2,0
3 months ago,Added 1k today to my existing stash....  Thinking at this price....news...and trajectory.. Can I afford to not buy more?,Scott,,19,0
3 months ago,WHY IT'S NOT MOVING UP,Rod Mac,,0,1
3 months ago,Look at that volume 30 mins in, grabbed another 2k shares 1.88,Tony,,0,0
3 months ago,Here we go,Dani330i,,0,0
3 months ago,Grabbed 2k shares at 1.9 average what a gift!,Tony,,0,0
3 months ago,bye bye 2,DotCN-BULL-Trader,,0,0
3 months ago,liftoff....,Konstantinos,,9,5
3 months ago,Fellas the earnings report was fantastic. Revenue was 15.1 mill vs 11 million expected. CEO says company will be profitable in 2021, crushed earnings with 20,000 company pool of business and has now added 100,000 new businesses to its customer list. Fintech is highly profitable and this company has knocked the ball out of the park. This is your 10 bagger stock! Enjoy the ride my friends!,L,,19,0
3 months ago,Get ready!,DotCN-BULL-Trader,,0,0
3 months ago,Wait, so this company is now trading at 2x sales with revenues basically doubling every quarter. Holy #$%$ 10-bagger right here. I don't even know what they do.,Phillip,,1,0
3 months ago,Amazing revenue and more exciting moves with this beauty. Good luck everyone with this juggernaut 🤩🤩🤩,Georgi,,0,0
3 months ago,Game , set ,match :),Ben G,,2,0
3 months ago,Guys dont reply or thunbs down to Rod Mac. Hes a paid short, but only gets paid if u respond.....,Shannon,,1,0
3 months ago,premarket will start the trend. hope is upside.,aloecez,,0,1
3 months ago,Check out (http://Pick-stocks.com). They just mentioned PKK.CN in the daily newsletter.,loutsch,,3,3
3 months ago,They r doing amazing,George,,0,0
3 months ago,,phil,,4,0
3 months ago,$3-$4 tomorrow - boooooooom,Plums,,15,0
3 months ago,,P,,9,0
3 months ago,ER tomr and it cannot even end on a green. OVERRATED stock,Rod Mac,,0,18
3 months ago,I see fin tech has announced the results and they were quite good but the stock is down....anyone know why?,Andrew,,0,3
3 months ago,When 2$ gets broken for the first time, this is going straight up to more all-time highs,steven,,0,0
3 months ago,What time do the release earnings?,Edward,,0,0
3 months ago,Why would anyone sell on earnings day?,waynec,,0,0
3 months ago,ER REPORT TODAY AND WHAT THEY ANNOUNCE IS CHANGE NAME? WHAT IS THIS?,Rod Mac,,0,7
3 months ago,cURIOUS WHY MANAGEMENT HAS NO HYPE ABOUT er.,Rod Mac,,0,5
3 months ago,Who's excited for the ER today,Sam,,0,0
3 months ago,Tomorrow this is going to boom. Get your shares now, earnings report tomorrow!!,jimmy,,14,0
3 months ago,ER tomorrow and no interest?,Rod Mac,,2,2
3 months ago,Long and strong. Happy Thanksgiving to all of you ! Enjoying the ride. Have nothing against day trading but appreciate your giving away these great stocks ! Regards.,Mahmood Hasan,,0,0
3 months ago,hold on folks,DotCN-BULL-Trader,,0,0
3 months ago,Happy Thanksgiving to all. Feel blessed. Joined for the long ride. Regards.,Mahmood Hasan,,0,0
3 months ago,Lots of potential!,Finance AP,,0,0
3 months ago,All the deep DD you need,Ben G,,0,0
3 months ago,join the peak discordhttps://discord.gg/Qb8Se4k,Ben G,,1,0
3 months ago,Bought in today at 1.62. I was eyeing this last week at 1.3, better late then never,Sam,,0,0
3 months ago,Last chance for a ticket to $$,Taco Terry,,0,0
3 months ago,This is my biggest position I bought today and only red for me. I came in too late.,Rod Mac,,2,1
3 months ago,Sorry guys, I jinx it. I just come in and boom it dropped. lol,Rod Mac,,0,1
3 months ago,Way out in the cosmos on this one! Lets get it!!!!,DotCN-BULL-Trader,,4,0
3 months ago,Q3 Earnings report on thursday!!,Juan,,9,0
3 months ago,Officially buying in today. What can I expect moving forward? What are peoples targets with this? This seems too big to ignore?,Thadius B,,0,0
3 months ago,Bought in at 1.32 a week ago. I am having trouble modeling the revenus from the last 2 deals, but I sure can see very strong growth. Other deals will probably arise as well. The Chinese market is huge!,Serge,,9,0
3 months ago,i added on m'y position Friday morning. i was so happy. The whole night i keep saying to m'y wife wow now i got X shares of Peak and cleary she just dont care. im glad this board here existe!,phil,,12,0
3 months ago,Will this be on TSXV?,Thadius B,,3,0
3 months ago,This company has been operating since 2016 as a public company. Prior to July 28, 2020. They had almost 800M shares outstanding. As of July 28, 2020; they did a 10:1 Reverse Split. What is it that people are seeing here? What has this company been doing the last 4 years? Given the amount of time that they've spent, how come there is no growth? Why are they only coming out now to get their name out there? Are they looking for more investors money to keep the light on?,Allan,,2,2
3 months ago,I know we had a big run up yesterday, but after that news and interview yesterday thing thing should be shooting up to like $2.5 no?,Branden,,3,0
3 months ago,5.5mil + volume today!,DotCN-BULL-Trader,,0,0
3 months ago,Stay long. It will pay out. Don’t be surprised when this reaches double digits likes it’s peers in the fintech space. Growing in the fastest economy. The fact that this model can work in China- just means this platform and business model can work anywhere else in the world. China prob one of the most difficult spaces to operate as private business- model will be proven and replicated else where with ease. Crazy to say that if they just operated in China it would be enough money anyways. Extremely bullish. -,buraa,,0,0
3 months ago,Great Announcement. And because of that the Chart shows some change of trend direction. Hopefully this will hold and continue the new upward trend For those who have limited French like me here is the English version of the announcement.https://peakpositioning.com/peak-expands-new-financing-program-adds-2nd-distributor-with-over-250k-retail-clients/More,Jhay,,10,0
3 months ago,Hello Money My Old Friend!!!!,DotCN-BULL-Trader,,0,0
3 months ago,,Johannes Finn,,3,0
3 months ago,And most thought 60,000 potential businesses lending was as good as it gets 😎,steven,,0,0
3 months ago,let me get my glasses for this news,George,,5,1
3 months ago,Huge news today!,Branden,,11,0
3 months ago,game, set, match!,Ben G,,4,0
3 months ago,We will never see under a dollar again,steven,,0,0
3 months ago,Nice support for the last 2 weeks, priming!,DotCN-BULL-Trader,,8,0
3 months ago,This MF is waiting for launch! There is a deal closing this month is everyone expecting a big drop?,DotCN-BULL-Trader,,4,0
3 months ago,Morning fam,paulspicks2020-Youtube,,0,0
3 months ago,Nice volume today!,phil,,0,0
3 months ago,Peak LongsVolume was 443,000 today vs 106,000 avg. with an 11% gain. This is what we have been waiting for. It’s the beginning of a big move up. Get your DD in order.,L,,4,0
3 months ago,Holding at this point for last few days. It gonna explode soon to new ATH.,M@n€¥,,0,0
3 months ago,Good morning! Remember Peak is at their inflection point. The point where they will start exploding and scaling at a rapid pace. Its already happening wit the BDC deal  potentially doubling their ecosystem with one deal. Think about the revenue potential with that one deal not to mention the whole city's they are incorporating into the ecosystem. No longer a matter of if but only when. Personally loading up one last time under a $1.00 i believe the next leg is coming. GLTA,Ben G,,0,0
3 months ago,Does anyone know of any other competition in this space either in China or worldwide?,Chun,,0,0
