PostDate,Content,Author,Likes,Dislikes
last year,Peak Positioning Technologies Inc.'s Asia Synergy Credit Solutions (ASCS) subsidiary, which provides credit outsourcing services to banks and other financial institutions, has launched a WeChat mini program that allows potential borrowers to quickly see if they would qualify for loans from any of the ASCS lending clients. According to Wikipedia, WeChat counts over 1 billion monthly active users and has been described as China's "app for everything" because of its wide range of functions. In 2017, WeChat launched its Mini Programs to allow companies and developers to create mini-applications to run within WeChat. As of June 2019, WeChat had over 1 million Mini Programs for its users to choose from, from bike-sharing to food delivery and everything in between. To put that in perspective, Apple's App Store has been around since 2008 and had approximately 2.2 million apps listed as of June 2019. Mini Programs have quickly become an integral part of the marketing strategy of virtually every company, large and small, operating in China, including JD.com, Tesla and McDonald's to name just a few (see more on WeChat Mini Programs here: https://wechatwiki.com/wechat-resources/wechat-mini-programs-epic-tutorial-guide/). "With the popularity of WeChat and the explosion of Mini Programs, if you are in business in China and your business cannot be found on WeChat, it's almost as if you are not in business," commented Jiangang Qiu, CEO of ASCS. "Our new WeChat Mini Program will allow us to market our lending clients' services not only directly to potential borrowers, but also to intermediaries whose business is to find these potential borrowers. We see this as an essential marketing and business development tool that should have a considerable positive impact on our operations going forward," Mr. Qiu went on to say.More,cris,3,0
2 years ago,echo echo.  thoughts?,Gothamman,0,0
2 years ago,Peak Subsidiary ASCS Adds New Loan Servicing ClientMontreal, Quebec--(Newsfile Corp. - March 13, 2019) - Peak Positioning Technologies Inc. (CSE: PKK) ("Peak" or the "Company") today announced that its Asia Synergy Credit Solutions ("ASCS") subsidiary added commercial lender XinXin Micro Loan Company Ltd. ("XinXin") to its growing list of loan servicing clients.ASCS uses the Cubeler Lending Hub System to find and qualify loan candidates in addition to doing all of the administrative work related to the loans on behalf of its clients, thus providing end-to-end loan servicing solutions to banks and other commercial lenders.Under the terms of the agreement between XinXin and ASCS, XinXin will allocate up to 100M RMB (approximately CAD$20M) in loans to be serviced by ASCS, of which 1.3M RMB (approximately CAD$260,000) has now been disbursed in two separate loan transactions currently serviced by ASCS.The news comes less than a week after ASCS announced the first transactions related to a similar agreement to service up to CAD$1B in loans on behalf of the Wuxi Rural Commercial Bank. "We're very pleased to add XinXin to our list of clients," commented Mr. Jiangang Qiu, CEO of ASCS. "It's a great feeling to have our clients recognize our value proposition and the benefits of the Lending Hub System. Every new client we sign up makes it easier to sign the next one, which in turn increases our influence on the commercial lending industry. We are all very excited about what we're in the process of accomplishing through Peak's group of companies," concluded Mr. Qiu.About Peak Positioning Technologies Inc.:Peak Positioning Technologies Inc. is an IT portfolio management company whose mission is to assemble, finance and manage a portfolio of promising companies and assets in some of the fastest-growing tech sectors in China, including fintech, e-commerce and cloud-computing. Peak provides a bridge for North American investors who wish to participate in the continued digitization of China's industrial sectors through the latest advancements in technology. For more information: http://www.peakpositioning.comMore,cris,3,0
2 years ago,come on go up ..,manny,1,0
3 years ago,Stock halted today? zero volume,Mufasa,1,0
3 years ago,it's a great time to buy. this stock is hovering around its 52 week low. any good news comes out and it's should blow up,Tyler,2,0
3 years ago,Good news today!,BagHolder,3,0
3 years ago,I'm liking this. bought in,Noah,1,0
3 years ago,Bueller?  Anyone else here?,Mufasa,1,0
4 years ago,Why bother guessing when the next breakout play is coming, SmallCapCanada has a proven track record of finding the gems of the TSX, TSX-V, and CSE before they run big. www.smallcapcanada.com,julie,24,0
4 years ago,time for another look kids and no no rvs has taken place but interest is brewing and the share price is up nicely,Jim,0,0
5 years ago,did the stock do a reverse split, anyone,Raffaele Venturino,0,0
5 years ago,did the stock do a reverse split, anyone,Raffaele Venturino,0,0
