PostDate,Content,Author,RelativeDate,Likes,Dislikes
4 months ago,Fantastic breakout this morning! Currently up 25% as of this post at $0.75, their technology with algae and smokestacks will be essential for the future as companies and governments across the globe look for cheap, sustainable, and ecological ways to combat climate change and emissions. $POND's technology is perfectly suited to help curb emissions in the future while also being able to sell products made from the algae growth. Great way to wake up to this, will be holding my shares for the long run!,Harris,,3,0
4 months ago,Still waiting for volume.,Lucius,,2,0
4 months ago,wait what happened? lol,Ryan,,1,0
4 months ago,$POND Pond Technologies closed at $0.60 , with a market cap of $25.93 M following CEO Grant Smith’s recent business update ~~ Highlights :- He believes $POND is nearing an inflection point, positioned to execute on near term objectives- His focus as CEO on driving sustainable revenue generation across the organization.- $POND ’s substantial decrease in monthly overhead     -  The net cash outflow for 2020 =$1.5 million, as compared to $4.5 million in 2019. - $POND ’s new development of bioreactor designs appropriate for production of recombinant proteins for diagnostic, vaccine and therapeutic applications, + patents - advanced licensing discussions with multinational companies in the animal feed, food production, and oil and gas sectors, with expected deal announcements forthcomingsee full update https://www.accesswire.com/648135/Pond-Technologies-Holdings-Inc-Announces-Continued-Momentum-with-Business-UpdateMore,Jason,,1,0
4 months ago,Pond Technologies Holdings Inc. Announces Continued Momentum with Business UpdatePond Technologies Holdings is pleased to provide the following business update on the continued momentum being experienced across the organization.Recently released a corporate update that I believe the market is sleeping on. Not only did they reduce expenses significantly from $4.5 million to $1.5 million theyve noted that "we are in advanced licensing discussions with multinational companies in the animal feed, food production, and oil and gas sectors, with expected deal announcements forthcoming."When ESG picks up again this should be a winnerhttps://www.accesswire.com/648135/Pond-Technologies-Holdings-Inc-Announces-Continued-Momentum-with-Business-UpdateMore,Larry,,0,0
4 months ago,Transalta CEO discussing #CarbonCapture #CCS for it’s future power plant ‘Sundance 5’. https://calgaryherald.com/opinion/columnists/varcoe-under-new-ceo-transalta-approves-new-195m-wind-farm-eyes-carbon-capture-project?utm_term=Autofeed&amp;utm_medium=Social&amp;utm_source=Facebook&amp;fbclid=IwAR2BEyg6E_KfboR5B1K-LHytAoAA04A4IQktLqyvY_DaL4NnZMCmorDd01U#Echobox=1621336643Economics have been done on another project almost a decade ago, but carbon price and public pressure was a lot different back then. Now pressure is high, and the carbon price has sky rocketed creating another significant value in the economics moving forward.“The company must examine the types of technology it could use, whether the captured carbon will be utilized or stored, and if TransAlta will seek any project partners.” Pond Technologies once again proving they are ahead of the curve with this concept and its technology.More,5bagger,,0,0
4 months ago,$POND recently announced it has granted an aggregate of 200,000 stock options to eligible consultants under the corporation's existing stock option plan. Each option is exercisable for one common share of the corporation at an exercise price of $0.67 per share. Very excited for how this translates into the company continuing to develop their micro algae that recycles CO2 and has a high protein and antibodies properties. $POND dipping here after steady gaining since March. This is an easy place for me to add more and would not be surprised to see this pop back to $.70s soon.Current MC is $27.22M. Check out more here https://www.accesswire.com/647589/Pond-Technologies-Announces-Grant-of-Stock-Options-May-13-2021More,Lucas,,0,0
4 months ago,$POND is one I have high hopes for, especially considering the current climate crisis. With CO2 as the biggest contributor to greenhouse gas emissions, $POND has created an innovative model that works to combat climate change while producing valuable byproducts. They've also recently announced their entry to the XPRIZE Carbon Removal competition funded by Elon Musk (with a prize of $100M). (Link: https://www.pondtech.com/media-releases/press-release-former-carbon-xprize-semi-finalist-pond-technologies-announces-entry-to-elon-musk-sponsored-xprize-carbon-removal-competition/)More,May,,0,0
4 months ago,$POND has done great things in 2021 so far! Great chart,Prospector,,1,0
4 months ago,Algae is going to be one of those things in the future that we look back at and say "why didn't we take advantage of this earlier." $POND is effectively using algae to reduce emissions while also growing healthy, usable algae. The stock has been outperforming the market over the past 6 months and I think that the upwards momentum paired with increasing climate concerns will help the stock and the fundamental business grow over the next couple of years.,Harris,,2,0
4 months ago,Check out this clip of $POND ‘s technical advisor Steven Martin explaining the importance of $POND patenting their algae platform process as opposed to the product. In a market that seems to only be growing the ability to be frontrunners in the technology is not a far fetched thought. Current MC is $30.68M. Check the clip herehttps://www.youtube.com/watch?v=SreoVVHhDVcMore,Lucas,,0,0
4 months ago,$POND up today 7.5% to $0.72 with a market cap of only $30.47M. $POND is a technology company that profitably transform's CO2 from any source into valuable algae-based products such as bioproducts, food ingredients, or nutraceuticals. Algae is expected to be the future of plant-based feeds for livestock. Their resource efficient method requires minimal land and loses zero water. They've recently announced their entry to the XPRIZE Carbon Removal competition funded by Elon Musk (with a prize of $100M). (Link: https://www.pondtech.com/media-releases/press-release-former-carbon-xprize-semi-finalist-pond-technologies-announces-entry-to-elon-musk-sponsored-xprize-carbon-removal-competition/) POND currently has 9 US patents and 24 international patents in process globally. The annual global markets that algae can supply exceeds $400B. Using a greenhouse gas associated with global warming to create algae products is a game changer considering the current climate crisis, and I'll be sure to watch this one closely.More,May,,1,0
5 months ago,I'm buying POND.v first thing tomorrow here's whyTSX: POND.v- grow various species of algae faster and with better quality than any other method- 9 US patents + 19 international patents in various European and Middle Eastern countries.- global algae market = $400 Billion +POND algae are:- Protein source for humans and animals- Natural colorants - Dietary supplements - Complex proteins (medicines, vaccines, antigens)POND dipping below $.70s today where it’s been seeing solid support. Only 50K volume today so hardly any shares traded hands and seems most are holding. I think this will be a quick correction. Still only $28.3M market cap and very tight with only 42M shares. This thing can MOVE. One to keep a close eye on.More,Alex,,1,0
5 months ago,Pondtech creates algae output using CO2 industrial emissions. High in protein, Algae is expected to be the future of plant based feeds for livestock.   They express a strong interest for global expansion into India and Vietnam.  Their technology is protected by 9 US patents, and 19 international patents. POND will supply global markets that can exceed $400 B POND  down 4% @ $0.72 with a market cap of $30.47MMore,Jason,,1,0
5 months ago,who can convert C02 from any smokestack into profit using algae?! Game changer. There's no hotter area on Wall Street than ESG with sustainability-focused funds nearing $2 trillionhttps://www-cnbc-com.cdn.ampproject.org/c/s/www.cnbc.com/amp/2021/04/30/theres-no-hotter-area-on-wall-street-than-esg-with-sustainability-focused-funds-nearing-2-trillion.html,Larry,,0,0
5 months ago,POND.V 2021 Investor deck for anyone interested. I am particularly focused on how they can turn every smoke stack into profit by capturing CO2 with their proprietary Algae process. An environmental game changer. https://www.pondtech.com/wp-content/uploads/2021/04/Pond-Technologies-Deck-04.21.21.pdfMore,Larry,,0,0
5 months ago,Though recently stagnant, sitting at $0.73, $POND technology has developed a disruptive technology platform that has been proven to grow various species of algae faster and with better quality than any other method. The technology is protected by 9 US patents as well as 19 international patents and will supply global markets that can exceed $400 Billion. MC is $30.9M.  A company worth checking out https://www.pondtech.com/wp-content/uploads/2021/04/Pond-Technologies-Deck-04.21.21.pdfMore,Lucas,,0,0
5 months ago,Pond Naturals grows and sells Astaxanthin at its BC facility and currently has a patent pending for its all-natural extraction process. The facility produces a premium value astaxanthin which is nature’s highest anti-oxidant. Excitingly the facility is seeing technological improvements to deliver expanded capacity to produce and extract over $1,000,000 of astaxanthin per month. A company worth checking out https://www.pondtech.com/wp-content/uploads/2021/04/Pond-Technologies-Deck-04.21.21.pdfMore,Lucas,,0,0
5 months ago,POND is a tech  leader that allows industrial emitters to essentially recycle CO2 via the cultivation of micro-algae.  POND is ready to bring their A-game as they enter Elon Musk’s $100M XPRIZE Carbon Removal  COMPETITION.  As a former semi finalist in the 2017 XPRIZE, Pond is confident about the future in their journey of bold, radical tech innovation.  Pursuing largest incentive prize in history, in global climate race against time,  IMO POND is on a fast track towards undoubtable expansion. POND is down 4% today at $0.73, market cap $30.9M.More,Jason,,0,0
5 months ago,EVERY SMOKE STACK IS AN OPPORTUNITY FOR POND 🤯Innovation Energy: PondTech sees every smokestack as an opportunity, and algae is the future. The Financial Post visits the PondTech lab in Markham, ON, to get a glimpse into their potentially game-changing algae business in everything from health supplements to food and manufacturing.https://www.youtube.com/watch?v=XKwGqt3n3_0More,Larry,,0,0
5 months ago,Canadian Federal Government working hard to reduce emissions… “What was tabled on Monday was the promise to introduce an investment tax credit for capital invested in CCUS projects in 2022, following a 90 day consultation period with stakeholders.” POND has ample opportunity in this carbon capture and carbon capture utilization and storage (CCUS) industry. The world has a drastically far way to go to meet its goals – “according to the International Energy Agency, the world has a long way to go. We are only at five per cent of the 800 million tonnes (MT) of carbon dioxide that must be annually captured and sequestered by 2030 if we are to meet those goals.” https://www.cbc.ca/news/canada/calgary/road-ahead-carbon-capture-storage-federal-budget-yedlin-1.5994628 We Could Be A Leader in Canada's Quest to Reduce Emissions!! Love what is a head of us. only 5% of the global goal by 2030.... can you say, "BULL MARKET"More,Booga,,0,0
5 months ago,POND.V Former Carbon XPRIZE Semi-Finalist, Pond Technologies, Announces Entry to Elon Musk sponsored XPRIZE Carbon Removal CompetitionPOND prepares to enter the XPRIZE Carbon Removal competition which officially opened for applications today. Funded by Elon Musk and the Musk Foundation, this $100M competition is the largest incentive prize in history. Previously, Pond was a semifinalist in the 2017 global $20 Million NRG Cosia Carbon XPRIZE competition to transform carbon into useful products.This should bring lots of attention here to this company. The Xprize competition gets a lot of media coverage.https://www.accesswire.com/641779/Former-Carbon-XPRISE-Semi-Finalist-Pond-Technologies-Announces-Entry-to-Elon-Musk-sponsored-XPRIZE-Carbon-Removal-CompetitionMore,Larry,,0,0
5 months ago,New discord room was just made for investors interested in learning more about the company. https://discord.gg/ZBWZQyvSc9,Larry,,0,0
5 months ago,There is a pond discord server that just started up. Lots of good dd is being put in there for anyone wanting to dive deeper and follow the company.,Crypto,,0,0
5 months ago,Created a discord board for some of the longs would love to hear from some of you’s https://discord.gg/ZBWZQyvSc9,Luc,,0,0
5 months ago,These guys are cleaning the air and turning it into a health supplement. They are directly tied to 2 huge markets. Kind of impressive.,Lucius,,0,0
5 months ago,just found out about these guys, bought some shares, gonna do my dd and buy more if it seems right :),Ryan,,0,0
5 months ago,making some exciting developments in addressing the massive challenges of pollution. Big fan of an ethical investment, I've got high hopes for this one.,Larry,,5,0
5 months ago,I ain’t gonna lie I’m thinking this is a boring stock, which is good! This baby has the potential for excellent growth, I’m shocked there isn’t a lot of attention towards these guys. I’ll definitely be buy more once I have the opportunity! Remember do your own DD!,Justin,,0,0
5 months ago,I finally did invested and iam up 16% on my investment! That stock has a nice momentum since a few weeks,Ben From the North,,0,0
7 months ago,Iam interested to invest but the financials doesnt look good :-/ Not ready yet maybe?,Ben From the North,,1,0
7 months ago,About to dump tons of money in here. Let's go I'm excited.,Jordan,,0,0
7 months ago,Morningstar has placed at fair value at .90 . Great time to get a position or increase.,MightyMaz,,0,0
7 months ago,Clean tech is the future, lets hope these guys under a new CEO focused on pipeline and revenue growth can get them there. I like the product flow. Carbon capture and the byproduct can be sold to farms as feed.,Andrew,,0,0
7 months ago,Based on the volume increase recently, it appears more people are recognizing the great potential for this company.,MightyMaz,,0,0
7 months ago,#$%$ I think I missed the train...... I was gone for a few weeks and this jumps double my old position I had.... shiiiiiiii  I shoulda never sold...... :(,ploúsios,,1,0
7 months ago,This company is forward thinking and their technology for carbon capture will be in high demand in the up coming years; pollution, space travel to Mars, etc ....,Madoff,,2,0
7 months ago,Waiting for this to get back into the low 30 cent range ...,Mark,,5,3
7 months ago,I will wait more lower price for buying,Marco,,2,0
8 months ago,Elon + carbon capture = 💰,Madoff,,0,0
8 months ago,I'm trying to understand how the money changes hands with this company. It's not very clear who makes what money and when. For example, if they install one of their bioreactors on an industry CO2 emitting factory, and the algae is growing for them to harvest. Why does the factory pay Pond? Pond is using the factory's C02 emissions,  would Pond not have to pay them? It's cool that they're keeping C02 from entering the atmosphere, but how are their products doing?,Doofus,,1,0
8 months ago,Elon musk is looking for Carbontech companies... so far, this is the only one in Canada who's trading at stock exchange. A nice speculative play.,YLnavz,,8,0
8 months ago,Something leaked out!,John,,0,0
8 months ago,woah! what happened here?,Aiden,,0,0
9 months ago,Running out of cash, substantial dilution incoming. Hoping 2021 is POND's time to shine.,Connor,,0,0
last year,Having done my undergrad in science and biology, algal biomass reactors are very exciting. With the possibility of scale and usable byproducts, it would be awesome to see further commercial expansion and uses within green businesses. Buy now at a steal before it goes back up!,Jupitorre,,0,0
2 years ago,How many times has this outfit changed their name and its business model? Is it another P&amp;D on the Venture Exchange?,Doug,,0,0
2 years ago,So what does everyone think of ponds future? Iv been interested in this company for a while I think they could be massive one day, but what about the short term?,Kyle,,0,0
3 years ago,Wish we could get some news on where this is going or what's happening,GEORGE,,0,0
3 years ago,#$%$... 20% w/ no reason or ryhme,GEORGE,,0,0
