PostDate,Content,Author,RelativeDate,Likes,Dislikes
2 days ago,Bought today. This stock has multiple verticals that could explode! The risk vs reward to is too good to pass at these cheap levels,J,,1,0
3 days ago,13,24kg CO2e/kgH2 That is grey hydrogen production balance. Got this data from Greenpeace. Just don’t know the throughput jet of those facilities. I am interested in how pond tech deals with the co2 in terms of how much of it one bioreaktor sucks up during the process and how many bioreactor are nesecary to make it clean.,FragmentalOtto,,0,0
5 days ago,Can anyone show me a company that has successfully used this technology to turn their emissions into high protein algae and made a profit from said algae?,John,,0,0
6 days ago,Pond Technologies Holding Inc. up a bit after their announcement last week! On Sept 8, $POND / $PNDHF announced that they were teaming up with Livalta to grow and sell algae-based animal feed ingredients made from CO2 emissions.  The $POND CEO said the partnership will give their company global access to a multi bill animal feed market which is growing nonstop. He predicts big sales to come!!  The Ontario-based company has a mission to grow things safely, in a controlled environment, and they are making $$$ by transforming underused products into useful products for consumption!!  Best part- even after a huge boost last week, $POND.V still $.50 with a market cap of $23.3m  https://finance.yahoo.com/news/exclusive-pond-technologies-partners-livalta-120016877.htmlMore,partystocker,,0,0
9 days ago,Seems we have snappers under this algae infested pond.,Mike,,0,0
9 days ago,oooo la la  —$POND.C just added info regarding the participation of an insider in the non-brokered private placement offeringColmac Holdings Limited, controlled by Mr. Robert McLeese, Chairman of Pond, participated in the Offering and subscribed for 333,333 units of Pond - love to see this kind of confidence in the company. Makes sense as an investment in $POND is an investment in the future of carbon emission control - something now required by the majority of industries producing any CO2 emissions$POND.V will supply global markets that can exceed $400 B $POND still so cheap at $0.50 with several  groundbreaking projects on the go , market cap $23.3 M https://www.pondtech.com/media-releases/press-release-pond-technologies-adds-information-regarding-insider-participation-in-recently-completed-private-placement/More,Alex,,0,0
9 days ago,How is that?,FragmentalOtto,,0,0
11 days ago,Great news ! $POND.v / $PNDHF has resumed trading and we couldn’t have asked for a better day, up 11% after close, unreal. 	As more efforts are put towards reducing carbon emissions the demand for companies like $POND.v / $PNDHF will continue to grow. $POND.v / $PNDHF have managed to come up with many ways to use algae with intents of reducing carbon emissions. “A pioneering global partnership between our responsible proteins division Livalta and Pond Technology Holdings will create the world’s first commercially viable production of algae-based animal feed ingredients from&nbsp;CO2&nbsp;emissions.”  This is an excerpt from a fantastic article on $POND.v / $PNDHF I highly recommend you check it out: https://www.abagri.com/worlds-first-scalable-production-of-algae-from-carbon-emissions $POND.v / PNDHF $0.5 A share with a market cap of $25MMore,Tory,,4,0
11 days ago,Want special treats on the stock market?!? | www.StockTreats.com,Akhenaton,,0,1
11 days ago,Another market. Another contract.,Lucius,,0,0
12 days ago,$POND.c green at $0.49   Price been rising since last week   Market cap $23.07 M Demand for this tech STRONG asf y’all In a climate race against time, Any major industry which is producing CO2 rn (essentially every major industry) is mandated to have a green strategy involving the abatement of CO2 + ensure a minimal carbon emissions approach.$POND = “a highly undervalued player in this sector... and is an excellent investment prospect for microcap”https://smallcapsdaily.com/pond-technologies-a-true-pioneer-in-algae-based-green-technologies/More,Luke,,1,1
16 days ago,Volume up again, news for tomorrow?,Lucius,,2,0
16 days ago,Wonder what this stock will hit !,Mister,,0,0
17 days ago,Absolutely hyped to see that Pond Technologies ($POND $POND.v $PNDHF) is up 7% today! They're one of my favourite green biotechnology companies as their method to converts excess C02 emissions to algae-based products is game-changing. The growth potential for $POND.V is massive as the fight against climate change ramps up.,Waves,,2,0
17 days ago,https://financialpost.com/financial-times/oil-and-gas-pipeline-industry-tries-to-reinvent-itself-with-carbon-capture-plans,Daniel,,1,0
20 days ago,With greenhouse gas emissions being a huge problem right now, there is high growth potential in the carbon capture industry and $POND.V is one of my favs in the green tech space. Might take a little longer till they start making money but I think this method to use greenhouse gases to create algae products will be game-changing.,May,,1,1
26 days ago,$POND has a great product in a growing industry. Add that to the multiple revenue streams; it looks pretty cheap at $20M. They recently completed a $1.5M offering which will also help fund current/future operations.,jerome,,0,0
27 days ago,With RNG becoming more and more relevant they could sell their bioreactors rampant and all algea that come out of it over demand could go to biogas facilities. Something has to happen.,FragmentalOtto,,0,0
last month,Here is an old but gold BNN interview that explains how $POND.V 's carbon recycling tech works, and where $POND stands in the green technology space. It also goes over some of their partnership with oil sands and cement companies.https://www.youtube.com/watch?v=F90sN9w6MEsMore,StockHawk,,0,0
last month,Pond Technologies Holdings Inc. ( $POND.V $PNDHF ), a biotechnology company focused on growing algae with CO2 emissions, announced yesterday that they closed a non-brokered private placement offering of 3,333,333 units of Pond @ $0.45 per Unit.The aggerate gross proceeds of this deal is $1.5M. Each Unit was comprised of one common share of $POND and one-half Common Share purchase warrant. Each warrant entitles the holder to buy one half common share @ $0.60 $POND is expected to use the net proceeds of this deal for general working capital purposes.$POND 's stock price is so far stable today, trading @ $0.47full article here: https://www.accesswire.com/660236/Pond-Technologies-Announces-Closing-of-1500000-Unit-OfferingMore,StockHawk,,0,0
last month,POND.v closes the week even 	ive been following $POND.v for a while and have been a huge fan of what they do and what their technology does for the planet and the future. The most recent news ive heard from pond is they have teamed up with a Canadian oil-sand producer and Fortune 500 company to grow covid-19 antigens that can be expressed from a unique strain of algae 	I think this great news for $POND.v because they continue to find new ways to use their technology for different fields	 showing adaptability for the times. $POND.v will produce these antigens for a cover-19 rapid diagnostic at a commercial rate. They intend to enter a commercial agreement to sell antigens/antibodies from genetically modified algae as a way to generate additional revenue for them	$POND.v continues to make big deals, its becoming a staple of the company and is imperative for sustaining growth of the company and brand. Not one to sleep on imo. https://ca.finance.yahoo.com/quote/POND.V?p=POND.VMore,Tory,,0,0
last month,Hope they go on to sell their farms as well. For the sake of our climate and not to run into a shortage of algea. When Pharma just started to perceive algea as the better base for therapeutics this market alone could become huge in unpredictable time.,FragmentalOtto,,0,0
last month,Keeps getting better and better. Awesome news.,Lucius,,2,0
last month,Best time to get in is now! Fantastic news and only the beginning of many more wonderful things to come!,Bernard,,3,0
last month,Smashed the average volume the last two days upwards. Still a bit low, but its getting more attention, and that is usually for a reason.,Lucius,,1,0
last month,$POND bounced back today rising 6.7% to $0.48CAD/sharePond Tech ( $POND.V ) is most well known for its ability to capture CO2 from industrial emitters by using it to grow algae. This algae can then be used for animal feed. However, algae also has several lesser-known uses:1. Human Nutrition:  Pond's powdered health supplements have antioxidant and anti-inflammatory properties. They are Vegan GMO and gluten-free2. Household items: Algae biofoams can be used to make apparel &amp; footwear, biodegradable plastic containers used in food &amp; beverage. Algae can also be used to make organic cosmetics.3. Petroleum Feedstock: Algae can be used as an ecologically friendly feedstock for petroleum derivatives like biofuels, bioplastics, and green chemicals Compound annual growth rateSubstantialThis algae market is worth $35B (USD) and is projected to be $45B by 2023. It is growing at a compound annual growth rate of 5.2%. More here: https://www.pondtech.com/algae-products/More,StockHawk,,0,0
last month,Gaps have been filled, we are very close to the bottom. Id expect it to start slowly moving upwatds. Carbon capture and algae are the future.,Lucius,,0,0
2 months ago,Pond Tech ( $POND.V ) is a biotechnology company that is most well known for turning CO2 from industerial edmitters into algae that can be used for animal feed and more.However, they also specialize in creating genetically modified algae and nutritional products. Their organization has 3 main branches:1.  Pondtech sells and licenses $POND 's CO2 capturing techonology and equipment to engineering companies, project developers, and others who work with industrial emitters 2. Pondbiotech Grows genetically modified algae that express complex proteins used in diagnostics, therapeutics and medicines. This modified algae is expected to be the standard for livestock feed in the future 3. Finally, Pondnaturals produces and formulates custom blended nutrition products Currently after this odd day on the market POND is on a slight discount,  selling at @$0.45 market cap $19.34 MYou can check out the lesser known branches of their organization here: https://www.pondtech.com/More,StockHawk,,3,0
2 months ago,If you like this business model our hesitate cause you doubt the use of algea, check out Fermentalg for more.,FragmentalOtto,,1,0
2 months ago,As the demand for technology aiding in carbon reduction is rising I’ve got my eyes on $POND.v $POND.v utilizes carbon rich sources, like industrial plants, to cultivate algae that “eat” the carbon and they harvest said algae for: - Nutraceuticals- Superfoods - Aquaculture / animal feed$POND.v is starting to see a rise after a bit of a dip last week which is to be expected given the craziness of the market providing a solid opportunity to load up. Currently at $0.46 a share with a market cap of $19.698M I came a across this article about a private carbon emission reduction company Climeworks:https://www.cnbc.com/2021/07/23/these-companies-are-sucking-carbon-from-the-atmosphere.html?__source=iosappshare%7Cnet.whatsapp.WhatsApp.ShareExtension however, a lot of attention is on, companies like $POND.v and investors are loving it so don’t miss this opportunity to get in before they blow up !More,Tory,,1,0
2 months ago,It does it again.,FragmentalOtto,,0,0
2 months ago,POND.v is deriving value from industrial emitters in  3 different streams - Pondtech     - Involved in the sale and licensing of $POND ’S CO2 abatement technology and equipment    - Sells to project developers, engineering companies, funders ,and others working with industrial emitters - Pondbiotech     - Grows genetically modified algae that express complex proteins used in diagnostics, therapeutics and medicines.     - Expected to be the future in livestock feed. - Pondnaturals     - Is engaged in the production and formulation of custom blended nutrition products POND @$0.47 market cap $20.41 MMore,Alex,,1,0
2 months ago,,Nas,,0,1
2 months ago,What’s happening?,FragmentalOtto,,0,0
2 months ago,Long term play with these bad boys do your DD!!! Going to be buy all the small dips as much as I can this is a multi-baggers,Justin,,0,0
2 months ago,Pond Technology (Ticker: POND.v)  is a company that has developed a disruptive technology platform that has been proven to grow various species of algae faster and with better quality than any other method.  I had no idea what they used algae for so I took some time to check it out as it caught my eye and its pretty incredible the diversity of what its used for and I think it could be a really worthy investment.   Pond’s focus on high-value algae are:  Protein source for animals and humans (vegan and renewable) Natural food colorants (Pepsico, Kraft, Coca Cola and the Mars candy company continue to use synthetic food colors); Nutraceuticals (dietary supplements and food additives) and Complex proteins used in the development of antigens, vaccines, medicines and diagnostic equipment.  Has anyone else checked them out? Thoughts?  If you think you might be interested you should give them a look here: https://www.pondtech.comMore,Corey,,1,0
2 months ago,POND Tech ( $POND ) captures CO2 output from industrial factories with biotechnology They do this using micro-algae with feeds and grows from CO2This micro-algae can then be used in animal feed Algae is expected to be the future in animal livestock as it is very high in protein (you can read more about that here: https://making-biodiesel-books.com/algae-bioproducts/algae-animal-feed/) They are in licensing discussions with several animal feed, food production, and oil/gas companiesAs the market has been doing bad generally today, $POND.V  is selling @ $0.42CAD, MC $18.05M, so now is a good time to get in on the cheap if you aren't alreadymore about them here: https://www.pondtech.com/More,StockHawk,,0,1
2 months ago,@StockHawk Almost all industrial factories produce CO2 emissions. However, with POND Tech ( $POND ) this CO2 output can be captured with biotechnology This micro-algae technology allows industrial CO2  emitters to turn their CO2 pollution into animal feed Algae is expected to be the future in animal livestock as it is very high in protein   $POND.V  is selling @ $0.48CAD, MC $20.84MAdditionally, they are in advanced licensing discussions with several animal feed, food production, and oil/gas companiesyou can learn more about them here: https://www.pondtech.com/Also, this CEO interview has a lot of info: https://www.youtube.com/watch?v=ydyTEJa76i4+More,StockHawk,,2,0
2 months ago,Pond Technologies Holdings Inc. ( Ticker: POND.v  PNDHF ) an ESG company addressing global sustainability challenges of climate change and nutrition, announced John M. Farah Jr, Ph.D to the Board of Directors.  John M. Farah Jr, Ph.D has over 30 years of experience in health care and the biopharmaceutical industry   Going through Johns resume, He’s done a lot of amazing work but there was some big names that really stood out  “He started his industry career as a research investigator in neurosciences and immune-inflammatory programs at G.D. Searle &amp; Co. (now Pfizer).” “John began advising small to mid-sized firms after 19 years at  Cephalon (now Teva)”More,Corey,,2,1
2 months ago,Despite, climate change posing a growing threat, the production of CO2 emissions is a side effect of the majority of production chains. However, the technology to minimize CO2 output is here POND Tech ( $POND.v ) has micro-algae technology that allows industrial CO2  emitters to essentially turn their CO2 pollution into animal feed Because algae are high in protein it is expected to be the future in animal livestock. POND grows algae using the carbon emissions from factoriesTherefore, the CO2 is contributing the livestock market rather than to climate change  $POND.V  is selling at $0.485CAD with a small market cap of just $20.84Myou can learn more about them here: https://www.pondtech.com/More,StockHawk,,1,1
2 months ago,I thought this was good news,FragmentalOtto,,0,0
3 months ago,Great news, steady growth in this industry. They were sold out of 12mg regenurex for a little while too. Sales are taking off in that branch too.,Lucius,,0,1
3 months ago,$POND $POND.c an ESG company addressing global sustainability challenges of wellness and climate change just announced that it has received a purchase order for an initial engineering study from CVS Midstream Solutions Corp. Upon completion of the engineering study and a positive Final Investment Decision by CSV, the first stage of development would be an algae plant that would supply Pond with an enhanced supply of astaxanthin. Pond is currently selling micro-algae derived antioxidant astaxanthin under its Regenurex brand and the enhanced supply of Canadian grown astaxanthin and would serve as an additional revenue stream for Pond Naturals.Great news for POND as they continue to expand their facilities for the production of micro-algae that allows industrial emitters to abate and ultimately recycle CO2, meaning good for $POND is good for the environment.$POND is up 1.8% , current MC is $25.06M.Check it outhttps://www.accesswire.com/653538/Pond-Technologies-Announces-Engineering-Contract-with-CSV-Midstream-Solutions-Corp-for-Construction-of-an-Algae-Plant-Utilizing-CO2-from-an-On-Site-Natural-Gas-PlantMore,Luke,,0,0
3 months ago,To fight climate change the Canadian government is likely going to be tightening regulation on companies emissions. Therefore, companies that specialize in capturing emissions are going to be increasing in demand.Pond Technologies ( $POND.CN ) is based in Ontario and they specialize in feeding CO2 emissions to algae. The algae not only stops the CO2 from going into the air, but it can also be used later for animal feed and even fuel.  This company seems really exciting and  they are selling for about only .58 right now Their CEO did a good interview a couple years back, you can check it out here: https://www.youtube.com/watch?v=ydyTEJa76i4More,StockHawk,,3,0
3 months ago,$POND announced today sale of its petroleum and natural gas assets in the Pembina Area, Alberta. Highlights from the news release: - Agreement is with Grizzly Resources- Grizzly will assume all abandonment and reclamation liabilities related to the assets, giving Pond more flexibility, the ability to clean up their balance sheet, and allows them to continue their aggressive growth path - Grizzly will pay up to $2.25M in future conditional consideration to Pond from the Pembina asset Currently sitting at $0.62, this game-changing carbon capture company has a tight share structure and a mc of only $26.79M. LOTS of growth potential in the carbon capture industry, I'm looking forward to hearing about Pond's initiatives underway in the upcoming months!Here's the link to the news release: https://www.accesswire.com/652636/Pond-Technologies-Holdings-Inc-Announces-Sale-of-Pembina-Petroleum-and-Natural-Gas-AssetsMore,May,,0,0
3 months ago,This company needs exposure,Lucius,,1,0
3 months ago,Check out this great video that breaks down $POND. It discusses Share structureImportance of using algae against carbon $POND ‘s patented technologyGrowing Market opportunity $POND ‘s strong management teamEtc. $POND up 1.6% , MC is $27.22M. Check it outhttps://www.youtube.com/watch?v=Z8u9Te4mKi4More,Luke,,2,0
3 months ago,33.6 million float is nothing, this will move with just exposure,Lucius,,0,0
3 months ago,I very much like the technologie and idea to turn carbon into algea. I don’t supplement but I also invest in bioplastic which will grow demand for biomass. I wrote an email to ask wether they could turn a whole gas to hydrogen plant to zero emission. Unfortunately no response because I can not really figure that out from the data on their website neither data from a Gas to hydrogen plant. I consider this one of their main pros because hydrogen will grow in demand very quick over the next years and we need the renewable Energie for the grids.,FragmentalOtto,,0,0
3 months ago,On top of the enviro solutions, I been taking their Regenurex and it honestly makes me feel great, and gives me energy. Huge market for supplements, and their competition is weak,Lucius,,0,0
3 months ago,CO2 is the single largest contributor to greenhouse gas emissions and is a huge problem the world is facing right now. Being one of the few public companies that focuses on carbon capture, this green energy stock is game-changing imo. Their recent financials showed solid improvement, they have a tight share structure, and an innovative method to transform CO2 into algae-based products. My fav green tech stock right now!,May,,0,0
3 months ago,POND.v POND is a tech  leader that allows industrial emitters to essentially recycle CO2 via the cultivation of micro-algae. They are Currently pursuing largest incentive prize in history, in global climate race against time, for Elon Musks Xprize of $100 M. High in protein, Algae is expected to be the future of plant based feeds for livestock.   $POND is  in advanced licensing discussions with multinational companies in the animal feed, food production, and oil and gas sectors, with expected deal announcements forthcoming. $PONDHF will soon be supplying global markets that can exceed $400 B $POND.V @ $0.65, mc $28.09 MMore,Jason,,0,0
3 months ago,$POND is currently one of my favourite companies in the green tech space. At $0.65 today with a mc of only $28.09M, Pond is one of the few public companies that focuses on carbon capture. This one has LOTS of potential as the carbon capture industry will experience high growth in the upcoming years due to the shift towards an increased focus on tackling climate change.,May,,1,0
3 months ago,For investors looking to get exposure to green tech, $POND is one to check out. One of the few public companies focusing on carbon capture, Pond profitably transform's CO2 from any source into valuable algae-based products such as bioproducts, food ingredients, or nutraceuticals. Their recent financial statement's for Q1 ending March 31, 2021 showed improvement with a 58% increase in Pond Naturals Rev, a positive working Capital of $532,000, and a decrease in net loss by $31k. I expect this growth to continue as they have strong re-order levels, new clients onboarding, and increased order volume from customers. With the current climate crisis, the carbon capture industry will experience lots of growth in the future and this innovative method that uses greenhouse gases associated with global warming to create algae products will be huge.More,Matty,,3,0
3 months ago,Check out this company that provides profitable solutions to the global health and wellness challenges of climate change and nutrition through a proprietary growth platform, including patented advanced photonics that optimizes key growth inputs in order to provide a controlled environment that maximizes the growth of algae and other organisms. This video breaks down $POND ‘s process and the benefits it provides, which is currently protected by 9 US patents as well as 19 international patents in various European and Middle Eastern countries. Annual global markets that algae can supply exceed $400 Billion.Current MC is $28.52M. Worth checking out https://www.youtube.com/watch?v=l2FhmB7IqgoMore,Luke,,0,0
4 months ago,$POND is one of my favourite companies targeting the rapidly growing sustainability sector because of their unique technology. They use bioreactors to grow algae and reduce emissions with the algae while simultaneously harvesting the grown algae for use in other items such as medicine and plastics.They have the idea and the technology to back the picture, all I’m waiting for now is for the company to scale the tech across the continent/globe. I’m not selling any shares at the current levels because I can see this being a $1.00+ stock in the future because of climate change concerns and the scaleability of $POND’s tech.More,Jordan,,2,0
4 months ago,What happened to the Discord? I don't see it anymore???...,N!T!N,,0,0
4 months ago,$POND just released Q1 financial statements ending March 31, 2021 (unaudited) some of the highlights include:- 58% YOY revenue growth led by the sales of ingredients and Regenurex astaxanthin products.- $532k of positive working capital- Decreased the Q1 net loss by $31kTheir use of algae bioreactors connected to smokestacks to decrease emissions and rapidly grow algae in a CO2 enhanced environment is a genius idea. As climate change discussions by governments increase they’re going to focus on EV’s, renewables, and carbon capture. Over the next decade, I expect a lot of growth in the carbon capture industry letting $POND capitalize on the growth. Honestly, this one is a longterm holdMore,Harris,,0,0
4 months ago,For those that have been here for a while, can anyone tell me why they have negative earnings and when they are forcated to go positive ?,Matlab,,0,0
4 months ago,POND.V Pond Technologies Continues Growth as Pond Naturals Receives White Label Order from U.S. Client"As compared to 2019, Pond Naturals revenue grew 24% in 2020 to nearly $4.5 million. With continued strong re-order levels, new client onboarding, and ongoing discussions in regard to entering new formulation verticals with CPG and CBD companies, Pond anticipates continued growth in 2021 and beyond. "https://www.accesswire.com/649418/Pond-Technologies-Continues-Growth-as-Pond-Naturals-Receives-White-Label-Order-from-US-ClientMore,Larry,,0,0
