PostDate,Content,Author,RelativeDate,Likes,Dislikes
10 months ago,Wow quite the news release today! I bet nobody saw that one coming. I'm willing to bet their partner could be 'The Boring Company'. Tesla and Elon Musk are always looking at better, outside of the box type ideas to revolutionize what they're doing. Who else would look to plasma torches for tunneling? PYR is killing it these days, its too bad overall markets are down, but when you look at how well PYR share price has held, that tells you just how strong they're doing relative to most other industries right now. Great Job guys!,Jeff,,1,0
10 months ago,Up .02 today - did we get another million this week?,lawrence,,1,0
10 months ago,After today's really good news,  could we have some more on the pure silicon front.,lawrence,,1,0
10 months ago,It certainly was worth it,lawrence,,0,0
10 months ago,Great news today, Millions of dollars will be pouring into PYR coffers every week over the next couple months. Perfect timing during this Covid Meltdown. Means the company will have plenty of cash on hand to operate and fulfill this contract. At a time of great uncertainty in the world PYR is showing they can still get business done!,Jeff,,1,0
10 months ago,http://www.globenewswire.com/news-release/2020/03/23/2005020/0/en/Drosrite-International-LLC-Receives-First-Payment-under-US-17M-Contract-with-Radian-Oil-Gas-Services-Company.html,Jeff,,1,0
10 months ago,Certainly hope today's "stop Trade" is worth it.As always....,lawrence,,4,0
10 months ago,Plasma torch may be the solution to Covid-19.,Thoughtfully,,0,0
11 months ago,Just maybe the pellet business may lead to some follow-on orders.  As always....,lawrence,,0,0
11 months ago,Wasup - with hindsight, which is always 20/20, you were right-on as this company has not a sale from any of its technologies in many months.  Not even any smoke let alone any fires.As always....,lawrence,,0,0
11 months ago,When the news hits the wire the stock price will jump and there will be no looking back as sales and contracts soar,james,,1,0
last year,No news is good news.,Thoughtfully,,0,0
last year,Going to buy back in at 10 cents.,wasup,,1,2
last year,Special theory of stock price relativity: The value of a foreign stock in a local currency is relative to the relative strengths between the local and foreign  currencies and the strengths of the local currency at the time of the buy and sell. General Theory of stock value relativity:The value of a stock trade is relative to the relative strengths of the currencies which were used to buy and sell it.Simplified: If you purchase this stock in dollars and the dollar gets stronger than the canadian dollar expect to lose money and vice versa.That said I think the company is due for some good news and the dollar is due for a correction.Somebody probably said it better before.More,Thoughtfully,,0,1
last year,Sold mine. Something is wrong here. I will wait until the new year to buy back in.,wasup,,0,0
last year,Scooby - please post one or announcements of the deal done and $6.4 million collected.,lawrence,,1,0
last year,My error - PYR has attended this Philadelphia conference in the past but not this year.,lawrence,,0,0
last year,Whoop Whoop up 2.7% today!!!,Thoughtfully,,0,0
last year,PYR will be attending a conference in Philadelphia next week.  Perhaps they will announce the big DROSRITE deal being completed at that time,lawrence,,1,0
last year,Now here's a real opportunity for DROSRITE:Helena, Montana - At the Anaconda closed copper mine there's a copper slag pile measuring 2,600 feet long by 2,100 feet wide by 275 feet tall containing 26.5 Million tons of slag.  Contact the EPA as they don't have much use for it and they're thinking of covering it with 18 inches of dirt and growing grass on it.,lawrence,,1,0
last year,Where is the good news that the mega DROSRITE deal is done and $6 million is in the till - about a month late!!!!!!!!!!!!!!!!!!!!!,lawrence,,0,0
last year,WOW! PYR must be in desperate need of Christmas Party money. LOL,wasup,,1,0
last year,Up 2% today!,Thoughtfully,,0,0
last year,@Lawrence dig into Emirates Global Aluminum,MacD,,0,0
last year,PYR must need more money. Dig into the shares again.,wasup,,0,2
last year,Not sure I ever saw this until today so here it is:Metal recovery system targets smaller facilities29 June 2018PyroGenesis' Drosrite System.PyroGenesis' Drosrite System.Powder producer PyroGenesis Canada has developed a smaller version of its Drosrite system for metal recovery, designed for small facilities.According to the company, Drosrite is a salt-free, sustainable process for maximizing metal recovery from dross, a waste generated in the metallurgical industry. PyroGenesis' patented process can avoid costly loss of metal while reducing a smelter's carbon footprint and energy consumption. The company says that the system can increase metal recovery from waste, without producing any hazardous by-products, while at the same time reducing operating costs.The Mini-Drosrite System can economically process 500 tons of dross/year when compared to the 3,000-7,500 tons/yr processed by PyroGenesis’ larger system.‘This smaller system enables us to target thousands of smaller facilities which were not originally in our target market,’ said CEO Peter Pascali. ‘We have targeted three main dross streams; aluminum, copper, and zinc, each divided between primary, secondary and casting producers. Presently we are focusing on the three segments within aluminum dross.More,lawrence,,4,0
last year,Let's consider what we have in holding PYR:- Additive materials- 10% of HPQ, which is using PYR's plasma arc tech for solar cell applications-  DROSRITE, first use in aluminum and potentially copper - Iron ore pelletization- Waste to energy incineration and syngas generation- Municipal waste water treatment- U.S. NavyAll but the last are game changers, company makers and disruptive technologies and they're all wrapped up in PyrogenIsis.More,lawrence,,2,0
last year,Mac D  Should we be expecting an overdue update on plasma torch opportunity shortly?  I can see DI being involved in this opportunity as waste to energy is a real world-wide opportunity, IMO,lawrence,,0,0
last year,From yesterday's PR: ....selected other Middle Eastern countries....Here's a article from 2013 showing there's a lot of potential possibilities for DI to garner additional sales:https://gulfbusiness.com/top-10-largest-aluminium-smelters-in-the-world/More,lawrence,,0,0
last year,Little more about the Saudi Aluminum plant - world's largesthttps://www.alcoa.com/saudi-arabia/en/default.asp,lawrence,,1,0
last year,PR out on a DROSRITE deal around 2 p m today - nothing but positive.  Should be interesting to see how the PPS reacts over the next few days.  Now if something meaningful can come from the #$%$ outfit JV we could be off to the races.,lawrence,,1,0
last year,Big news on drossrite front!,Bill,,1,0
last year,Had a thought while taking a dump today - most of my best thinking occurs the.  How about this scenario:  This deal is going down late last week and despite PYR's best efforts to keep it quiet the fear was that the deal would be leaked before it was signed off on so they halt trading after Friday's close and despite Mac's tease about Monday there's still unresolved issue/s so the silence continues.  Tomorrow, I'll have another BM and maybe I'll have another story.,lawrence,,0,1
last year,2 days and nothing!  When and if this "wonderful" PR comes out it better be really good else I would expect the PPS to drop materially.As always,lawrence,,0,0
last year,Any news on here. Or did we loose our money.,wasup,,1,0
last year,MacDAny idea what the annual capacity of the Swedish pellatizing unit is?ThanksMore,lawrence,,0,0
last year,Lots of irons in the fire for PYR and here's another one as MacD says PYR owns 10% of HPQ:HPQ and Apollon Assessing Manufacturing Porous Silicon Wafers for Li-Ion Batteries8:30 am ET September 25, 2019 (Globe Newswire) PrintHPQ Silicon Resources Inc. - TSX-V: HPQ; OTCPink: URAGF; FWB: UGE ("HPQ" or "the Company") is pleased to announce the extension and the expansion of scope of the December 2017 collaboration agreement with Apollon Solar SAS, ("Apollon"). The agreement now includes evaluating manufacturing porous Silicon wafers for solid-state Li-Ion batteries using Apollon patented process and Silicon (Si) produced by HPQ PUREVAP(TM) Quartz Reduction Reactor ("QRR") ("PVAP Si").APOLLON PATENTED LOW-COST APPROACH TO MAKING POROUS SILICON WAFERSIn 2012, Apollon, working in collaboration with France CNRS ("Centre National de la Recherche Scientifique"), developed and obtained a worldwide patent for a unique low-cost process that uses standard metallurgical Silicon (2N to 4N+ Si) to produce square porous Silicon Wafers with a thickness of up to 2 cm."The HPQ PUREVAP(TM) QRR's proprietary capacity of controlling the purity of the Silicon (Si) produced should allow our unique and patented process to optimize the porous structure of the wafers between Microporous (pore size &lt;5nm), Mesoporous (pore size 5nm - 50nm) and Macroporous (pore size &gt;50nm) as per end-users requirements, simply by adapting process parameters" stated Mr. Jed Kraiem Ph.D, General Manager of Apollon Solar.Working with Apollon, HPQ intends to develop the manufacturing of porous silicon wafers using PUREVAP(TM) Si that can be used as anodes for solid-state Li-ion batteries."Combining Apollon's patented low cost approach to make porous Si wafers and the HPQ PUREVAP(TM) Gen3 Pilot Plant's ability to produce Si will allow us to start the commercialisation of our porous Si wafers for solid state Li-Ion batteries earlier then most competitors, who are still only earlier stages R&amp;D plays" said Bernard Tourillon, President &amp; CEO of HPQ Silicon Resources Inc. Mr. Tourillon added: "Production of the first porous Silicon test wafers could start as early as Q4 2019."GLOBAL ENERGY STORAGE MARKET READY TO EXPLODEA recent report projects that energy storage deployments are estimated to grow 1,300% from a 12 Gigawatt-hour market in 2018 to a 158 Gigawatt-hour market in 2024. An estimated US$71 billion in investments will be made into storage systems where batteries will make up the lion's share of capital deployment. Research suggests that replacing graphite materials with Silicon anodes in Li-Ion Batteries promises an almost tenfold (10x) increase in the charging capacity of batteries."Silicon potential to meet energy storage demand is generating massive investments. HPQ, working with Apollon, fully intends to use its first mover advantage in low cost porous Silicon (Si) wafer manufacturing using metallurgically produced PUREVAP(TM) Silicon (2N to 4N+ Si) to attract investors and commercial interest" said Mr. Tourillon.About SiliconSilicon (Si) is one of today's strategic materials needed to fulfil the renewable energy revolution presently under way. Silicon does not exist in its pure state; it must be extracted from quartz, one of the most abundant minerals of the earth's crust and other expensive raw materials in a carbothermic process.About HPQ SiliconHPQ Silicon Resources Inc. is a TSX-V listed company developing, in collaboration with industry leader PyroGenesis (TSX-V: PYR) the innovative PUREVAP "Quartz Reduction Reactors" (QRR), a truly 2.0 Carbothermic process (patent pending), which will permit the transformation and purification of quartz (SiO2) into Metallurgical Grade Silicon (Mg-Si) at prices that will propagate its significant renewable energy potential.HPQ is also working with industry leader Apollon Solar to develop:-- Porous silicon wafers manufacturing using PUREVAP(TM) Silicon (PVAP Si) that can be used as anode for solid-state Li-ion batteries; and-- A metallurgical pathway of producing Solar Grade Silicon Metal (SoG Si) that will take full advantage of the PUREVAP QRR one-step production of high purity silicon (Si) and significantly reduce the Capex and Opex associated with the transformation of quartz (SiO2) into SoG-Si.HPQ focus is becoming the lowest cost producer of Silicon (Si), High Purity Silicon (Si), Porous Silicon Wafers and Solar Grade Silicon Metal (SoG-Si). The pilot plant equipment that will validate the commercial potential of the process is on schedule to start in 2019.This News Release is available on the company's CEO Verified Discussion Forum, a moderated social media platform that enables civilized discussion and Q&amp;A between Management and Shareholders.More,lawrence,,2,0
last year,Latest PR re iron ore pelletizing  Encouraging - maybe.  I'm leery only because other promising uses appear to get an order or two and then we don't hear a peep for months, ex. DROSRITE.  Here's an interesting article especially Sections 1 and 6.  Enjoy!https://www.intechopen.com/books/iron-ores-and-iron-oxide-materials/iron-ore-pelletizing-process-an-overview,lawrence,,1,0
last year,MacDLink please,lawrence,,0,0
last year,Many months since we last heard a peep about the DROSRITE business - no more deals  and nothing about the JV partner.Not encouraging!As always....More,lawrence,,1,1
2 years ago,Bill:Read my latest posting on ZMS' board,lawrence,,0,0
2 years ago,Part 1Thanks to Google, Startech is the oldest of the two plasma arc technology companies.  Never would have remembered the name but I do go beck long before 2007 which is the article date and I do recall deciding to pitch the 1 inch file of articles on Startech's history that I accumulated thru the years when I read that they went bankrupt in 2013.  So here's the article: https://www.popsci.com/scitech/article/2007-03/prophet-garbage/All I can say is that Startech's $240 million price tag is very probably why they couldn't continue in business and now I'm wondering how PYRO get's away with a $3.64 million price tag.More,lawrence,,0,0
2 years ago,Today's PR re a land based waste incineration use for the plasma arc tech was a pleasant reminder of much earlier efforts by a couple of companies that were doing the same thing as long ago as maybe 20 years ago.  Can't tell you the number of times I've thought of them as PYRO's story has unfolded thru the last couple of years holding the stock.  I'll have more to say about my previous experiences with this application of the plasma arc tech in a few days.  What I'll leave you readers with is that this application has huge potential for PYRO (bigger IMO than anything else except for DROSRITE), IF they can pull this off and the future deals are structured the right way which I think PYRO has the brains to do.As always, time will tell.More,lawrence,,1,0
2 years ago,https://www.pyrogenesis.com/wp-content/uploads/2019/06/PyroGenesis-Announces-3.64M-Non-Military-Land-Based-Waste-Treatment-System-Sale-First-Payment-Received.pdf,Snowman,,0,0
2 years ago,About time for some encouragement on the DROSRITE front either from our secret JV partner or a sale by PYRO.  Been many months without anything on this front.As always....,lawrence,,0,0
2 years ago,PYR has existing relationship with US navyhttps://3dprintingindustry.com/news/u-s-navy-expands-its-metal-3d-printing-capabilities-157039/,Snowman,,0,0
2 years ago,2nd tranche done with another 10 million fully diluted.One thing to be aware of is that NASDAQ, I believe, requires these startups to be above $1 else they eventually get delisted so, if this is threatened by the authorities, look for a reverse to happen.  Just a heads up as it's happening with another of my holdings as I write this. Need some good news like ORDERS!More,lawrence,,0,0
2 years ago,There's a video of the pouring of high-grade silicon from the PUREVAC2 system on HPQ's web site.,lawrence,,1,0
2 years ago,HMMMMWith today's PR, when all is done there'll be ~150 million outstanding and probably 200 million fully diluted.  Just the fact that they're going to the cash well as often as they are tells me that they don't see this business as being on a breakeven basis for the rest of 2019.  Three legs to this enterprise and they all need props.  It is what it is.As always....More,lawrence,,1,0
2 years ago,RAPID + TCT 2019Cobo Hall, Detroit5/20 thru 5/23Booth 1631Would have been disappointed if I didn't find PYRO's name on the exhibitors list.  Don't expect to see much in a 10 X 10 area but would like to meet some of the principals.Going to try to get there tomorrow.More,lawrence,,1,0
2 years ago,How do these private placements work? I’m assuming they are diluting, but instead of just issuing new shares these are already purchased. Do they hurt the stock price?,Bill,,0,0
2 years ago,There is an interview on HPQ website with PYR and HPQ CEOs. It won’t let me post the link on here, tried a few times.I found the interview informative with a few hints at future events,Snowman,,1,0
2 years ago,Spreading the word re PYRO and I would think that a lot of eyes have seen the article and maybe that's the reason why the PPS has perked up lately.https://3dprintingindustry.com/news/pyrogenesis-reports-fy2018-earnings-anticipates-imminent-contracts-of-32-million-154846/?goal=0_695d5c73dc-7ac3f8bc9d-64691477,lawrence,,0,0
2 years ago,PYRO's year -end results etc are out today.  Reason to be optimistic about the future.  One thing I noticed is the $51 million loss carryover - oh to see that load eaten up by future profits.As always....,lawrence,,0,0
2 years ago,Bill, drop down  a few posts to view my earlier post from today,lawrence,,0,0
2 years ago,I don't see my post from today so here it is again.  Be sure to watch the video in the article re use TI powder to see a bucket of the powder being loaded into the AM machine and then what it produces with the powder.  ENJOY!!https://3dprintingindustry.com/news/aeroswift-successfully-3d-prints-0-5-m-tall-large-scale-airframe-for-uav-154488/,lawrence,,2,0
2 years ago,Bill, Mac - When PYRO gets it's act together on the 3 fronts that count: powders, DROSRITE and ultra pure Silicon, this company will be an absolute winner BUT don't hold your breath waiting for that day which I think is sometime this year.,lawrence,,0,0
2 years ago,https://finance.yahoo.com/news/pyrogenesis-announces-potential-contract-over-130500927.html,Bill,,1,0
2 years ago,BillI'm having fun with another Canadian firm, GROW.V or BLONF.,lawrence,,0,0
2 years ago,Let's hope the AM spin-off is completed in half the time since it was first discussed maybe a year ago.  Since this won't be completed for a number of months, that will give them time to complete additional deals/orders that should put some meat on this skeleton right now.,lawrence,,0,0
2 years ago,HMMMMMMMMMMMWe have a Stop Trading Today.  Hope the coming PR helps us have a Happy Easter.As always....More,lawrence,,0,0
2 years ago,halted.eom,Gord,,0,0
2 years ago,HPQ had and interesting PR released a couple of days ago.  Anybody know how much of HPQ is owned by Pyro?,lawrence,,2,0
2 years ago,Another encouraging PR out today,lawrence,,0,0
2 years ago,PR out today which is nice but leaves me with a number of questions that I will pose to Pete today and any answers I will forward.  I imagine others will have the same questions so he just might do one of his Q&amp;A PRs.,lawrence,,1,0
2 years ago,https://www.navsea.navy.mil/Media/News/SavedNewsModule/Article/1745546/navy-awards-contract-for-construction-of-two-carriers/This could be related to yesterday’s buying,MacD,,0,0
2 years ago,Nice price and volume action so far today and no news either.As always....,lawrence,,1,0
2 years ago,Where's PYRO?https://3dprintingindustry.com/news/3d-printing-industry-awards-2019-materials-company-of-the-year-update-148031/?goal=0_695d5c73dc-13525b53c7-64691477,lawrence,,0,0
2 years ago,Note the picture credit in the attached articlehttps://3dprintingindustry.com/news/metal-powder-industries-federation-publishes-standards-for-additive-manufacturing-147460/,lawrence,,2,0
2 years ago,Sure enough, Q3 for the unit's fabrication but that had to be record time for signing the deal.,lawrence,,0,0
2 years ago,Obviously pure speculation by me but we haven't seen any more orders for DROSRITE systems in a few months and I'm thinking that everybody is waiting for the tolling JV to be formalized to see whether it's better to toll their dross rather than commit millions to owning a unit.As always....,lawrence,,0,0
2 years ago,Today's PR re a iron ore/fines pelletization use for their plasma arc tech.First it was Titanium and hopefully a number of other hard metals used in the AM business and now this.  This could another great use for the plasma arc tech but I don't see it gaining much traction in 2019 as, if the deal goes thru, it will take the rest of the year to build the unit, site it, test it and then, if the new owners let it, be demoed to other interested parties.  Here's something on iron ore pelletization I found on GOOGLE that gives one the flavor of just what the worldwide potential for this application.https://www.researchgate.net/publication/279804825_Iron_Ore_Pelletization_Technology_and_its_Environmental_Impact_Assessment_in_Eastern_Region_of_India_-_A_Case_StudyAs always, time will tell.More,lawrence,,1,0
2 years ago,80,000kg tear for 3D printed crane hook, we are heading in the right direction with all thishttps://3dprintingindustry.com/news/huismans-3d-printed-waam-hook-lifts-80000-kg-load-127564/,Snowman,,1,0
2 years ago,Starting to see bigger and bigger parts being made by additive manufacturing. https://3dprintingindustry.com/news/damen-shipyards-worlds-first-3d-printed-propeller-121112/,Snowman,,1,0
2 years ago,Titanium 3D printed Brake disc caliper test. This is the future for a lot of thingshttps://youtu.be/hPkY8nBWxoU,Snowman,,3,0
2 years ago,Additive mfg predictions for the coming years - let's see how they play out.https://3dprintingindustry.com/news/idc-2019-predictions-attributes-2-billion-in-new-spending-related-to-3d-printed-products-145138/,lawrence,,1,0
2 years ago,Great news today seems everything is on track the exclusivity of Drosrite tolling only is a pretty good indication that the JV is progressing.,MacD,,0,0
2 years ago,There is now a PYR Investors Group on Facebook.,MacD,,0,0
2 years ago,Another player in the AM powder business with a 1st year goal of 1000 tons.  PYRO's mentioned at the bottom.Tekna, one of the few companies in the world to produce 3D printing powders by gas plasma atomization, has signed an MoU Luxembourg steel specialist Aperam.Together the companies have agreed to co-develop spherical metal powdered feedstock for use in 3D printing and metal injection molding (MIM).The news follows Tekna’s $5.5 million investment in the expansion of production facilities in Sherbrooke, Québec.Tekna and Aperam metalsGas plasma atomization at Tekna ensures the production of powders with a controlled grain size and sphericity with a high level of purity. For additive manufacturing in particular, its range of powder encompasses Ti64 titanium, Tungsten Carbide, Tantalum, and Molybdenum, a common addition to steel and stainless steel alloys. In addition to spherical powders, the company also makes nanopowders.Since the expansion of its facilities in Quebec, Tekna is on track to increase the production of both its powdered products to over 1000 tonnes per year.Aperam, on the other hand, produces steel and stainless steel in bars, strips, wire rods and plates. In addition to its Luxembourg headquarters, the company has sites across 18 European nations, Russia, Asia, the Middle East and North and South America. This includes 2.5 million tonnes of flat stainless steel capacity in Europe and Brazil.A depiction of Tekna's ICP process. Image via Tekna.A depiction of Tekna’s ICP process. Image via Tekna.Metal powder strategyThis new partnership with Aperam is parts of a wider, growth strategy at Tekna, as Luc Dionne, CEO of Tekna Plasma Systems, comments, “This agreement is a major step in Tekna’s growth strategy in the markets of additive manufacturing.”For Aperam, Tekna offers the opportunity for the company to expand its reach beyond its existing steel products. “We are very proud of today’s agreement with Tekna, which is part of our strategy to further transform our business and address the next generation needs of our customers through new technologies,” says Timoteo Di Maulo, CEO of Aperam, “This collaboration also enables us to further consolidate our leading position in the Nickel alloys and speciality steels markets.”Notable competitors of Tekna, and now Aperam, in the plasma atomized metal powders market include AP&amp;C, now a part of GE Additive, and Pyrogenesis, headquartered in Québec, Canada.Recently, AP&amp;C teamed up with the National Research Council of Canada (NRC) to develop a method for anaylzing metal additive powders, and Pyrogenesis is currently in the midst of its ‘industrialization plan‘ having seen the completion of a new metal powder production facility.More,lawrence,,3,0
2 years ago,I believe we are very close now to having PYR shares finally move up to previous highs and beyond. I can see the share price forming a new base in the mid sixty cent range for a short time and any positive news release on the JV (which could come at any time) should see meaningful share increases especially considering the insiders control more than 50% of the stock. Exciting times just around the corner!,The Realist,,2,0
2 years ago,Posters on stockhouse have pointed out Sojitz Group as the probable Japanese trading house. Not that it matters as this is excellent news.,MacD,,1,0
2 years ago,That was a real nice PR out today.  I hope they have a signed JV before year-end as I would think the #$%$ company has a fill-in-the-blamks contract in their desk.As always....,lawrence,,2,0
2 years ago,This is going to fly today.,Patrick,,3,0
