PostDate,Content,Author,RelativeDate,Likes,Dislikes
4 months ago,Garbage stock. They should burn all stocks with their plasma torch and put it to good use.,Lasalle,,1,10
4 months ago,Triple P too good. Best CEO ever,Dan,,8,1
4 months ago,PYR went up to fast and now going back to reality. Same with HPQ. It will go back to a reasonable price next news release.,wasup,,1,5
4 months ago,What’s going on with this drop today?,Carm,,1,0
4 months ago,When will it go back to $6+? Still holding,Aerodynamic,,2,1
4 months ago,Uplist around the corner. Client A signing around the corner. Agreement with a US tunneling company 1.4.2020, -&gt; Update around the corner. What about client B&amp;C? A lot of news to be released, I'm not going anywhere.,Elmacojr,,9,3
5 months ago,Love the news, I been researching a lot about this company!,El fuego,,4,2
5 months ago,I think that this is short lived. The market is a little mixed up right now and will continue until the end of the month. I'm not buying anything until the market cools down.,wasup,,3,5
5 months ago,Finally US navy news. Watch this climb next couple days!,Dan,,10,5
5 months ago,here we good. markets blood red and were putting out amazing pr.,Tyler Shorrocks,,3,0
5 months ago,Mr. Pascali is a master at keeping our expectations in check. It’s either no news or news with no expectations baked in. We all know this company is a winner, but he keeps the hype to a minimum. It grows on its own merit.,Bill,,3,4
5 months ago,Please explain "plug and play"  for the tech re pelletization as I just can't imagine it being that easy as the phrase implies.Thanks,lawrence,,0,0
5 months ago,Oh my!!!!!!!PR released after the close today.  Nothing's done YET but get a signed deal, which should take few weeks I would expect.  If and when done, lets hope there's more follow-on then we've seen from previous applications.  This could be a grand opportunity.As always....More,lawrence,,3,4
5 months ago,Stonks always go up eh,Aerodynamic,,0,0
5 months ago,￼non believers!!!!!!!,daniel,,2,1
5 months ago,LETSS GOOOO,RoninHoffmann,,2,0
5 months ago,https://finance.yahoo.com/news/pyrogenesis-participates-hpq-non-brokered-121500514.html,Bill,,1,1
5 months ago,This is the wrong quote. PYR is actually up 4 cents.,wasup,,0,0
5 months ago,anyone have a clue why this took a dive?,Duncan,,0,0
5 months ago,what happened for this stock to drop soo hard?,Mr Wiggles,,0,0
5 months ago,huge drop...?,Dillon K,,0,0
5 months ago,It's the type of cie that turns a trader into an investor. All their patented plasma technologies are at a turning point, just turned its first profits, great margins and lots of growth this year only with Drosrite. This contract alone will bring millions each year in tolling royalties. Good luck bringing this powerhouse down blan, you should switch sides, being short is gonna be bad for your wallet.. Never forget it's one of if not THE biggest plasma expertise cie in the world. I will probably retire next year thanks to PYR/HPQ.  Good luck to longs and shorts, don't touch plasma experts, you'll get burned.More,Pitpitcolisse,,1,2
5 months ago,what's up with the drop.. is this another Robert Mcwhirter flunk like ATE??,Stock Time,,2,3
5 months ago,any updates?,Stock Time,,0,0
5 months ago,Hummm: Manufacturing of Si nano powders is not yet commercially feasible with selling prices of US$ 30,000/kg.3,Nick-1,,1,0
5 months ago,Any updates?,daniel,,0,0
5 months ago,Eps is $0.04 as of july 29.  With share price at 4.188 currently that puts p/e at 104.7.  Pyrogenesis is profitable and securing contracts.  I might wait and see if price will drop any more before entering to get a more justifiable p/e.  Any thoughts?,Duncan,,3,1
5 months ago,what's up,Stock Time,,0,2
6 months ago,We thinking NR today? I'd like to see a Navy update or possibly uplist eta?,Ramon,,3,0
6 months ago,Why is this an $800m market cap?  They have a backlog of up to $38m...seems like an extreme valuation, what else is going on with this company?,Andrey,,1,4
6 months ago,Got in today.  Looks like a promising business model.  If it pays off, I got a winner.,Anonymous,,6,1
6 months ago,so this is what happens when people put stop losses lol. they get triggered. who would've thought. never put stop losses on stocks popular with shorters,Ramon,,5,2
6 months ago,Why is there two stock listings ? What is the difference between the two?,Kevin,,0,0
6 months ago,Waiting for a test of $5 to add more.,Haas,,0,0
6 months ago,guy walks into the casino says I'm taking in $1000 and at the very least walking out with $1000.. can't do that in reality.. but I think you can say with PYR take a chance $1000 stop limit sell at the price you bought in.. am I missing something?,Stock Time,,2,0
6 months ago,when this uplists we are on a fast track to the $10,Ramon,,4,1
6 months ago,Maybe an insider trading some shares to help pay for things. Or just profit taking.,wasup,,1,2
6 months ago,Is it a good timing to buy ?,Gabriel,,4,4
6 months ago,happy I got in last week!,Stock Time,,8,1
6 months ago,Another great week ahead! Congrats long. Multi billion contracts coming soon,Louis,,4,1
6 months ago,very cheap price,Pascal,,4,1
6 months ago,I don't get it PE ratio is over 35. Why people keep buying?,Omar,,2,3
6 months ago,I am happy I took position here. It seems people in this company know what are they doing and the company will have a bright future.,Haas,,6,1
6 months ago,any opinions on a good entry point now??,Stock Time,,2,2
6 months ago,Dividend possible?,daniel,,0,2
6 months ago,What do people think the price could be in 5 years?,Cailean,,0,1
6 months ago,https://finance.yahoo.com/news/pyrogenesis-confirms-total-receipts-over-190600222.html,Bill,,0,0
6 months ago,Nice try, blan2.,Max,,4,1
6 months ago,Wealth Simple app is a fraud,Kevin,,2,3
6 months ago,What a bold move by Peter! Granting options to his employees is such a great decision. The price point is very telling. He is helping to ensure the success of all his people and not just himself. Having the options vest over time, allows them to follow the price rises of the stock he is expecting, doesn't drop a ton of shares on the market at once, and ensures employees are motivated and excited about building a great company. When you take into account the fact they bought open market shares since april, which are then cancelled, there's no dilution really with these options. He simply took public shares out, to allow room for employee shares in their place, while also receiving money to the company to fuel operations. Incredibly wise moves, this guy is gonna be CEO of the year!!More,Jeff,,11,3
6 months ago,Q2 profitable, possible spinoff with shares for holders of pyrogenesis, contracts still trucking along, uplisting very close. Sounds like a good q1 report to me :),Ramon,,12,2
6 months ago,Q1 financials posted!!!! Looking awesome and Q2 will 100% be profitable. Go long and ride this ticket til the end of the year and you'll be thankful.,Dan,,9,2
6 months ago,Trading halt today - for what????,lawrence,,1,0
6 months ago,This is the diamond in the ruff that I got into big time three years ago. This baby will be shinin bright by next year and will afford me to retire at 58. My average is .60 a share but get in as many as you can before $5 and you will be set 5 years from now. By then, even $5 would have been a good buy in. I have never posted this before in my 15 years of trading, but if you miss this, you miss possibly one of the few that can make a person very wealthy and never have to worry about anything. Ok, maybe.... only what kind of cars you want to put in your three car garage.,PEET ROZE,,10,2
6 months ago,Posted this earlier and it was taken down...don't let the "Liars" on this board steer you in the wrong direction. Pyrogenesis is ideally situated to increase in value. https://stockhouse.com/companies/bullboard?symbol=v.pyr&amp;postid=31251669,CrazyCanadianPete,,4,0
6 months ago,What y’all not telling me ?!😅,Brett,,0,0
6 months ago,joined the party on the dip...thanks @CrazyCanadianPete,Grant,,3,0
6 months ago,PYR just provided update on current share price changes. basically telling traders to calm down saying quote: "investors can take comfort from the fact that PyroGenesis has never been on more solid ground" "backlog is increasing to record levels, pipeline growing exponentially and balance sheet cleaned up". Basically shorts, cover your #$%$,Ramon,,4,1
6 months ago,this company has a monopoly. calm down. the whole market is red and the gains here were insanely fast. patience till next NR,Ramon,,6,2
6 months ago,PYR went up in stock price far to fast and doesn't make the amount of money to see a hike like this.,wasup,,2,2
6 months ago,The technology is unique, so would be the upside potential once the anticipated sales start to happen !!,OCEAN,,1,2
6 months ago,stop loss at $3.85 Just got my money back. *sigh*,YLnavz,,0,3
7 months ago,Ouch - looks a blow-off top was achieved.. I hope they'll surprise with positive news,Robert,,2,0
7 months ago,pump and dump going on,Bozmozaivic,,2,8
7 months ago,I question if this rally is sustainable. how low will the pullback going to be? my price limit buy is $9.8 lol. short sellers pour some water to this heat!,YLnavz,,0,0
7 months ago,Is it to late or will it be shorted?,Brett,,0,0
7 months ago,For any investors new here, you have to check out some of the info on Agoracom. The CEO Peter Pascali actually frequents the site and provides answers to questions that have been posted. There is a 70 minute Q&amp;A video from June 18th...a really good confidence builder in the company, if you are unsure about it's potential.,CrazyCanadianPete,,3,0
7 months ago,but why?,Bubba Gump,,0,0
7 months ago,What can push PYRO and HPQ so fast and so high ? Somebody may whispering something? An in 2.32 and 16 cents. A dream...,Mario,,0,0
7 months ago,what the heck is this rally all about??? I'm not complaining and I'm actually happy... but what the hell! lol,YLnavz,,2,0
7 months ago,is this a stock,Bozmozaivic,,0,2
7 months ago,Encouraging to see there's been good follow-on to late Thursday's PR.,lawrence,,5,0
7 months ago,Unreal I was in on this company at .70cents last year was not doing anything at this time and is up almost 500% since then.,Ryan,,1,0
7 months ago,It hit $3.80...nice jump.,CrazyCanadianPete,,0,0
7 months ago,Bids already at 3.50$ be ready for take off,Woodoo,,1,1
7 months ago,Several months back, Cleveland Cliffs bought my company, AK Steel. On our internal webpage they posted a “talk to Lourenco “ link. This was for suggestions, ideas, etc. Lourenco Goncalves is their CEO. I sent them the Pyrogenesis article dated April 30 about reducing GHG’s for iron ore producers. I wonder if Client C, is them. Even it it isn’t, it looks like we are on our way, gentlemen.,Bill,,5,0
7 months ago,Be ready for another huge day !,Elmacojr,,3,1
7 months ago,Awesome news to end the day!,CrazyCanadianPete,,5,0
7 months ago,Looks like they always release good news right after late filing,pj,,2,0
7 months ago,This announcement just restates that they will be announcing 1st quarter results on or before July 16. Nothing new.,Bill,,3,1
7 months ago,MACSo glad you educated Zac by filling in the holes in his DD.Looking forward to a update on pellet co 1's testing - don't want any missteps.More,lawrence,,2,0
7 months ago,Search Pyrogenesis, Agoracom interview and watch it. Unlike Blan, what Peter says is truth and comes to fruition in due time. Don’t believe me search it for yourself. You’re looking at the investment of a lifetime,MacD,,2,0
7 months ago,And I was looking at this stock when it was .23,MkGrowth,,0,0
7 months ago,MacD is right.,Elmacojr,,2,1
7 months ago,Quick Summary for anyone new. Pyro has been in business for 30 years. Clients include, NATO, DARPA, US Navy, Carnival, Fincanteiri. Partnership include, Aubert and Duval, Sojitz, Radian Oil and Gas, Research Institute of Sweden (RISE), un-named tunnelling company (Suspected to be Arcbyte). Radian contract was 20 years $55 mil contract that started paying in March. 25 mil first year revenue. $2 million in warrants were recently converted. $10 mil of warrants in the money. 3 mil convertible debentures recently retired. Announcement of two potential torch clients. If these clients commit 1.8 Billion worth of torch sales. $10 million payment coming from US Navy on waste destruction systems for aircraft carriers.More,MacD,,6,1
7 months ago,2019 is now public and it certainly looks like they cleared the books of all the bad stuff so 2020 and hereon should be clear sailing.As always....,lawrence,,1,1
7 months ago,cutting edge technology on the verge of market disruption. do your DD, check the company's 2020 NR, you'll understand why I wont sell 1 share.,Pitpitcolisse,,1,0
7 months ago,First quarter results being posted next month. It should represent more of the current situation for the company.,Bill,,3,1
7 months ago,Is it HPQ that's hyping PYR today?  Heavy trading in both stocks today.As always....,lawrence,,0,1
7 months ago,HMMMMMMMMMMIs it the coming 10Q or hopefully something more exciting that's perking the stock today?As alwaysMore,lawrence,,0,1
7 months ago,Looks like we might have 3 spinoff candidates in the near/intermediate future.  Pete may have to set up a separate division just to handle all the goings-on for administering all the activity BUT, first, things have to fall into place.As always....,lawrence,,1,1
7 months ago,Ultee  Yes be sure to read all the PRs especially today's,lawrence,,1,0
7 months ago,big contract discuss !!!!,René,,1,1
7 months ago,many projet for cie and big money for profit...the techno is breveté and very good...,René,,0,2
8 months ago,I'm thinking about taking position in this stock. I don't know anything about this stock. Any idea or suggestions please?,Ultee,,0,2
8 months ago,2019 year end report coming up probably won’t show any of the million dollar payments that have come through yet from the 25 million drosrite deal. Next months first quarter 2020 report should, right? The first quarter report hopefully will be a lot better.,Bill,,1,1
8 months ago,You may want to take the 2 away from the 2.50 Ed. This has happened before, great news huge pump and the was cut in half in a few days. Good company though. I hope it doesn't happen again.,wasup,,0,0
8 months ago,dumped at the end of trading beware! There may be more downside,Robert,,2,0
8 months ago,Even on a down day, this stock still wants to move up...,CrazyCanadianPete,,0,1
8 months ago,Insider selling. One lump sell at opening.,wasup,,0,0
8 months ago,Mac D thought cement producers were a good possibility for plasma arc.  Here's something about cement making that seems to be  needing like PYRO's tech to answer the heating problem:Kiln fuelsUsed tires being fed mid-kiln to a pair of long kilnsFuels that have been used for primary firing include coal, petroleum coke, heavy fuel oil, natural gas, landfill off-gas and oil refinery flare gas.[13] Because the clinker is brought to its peak temperature mainly by radiant heat transfer, and a bright (i.e. high emissivity) and hot flame is essential for this, high carbon fuels such as coal which produces a luminous flame are preferred for kiln firing. In favorable circumstances, high-rank bituminous coal can produce a flame at 2050 °C. Natural gas can only produce a flame of, at best 1950 °C, and this is also less luminous, so it tends to result in lower kiln output.Alternative fuelsIn addition to these primary fuels, various combustible waste materials have been fed to kilns. These alternative fuels (AF) include:    Used motor-vehicle tires    Sewage sludge    Agricultural waste    Landfill gas    Refuse-derived fuel (RDF)    Chemical and other hazardous wasteCement kilns are an attractive way of disposing of hazardous materials, because of:    the temperatures in the kiln, which are much higher than in other combustion systems (e.g. incinerators),    the alkaline conditions in the kiln, afforded by the high-calcium rawmix, which can absorb acidic combustion products,    the ability of the clinker to absorb heavy metals into its structure.A notable example is the use of scrapped motor-vehicle tires, which are very difficult to dispose of by other means. Whole tires are commonly introduced in the kiln by rolling them into the upper end of a preheater kiln, or by dropping them through a slot midway along a long wet kiln. In either case, the high gas temperatures (1000–1200 °C) cause almost instantaneous, complete and smokeless combustion of the tire. Alternatively, tires are chopped into 5–10 mm chips, in which form they can be injected into a precalciner combustion chamber. The steel and zinc in the tires become chemically incorporated into the clinker, partially replacing iron that must otherwise be fed as raw material.A high level of monitoring of both the fuel and its combustion products is necessary to maintain safe operation.[14]For maximum kiln efficiency, high quality conventional fuels are the best choice. However, burning any fuels, especially hazardous waste materials, can result in toxic emissions.[15] Thus, it is necessary for operators of cement kilns to closely monitor many process variables to ensure emissions are continuously minimized. In the U.S., cement kilns are regulated as a major source of air pollution by the EPA and must meet stringent air pollution control requirementsMore,lawrence,,2,1
8 months ago,So I was talking to a guy at work today about this great company I just bought into on Friday...and how we had a 25% pop today. I mentioned the name and started rifling off the same spiel I did below and he says "I watched a documentary about that on the weekend...they use torches to burn garbage on navy ships."...well I ask what was it? and he says "A plastic ocean, it's on Netflix"...I came home and decided to check it out, and for those that don't care to watch the whole hour and 40 minutes, it's at the 1hour and 10 minute mark...there is a brief, less than 2 minute clip of a air craft carrier and some footage of at least a replica of what is being provided from PryoGenesis...Name is mentioned and company name on the screen. I keep getting these little signs in the past week, all pointing to this company...just bizarre. I also noticed, the documentary is dated 2016...and again, story has been out there for years, and I'm just hearing about it. Still feeling like I'm late to the party, and watching the price climb with only a tiny investment...at least I have my foot in the door.More,CrazyCanadianPete,,0,2
8 months ago,BillCheck out your Zecotek - it's been trading lately and looks like a revamped WEB site,lawrence,,0,0
8 months ago,Certainly keeping momentum,S,,2,0
8 months ago,My Oh  My,  well over a million traded so far today on no news, naturally,lawrence,,2,0
8 months ago,This is why I'm in...….10 plants x 50 torches each x $3M per torch = $1.5 BILLION. Just one company... Others will follow.,Phil,,2,0
8 months ago,Cemet!!!!!!!There's that word "sintering" which we saw in the iron pellet process and it's used with temps up to 1450 degrees.  Sure sounds like a perfect use for the plasma arc tech PLUS i remember reading years ago that used tires were used in the incineration process as a cheap source of heat - not good.Cement manufacturing is a complex process that begins with mining and then grinding raw materials that include limestone and clay, to a fine powder, called raw meal, which is then heated to a sintering temperature as high as 1450 °C in a cement kiln. In this process, the chemical bonds of the raw materials are broken down and then they are recombined into new compounds. The result is called clinker, which are rounded nodules between 1mm and 25mm across. The clinker is ground to a fine powder in a cement mill and mixed with gypsum to create cement. The powdered cement is then mixed with water and aggregates to form concrete that is used in construction.More,lawrence,,3,1
8 months ago,this was just broadcast on BNN...get ready for a pop.,CrazyCanadianPete,,0,0
8 months ago,This looks odd to me . 840k shares bought and it stalled. It just doesn't work that way. Fishy smell.,wasup,,1,5
8 months ago,With this stock for debt deal, how much of HPQ will PYRO own?,lawrence,,0,0
8 months ago,Sure wish the company would give us clueless stockholders a whiff of the news that's pushing the stock's PPS,lawrence,,1,0
8 months ago,Somethng's afoot,lawrence,,1,0
8 months ago,Thought there might be a status update on the last 3 stages of the pellet situation but NO.  Maybe something on Tuesday.As always....,lawrence,,0,0
8 months ago,Here's a good read on possibly going for an uplisting to NASDAQ:The NASDAQ is the second-largest stock exchange by market cap in the world. As an American exchange, it has listed over 3,100 companies with average daily share trading volume at over two billion. NASDAQ has handled more IPOs than any other exchange. Since 2000, NASDAQ boasts over 1,000 Initial Public Offerings. What follows is a brief description of what NASDAQ is and what it takes to be listed on that exchange.What does NASDAQ stand for? It’s an acronym for National Association of Securities Dealers Automated Quotations.What are the rules to be listed on NASDAQ? To be listed on the NASDAQ exchange and reporting system, the following requirements:    Shareholders Equity of at least $2,000,000    At least 100,000 shares of public float    A minimum of 300+ shareholders    Total assets of $4,000,000    At least two market makers    $3 minimum bid price of the company stock    Public float market value of $1,000,000 I’ve heard a number of pushers for reverse mergers tout the ability of a company now listed on the Over the Counter (OTC) exchanges can “graduate” to NASDAQ or the NYSE. This is certainly possible and many salespeople will reference some big names like Turner Broadcasting, Occidental Petroleum or Berkshire Hathaway. Each of these companies are the wide exception to the rule. Unfortunately, transitioning to larger exchanges is much more difficult than many micro-cap business owners and management assume. However, it’s not out of reach as the numbers above showcase. Your best bet for being able to step up to the next exchange: build a good business that is investable. That is, focus on the business and not the financial engineering behind the business. If you have a great business, the money will flow in, the stock price will increase and the transition will be more than natural. The most common problem are the puffer fishes. They’re those that tout how great their business is, but who may have unrealistic expectations on their abilities and the growth within the market.More,lawrence,,0,3
8 months ago,Somebody correct me if I'm wrong but I believe the majority of funds won't touch a stock that's less than $5 and a U.S. listing is a must if you want to be a real somebody, IMO.  It's certainly not impossible for the PPS to reach $5 given enough good news but I'm wondering if a reverse split, say 1 for 4, might get the job done in fairly short order.As always, time will tell,lawrence,,0,1
8 months ago,Very encouraging PR out today on the pelletization deal which hopefully will be signed in another month or so,lawrence,,0,0
8 months ago,Great News!!https://stockhouse.com/news/press-releases/2020/05/19/pyrogenesis-enters-negotiations-for-supply-of-equipment-with-iron-ore,Jeff,,0,0
8 months ago,Glad I loaded up last week at .51.,HUGH,,1,2
8 months ago,Ironically sad or sadly ironic that the first order of business, i. e., the metal powders business hasn't been mentioned in months so I guess that it's lost its importance as a revenue/profit driver and the company's hope are the plasma arc apps from DROSRITE and now pelletization and maybe solar.As always....,lawrence,,0,0
9 months ago,Buying another block of shares before the announcement of profits causes a takeover bid,james,,0,0
9 months ago,Adding shares to benefit from the jump value when profits get reported,james,,0,0
9 months ago,Target price of .60 and eps of -.05 will change when earnings report gets issued,james,,0,0
9 months ago,The bottom line puts stock price near two dollars and climbing with every purchase order as they transform into a viable money maker and draw attention,james,,0,1
9 months ago,Unable to report earnings for 6 months while business improved and revenue jumped means a real eye opener report in future. This company will graduate to the big leagues soon.,james,,3,0
9 months ago,Alittle more to today's PR re iron ore pelletization, there were several references to environmental issues so here's an article on the business by a major player that has many references to environmental problems with current processes.  Wouldn't surprise if this company eventually tries to get in on this plasma arc technology.  As always, time will tell.https://www.metalbulletin.com/events/download.ashx/document/speaker/E001264/a0ID000000dHLO4MAO/Presentation,lawrence,,2,1
9 months ago,My concerns and have always had concerns with this company is they never mention the companies they work with. There's always a pump and then a few weeks later it gets dumped.,wasup,,0,0
9 months ago,Customer paying the company to create real revenue bodes well for future possible profits,james,,0,0
9 months ago,Whoa,S,,1,0
10 months ago,I am certain that plasma will kill corona virus.,Thoughtfully,,0,0
