PostDate,Content,Author,RelativeDate,Likes,Dislikes
yesterday,""I think we will see a flurry of retail bankruptcies likely in the first quarter of 2023" Mark Cohen, former longtime CEO of Sear Canada and current Columbia University professor of retail studies, warned on Yahoo Finance Live "reitmans will be part of that. be smart and dont hold the bag! cut loss,Roxy,,0,0
6 days ago,12 share volume in intire day LOOOOOOL do you need more proof this compagnie is DYING. dont be stuck holding the bag. markets our recovering go buy something with value like ATZ,Roxy,,0,0
9 days ago,This just in….We back baby!,JohnCENA,,4,3
9 days ago,Hey Dudes,  I'm sure the numbers for the 2nd quarter are more or less in.  It's gearing up to be good news, yes?,Sealy,,0,4
20 days ago,go see Aritzia for what real earning report looks like! Will be 50$ in no time and $100 in 5 year or less. Time to dump reitmans and go to the winner aritzia!,Roxy,,2,1
28 days ago,From 0.45 up to 2.13 then go down to 0.79 in a year,Andy,,0,0
last month,Question for the board? Why does US fx affect ret.a results. Do they have US debt? Or US cash holdings? Or operations? Much appreciated?☮️,Richard,,0,0
last month,0.50$ soon. no use holding this dying compagnie anymore,Roxy,,0,0
last month,What am I missing? EV 50mm, LTM EBITDA 108mm, trades at 0.5x multiple? Ok let’s be more conservative and just annualize last Q 9.9mm (slow season) - run rate 40mm EBITDA company trading around 1x? There is some nonsense conversation that this company did not generate cash last year - please explain how they have 40mm cash balance - higher than in January 2021, inventory is up - meaning they actually put more cash to work - and all this after paying 95mm in cash in bankruptcy and no debt increase - did they get that cash from air or they actually generated 115mm cash from operations last year which then was mostly used to make that 95mm payment. So this is cash printing machine, wake up people. Current inventory 137mm - even after huge discount still enough to cover market cap in liquidation plus current cash. Almost 100mm of other liabilities eliminated. I don’t have to believe in 100mm EBITDA run rate, just use last quarter- 9 mm cash generation from operations plus 9mm from working capital return - all this vs 50mm market cap…please poke holesMore,Al,,1,1
last month,Q1 results are out and are quite solid - best Q1 in 9 years.  Expecting a strong bounce tomorrow.  GLTA,Derek,,7,2
last month,Is RET releasing their quarterly report tomorrow  ?,Deadly,,2,0
last month,under 1$ just like i say. it will keep drop. DONT HOLD THE BAG,Roxy,,2,4
2 months ago,Set my sell for when it gets back to $27 a share. If it doesn't make it during my lifetime, it's up to the executors of my will to figure out what to do with these shares.,LeMAY,,0,0
2 months ago,why the sudden drop ? any guesses ?,Deadly,,2,0
2 months ago,Nordstrom is Reitmans for people with less sophistication.,LeMAY,,0,0
2 months ago,Huge volume today! Nice 214 shares changing hands!,JohnCENA,,5,0
2 months ago,couple things here: on a TTM basis, this company is not as cheap as you think given the competitive pressures that it’s facing from e-commerce and other brick n mortar brands (just look at deterioration of gross margins over the past decade). It produced ~7.7mil CAD in “normalized” FCF in 2021 - normalized in quotes if you back out the one-off 114mil CAD paid towards liabilities subject to compromise. Other than (1) change in capital allocation - return of dividends or (2) improvement of operating cost structure, what about the future of this company excites you at current levels? I hear a lot of “re-list to TSX” takes and that sounds to me like bet on a beauty contest. What about the company then will make investors on TSX excited to pile in?More,Dina Cece,,4,0
3 months ago,Thank you for answering my earlier question about insider share holders.Now I got another question, why is the daily trading volume so low ? I just checked and a grand total of 35 shares were traded. Thirty -five whole shares. Not even 350, or 3500 or 35K.,Deadly,,1,0
3 months ago,Hi everyone, I'm new here. I see no insider holders for this company. Am I correct ?,Deadly,,1,0
3 months ago,Fingers crossed for a good Artitzia earnings. Could benefit from it and will show us what we could expect,JohnCENA,,0,0
3 months ago,Holding for a few years. Will sell once it’s $5/share,tcal0522,,3,1
3 months ago,I guess you wont buy Nike, Lululemon and Michael Kors,Richard,,0,0
3 months ago,RET will be back below 1$ soon. Why do fellow canadiens support a compagnie that produces its cloths in asia sweatshops???? SHAME,Roxy,,0,0
3 months ago,so much manipulation going on these past weeks...truly thought we'd be on the up and up by now,Shayne,,0,0
3 months ago,180M shareholder equity on last quarterly reportCurrent market cap 70MVolume is lowWe need a catalyst (TSX uplisting, dividend re-instatement in next quarters) and surely this should trade at 3-5$More,Daniel,,2,1
3 months ago,If I had 75 Million $, I would Buy all Reitmans,Martin,,2,1
3 months ago,It's going to be a wonderful decade for Reitmans. Buying dips 🚀 🌙,LeMAY,,0,0
3 months ago,Got another 1000 shares at 1.37 today,JohnCENA,,3,2
3 months ago,Hi all, I jumped in today at a couple of points that the stock kept dipping.  Current valuation was just too attractive to pass up!,Derek,,5,2
3 months ago,P/E ratio of 0.5. EPS is higher than the stock price currently. What is not to like here,JohnCENA,,9,1
3 months ago,My opinion; A major Shareolder (Anonymous) has been selling about 50 - 60 000 shares per day since February. Once he end that, share price will go to a much higher price.,Martin,,0,2
3 months ago,,Martin,,3,2
3 months ago,Bought 2000 shares at 1.60. Was watching this for a while. Thought I missed my chance this morning. Not going to happen again. If it drops below 1.50 I will add 1000-1500 more.,JohnCENA,,1,2
3 months ago,,Martin,,0,1
3 months ago,50% increase in net profit. Market cap is only $70M that’s less then pure profit.This will be headed back to $5 And my nest eggMore,tcal0522,,0,0
3 months ago,Numbers are on-line,Alex,,3,1
3 months ago,What’s up ?,Martin,,4,0
3 months ago,Let’s go!!,tcal0522,,0,0
3 months ago,Does any one know if the numbers are before the opening or after the close tx ☮️,Richard,,0,0
3 months ago,This should be at $3 dollars after earnings tommorow,tcal0522,,0,0
3 months ago,is it haulted ?,Tayler,,0,1
3 months ago,P/E = 1,5....,Martin,,0,0
4 months ago,When is earnings?,JohnCENA,,2,0
4 months ago,Any reason why Reitmans wouldn't go back to $27 a share? Every stock goes up and down. Weird how many will not buy this stock until it goes to $5 or $10 or $15 or $20 or $25 etc.... Human nature is strange, and fear and greed drive such strange behavior in the stock market. 🤔 What is so hard about buying low and selling high while so many chase meme stocks, always best to buy stocks like this at this very low price. 😊,LeMAY,,0,0
4 months ago,Any doubters, check out their Instagram page...pumping lots of ppl all shapes and sizes, hitting alot of demographics,Shayne,,0,0
4 months ago,Let’s hear some realistic projections…..,Benjamin,,2,0
5 months ago,It’s coming back!,Ace,,5,3
5 months ago,Ouch!,rohit,,3,0
5 months ago,Based on facts (cash flows, balance sheet, etc) , this company is more than a steel at this price.,Martin,,8,3
6 months ago,in and out with this. they benefit from covid boost and poeple going back to work. once that is done the stock will keep dropping like it was before pandemie.,Roxy,,0,0
6 months ago,What's not to like?  Well run company, great management with integrity, free cash flow. It's a no brainer.,Sealy,,6,4
6 months ago,Fresh off the heels of creditor protection, Reitmans (Canada) Ltd. has announced plans to launch an online marketplace for women’s clothing.The Montreal-based company says RCL Market will be available online this fall and feature its three brands, Reitmans, Penningtons and RW&amp;CO.Reitmans says the marketplace will also offer “hand-picked quality value products offered by partner brands” and is inviting interested vendors to apply to sell clothing on its new site.SKIP ADVERTISEMENTARTICLE CONTINUES BELOWJackie Tardif, president of the Reitmans brand, says the company’s e-commerce business has grown exponentially in recent years and RCL Market will further transform the way its customers shop online.Reitmans said earlier this month it had paid $95 million and exited creditor protection after nearly two years.The company said it paid court-appointed monitor Ernst &amp; Young Inc. to distribute funds to creditors according to the plan of arrangement.Reitmans filed for creditor protection and obtained an initial order under the Companies’ Creditors Arrangement Act in May 2020.More,LeMAY,,0,0
6 months ago,Great buying opportunities. Just picked up 8k shares,tcal0522,,5,3
6 months ago,Now that we're out of CCA protection, is a return/uplisting to the TSX from the TSX-Venture something to expect this quarter?  That could be a possible upcoming catalyst,Daniel,,3,1
6 months ago,Been in low 2 dollars for awhile now, what are upcoming predications?,Ace,,0,0
7 months ago,,Shaker,,0,0
7 months ago,Not making sense why RET-A.V going down while  RET.V is going up. Would any body be kind enough to explain briefly,Shahriar M,,2,1
7 months ago,Great analysis in seeking Alpha a must read.long and strong,Richard,,2,0
7 months ago,Do you guys think Covid will have an effect on share price?,Ace,,0,0
7 months ago,Why has this stock been frozen since Dec. 31? It's now Jan. 4 (6am EST)...,Brian,,0,0
7 months ago,100% buy rating on barchart,Brian,,2,1
7 months ago,What’s everyone’s price targets here?,J,,1,0
7 months ago,see what tmmr brings us! in at .22 cents!,Tayler,,1,0
7 months ago,We have started touching the $2 zone, next goal is $3,Ace,,8,1
7 months ago,One last push. 2$ for Christmas. Let’s Gooo,linda,,2,0
7 months ago,Great article in the Globe. Coming of CCCA to approve de by the courts Jan 4th, ret.a will be trading at 50% book value, .2x sales of 700M annualized and should generate .25eps in 2022. Baring the end of the world see you at 5$ eo2022. DD and gday,Richard,,3,0
7 months ago,Why is this different this reit-v That’s almost 2 dollars,tcal0522,,0,0
7 months ago,Touching $2 today!,Ace,,0,0
7 months ago,Did the $95 m. payment go thru?,Kenneth,,0,0
7 months ago,Hey Hapapa plan approved Kaboom,Richard,,1,1
7 months ago,Vote results????,Martin,,0,0
7 months ago,What time is the vote??? Tx,Richard,,0,1
7 months ago,waiting for .60c to buy back in,Younger Doucheyer Muray Draper,,1,3
7 months ago,“The only regret you’ll have is that you didn’t buy more”,Shaker,,2,0
7 months ago,Let’s get this to the moon. 5 dollar on the way!!,tcal0522,,3,0
7 months ago,Wow. 300%  I earned from this stock  nice.  Go go go,hui,,2,1
7 months ago,Volume, Volume, Volume.,ME,,2,0
7 months ago,3$ by Christmas?,Ace,,2,0
7 months ago,2$ in reach. I believe,linda,,7,0
7 months ago,$33.5M EBITDA in the the quarter ending October 30th. As of December 4th there’s $101M of cash. Talk about cheap,Shredder,,0,0
7 months ago,Can’t wait to hit 5$,Shaker,,0,0
7 months ago,This could be a great opportunity setting up for stage zero life sciences.  Of its worth a look if you haven't already.,RC,,0,0
7 months ago,weird run up to 1.70 . 2$ soon?,Tayler,,1,0
7 months ago,Going to be at least 2+ by Christmas 100%,Ace,,5,0
7 months ago,Folks thus could be a turnaround story for fobi today check out the great news it could run to the 2-3 range very soon.,RC,,6,1
7 months ago,Folks this could be the turnaround story of 2022. The vote is Dec 31 and only 2/3 required. The mkt seems to indicate it's a go and with 29 stores closed and impressive last quarter numbers and strong articipated xmas sales we may be heading to 3-4$ quickly. Do yr DD and gday,Richard,,5,1
8 months ago,Opinion on the future path of Reitmans: will they go back to a dividends paying company or a growth company like Canada Goose or Lululemon? which path would see the share price go higher?,XVexed,,0,0
8 months ago,reitmans 52 week high again love it,Tayler,,2,0
8 months ago,Crazy. It’s a bear market yet this is managing to keep rising,Shaker,,2,0
8 months ago,Which will be worth more - RET.V or RET-A.V?,XVexed,,1,0
8 months ago,Love the volume. Hopefully it keeps up until the new year.,ME,,7,0
8 months ago,Here we go boys!,colin,,0,0
8 months ago,Oh wow, what's with the 22% jump today? Any news I miss?,GreenMarty,,7,0
8 months ago,115M credit facility. No dilution! And asking to approve $95M payment to creditors. Great news if it’s approved,Shredder,,6,0
8 months ago,I'm still optimistic that this guys can recover soon, any discussion anyone talk to me guys,Jhon,,3,0
8 months ago,There is strange algorithmic buying pattern right now that has not been seen before with this stock. Basically purchase of 500 shares every 3 minutes.,Jasper,,1,0
9 months ago,what happened on this store lastly is going up now its on the bottom again,Jhon,,0,0
9 months ago,While under CCAA, suppliers will not extend credit for inventory purchases. Reitman's must use all cash from operations to pay pre-2021 debts, not buy new stuff. Hard to stay in business in that scenario.,Kenneth,,0,5
9 months ago,Extension of CCAA protection is never good news. In 40 Years of investing, I have never seen a shareholder recover a penny of equity after a corporation entered CCAA proceeding.,Kenneth,,1,4
9 months ago,Last  quarter was positive and stores seems to be full since then.,Martin,,1,0
9 months ago,I would suspect thier will be low volume and a futher decrease in share price until next earnings release or a announcement of ending creditor protection.,ME,,5,1
9 months ago,Blowout results by Aritzia probably didn't help. It's never fun when someone else eats your lunch.,Kenneth,,2,0
9 months ago,volume is $841 on a Friday, we should be boomin!,Shayne,,1,0
9 months ago,Why nothing move on the chart?,Max,,0,0
9 months ago,Predictions for the week. 1.40 close on Friday,linda,,3,0
9 months ago,What are we thinking for this week??,Scrunt,,0,0
10 months ago,is it black Friday today? the stocks on a mega discount 😍😍,Jan,,0,0
10 months ago,HUUGE buys going through,Scrunt,,6,0
10 months ago,Volume, Volume, and Volume. Interst in this stock is climbing. Hopefully it keeps up.,ME,,7,0
10 months ago,Before initiating new positions, consider carefully that companies placed in CCAA rarely emerge with any value in the pre-existing common shares.,Kenneth,,1,10
10 months ago,Will we see a 1.20 closeee???,Scrunt,,5,0
10 months ago,Call me an optimist, but I hope to see this stock return to its $15-20 range once covid subsides. Retail sector has to start picking up eventually.,GreenMarty,,10,0
10 months ago,2$ coming soon,linda,,3,0
10 months ago,Any price predictions for today?,Tanmay,,1,1
10 months ago,Price predications in the upcoming weeks?,Ace,,0,0
10 months ago,damn shorts,R,,0,0
10 months ago,Oooooh yeah,Scrunt,,0,0
10 months ago,It is most definitely going to hit $2, hold and don’t miss out,Ace,,0,0
10 months ago,Does anyone have an idea when they will be able to exit out of credit protection?,ME,,1,0
10 months ago,bought another 15k, going up,Sic em,,4,0
10 months ago,Gonna test 1$ today,linda,,4,0
10 months ago,My biggest regret selling this,Dr,,2,0
10 months ago,what's the difference between reitmans class a and the other one?,Sam,,0,0
10 months ago,easy loonie,Sic em,,4,0
10 months ago,Bought in at 0.24 a share. Too bad I’m poor and didn’t buy a bunch.,K GM,,0,0
10 months ago,Hold or sell at the moment?,Tanmay,,0,0
10 months ago,This will go to $3.00 and some point. Their office real estate is worth that. That’s when you sell.,Jordan,,0,0
10 months ago,Has to hit 1.,Ace,,0,0
10 months ago,In 2019, Reitman's repurchased about 15,000 shares at $3 each. Because of that dumb management decision, they were unable to weather the covid storm and all but wiped out their shareholders (including me). In 40 Years of investing, I've never seen a company come out of CCAA with it totally wiping out its shareholders.,Kenneth,,2,1
10 months ago,Yay !!! Sold at 0.68$. Made decent $$$!!!,Stock-Lizzy,,1,2
10 months ago,When I was plus sized I loved this store. My niece convinced me a few months ago to buy 500 shares. Hoping to sell it today for 0.68 a share and we would make 50percent profit. Wish us luck. Promised to split the profit with her,Stock-Lizzy,,3,2
10 months ago,All post-covid recovery stocks are up today. This one is surprisingly higher than expected, 48! Keep going.,GreenMarty,,2,0
10 months ago,why is it rising so much after months of constantly being sold at 0.50, didnt the report still show they are losing money?,Jack,,3,0
10 months ago,Finally rising. Had this stock for too long.,Ace,,0,0
10 months ago,It's surely disappointing the lack of interest and hope given that news on its quarterly report is expected on the 23rd and news about it's creditors protection will come out before the 28th. I've seen lots of positive signs.. but keep in mind it's not a sexy brand and won't go to $2 this month or even year.,XVexed,,0,0
10 months ago,I think its over folks. Old navy and others are all dropping plus size brands now in house. fat women have become  the standard in North America,Kasane,,0,0
10 months ago,Given that this company is in CCAA why is it trading at greater than $0? Are its shareholders delusional? Or just stupid?,Kenneth,,0,2
11 months ago,I am not a woman but wanted to know - do women really dislike shopping at Reitmans stores? Why has this store struggled so much with all their brands?,GreenMarty,,0,0
11 months ago,hoping the fall release clothing line is better then the summer...I was at The R.M in Tbay, and the staff seemed happy with the female sales, but said it needed more male sales...only time will tell, go fall lineups!,Shayne,,0,0
11 months ago,Fall price predictions?,Ace,,1,0
11 months ago,Air Canada and Reitmans.,LeMAY,,0,0
last year,Looking good,Ace,,0,0
last year,$568 in volume today....looks like we need to add more to this one..,Shayne,,0,0
last year,today is take off day... taken off WS for low volume that is.,Kasane,,2,1
last year,And months after this is still not moving 😕,Futurenurse,,0,0
last year,Still waiting on the rocket to take off,Ace,,6,0
last year,Looking organic,Dr,,0,0
last year,should be on the up and up next week,Shayne,,0,0
last year,Stores should start reopening soon this is a perfect entry price,Dr,,0,0
last year,Isn't this company in bankruptcy protection? Normally, that means that the common shareholders are SOL. The fact that this company still worth a few pennies per share merely reflects the fact that there are a few Dumb Bunnies out there with more money than brains. This dog is going to zero.,Kenneth,,0,9
last year,Woa, up 22% today? What's the news,GreenMarty,,0,1
last year,This stock is a gem long term, they’ve been around 100years and doubt they’re going anywhere super undervalued for their financials and they’re going through a restructure,Dylan,,0,0
last year,$2.10 Sept 15,2021. Just for #$%$ and giggles.,ME,,4,0
last year,Today was a perfect example of what is keeping the price of Ret-a.v down.  People buying and then selling for 1-2 cent increases…. This stock could be upwards of .49-.55 range right now if people weren’t the way they are.  Lol.,James,,8,0
last year,Open price today reaction.   Buying the dip!,James,,1,0
last year,#$%$ that closed nothing like I thought it would,Shayne,,1,0
last year,Volume yesterday as compared with today.,James,,2,0
last year,Saw this ad on tiktok just now. Marketing is stepping up for e-commerce conversions. https://vm.tiktok.com/ZMeg1kE8P/More,Nunyo Biness,,3,0
last year,Who in their right mind is buying a bankrupt company?,Bill,,0,9
last year,malls are gonna open soon as vaccination rates increases. I'm sure we will see 🚀 by the end of the year,shay,,0,0
last year,crazy how people sell after a small 0.1-0.3 cent raise,shay,,2,0
last year,hopefully we can push past the fifty-cent marker,Shayne,,6,1
last year,where's  all the pumpers gone to ?,Mesoo,,2,0
last year,This will be down to .45 or less soon! Hopefully im wrong,Dale,,2,3
last year,Im curious how this company will do after it loses crediter protection,Dale,,4,0
last year,Thanks for the cheap  shares RET-.A.V   😎,Len,,1,1
last year,Why is this always below opening price!!?? Starting to think i should sell,Dale,,0,0
last year,Hahahah. Who the heck is buying and selling at market value instead of setting limit buys and limit sells...?? Hahaha,James,,1,0
last year,I like the overall outlook of this stock. 23M Mcap worth selling at .45 $ per share during the biggest pandemic in a Hundred years is the oppertunity of my lifetime. I started collecting shares in February and have been adding more every week. I'm up to 1126 shares at an average of .4650$. I'm stocking up on this and sitting on it for years if I have to, and when the pandemic panic is over and the stock goes to 5$ the old portfolio will look pretty good. I just hope the malls stay closed long enough for me to get to at least 5000 shares. ( not financial advice, I'm just a stupid mechanic).,Len,,3,0
last year,I thought it was gonna go up after the spike yesterday but it went back down 🥲,Futurenurse,,0,0
last year,Q4 was posted go check it out!,Jack,,0,0
last year,Anyone seen the Q4 yet? Wondering if they held off because of the Rogers outage... still no news on the site or other news sites,Jack,,2,0
last year,Oh, my.,Craig,,4,0
last year,time to buy,Kasane,,2,0
last year,to the moon!! 🚀,Money,,0,0
last year,is there no earnings on the 19th? it hasn't shown on yahoo yet I'll have to look again I guess,Joshua,,1,0
last year,Got an update from the president via LinkedIn sales Nav. “Thanks for reaching out. All formal men’s wear business had to pivot based on the impact of Covid_19. The RW&amp;Co team is doing an excellent job at evolving its product and brand. Some of these changes are being tested in stores and on-line right now. Starting in August and September you will see the introduction of several new men’s lifestyles. Casual, lounge, and commuter being the major newness. Thanks for your interest and support. I hope you and your family/friends are all safe and happy. All the best. Thanks, Michael”More,Nunyo Biness,,8,0
last year,I’m having trouble finding dividend information. Can some one point me in the right direction?,Nunyo Biness,,0,0
last year,,Money,,0,0
last year,Anyone know why the price spiked? Did someone buy a lot of shares?,Ace,,2,0
last year,,James,,2,0
last year,Hey guys. Haven’t been on here lately. But yeah I’m back and that’s only for one reason .80-.90 Reitmans is coming up.,vishesh,,0,0
