PostDate,Content,Author,RelativeDate,Likes,Dislikes
last year,Reitmans is in CCAA protection this of course makes it a high risk investment and in turn will keep the stock price down simply because not everyone has the same appetite for risk. If you can afford to invest in something that is high risk then consider investing in Reitmans. Read up on the CCAA progress, keep an eye out for the quarterly report April 19th and coming announcements in May when it looks like they'll get out of CCAA protection. COVID accelerated Reitmans' financial decline and brought to light issues that were occuring over the past few years at the company merely from going through CCAA restructing. Since last May they have used the CCAA restructuring as an opportunity to get rid of entire brands and stores that weren't profitable like Thymes and Addition Elle. They moved product lines that were selling well to their Reitmans stores and adapted product lines for everyone working from home. They negotiated better rents and have since then met their obligations and commitments under the CCAA restructuring. Read CCAA documents by searching for Ernst &amp; Young + Reitmans.If you're worried about Reitmans closing shop for good, Smartset had 100-150 stores when they went bankrupt and Reitmans still has over 400 stores including multiple brands that they could still close or sell off (Penningtons, RW&amp;Co, Reitmans) so it's not yet time to panic. It's always difficult to close down stores and lay off employees but COVID/CCAA restructuring gave them the excuses they needed to make drastic changes last May and since then no further closures have been needed.Reitmans has hit 20-25$ a share in their lifetime, Canada Goose, Aritzia and Gildan are at 30-50$ a share and there's a difference of 100 million dollars in revenue between Reitmans, Canada Goose and Aritzia. Reitmans in their worst year pre-COVID had over 800 million dollars in revenue so this is not a small company and people ARE buying their products.Online shopping aside people will need and want new clothes when stores fully re-open even if they're only going back into the office 10% of the time. Ask people around you if they've gained/lost weight during COVID. Ask women around you if they shop at Reitmans. Reitmans being one of the only stores that tailors to a wider range of sizes is well positioned to recover when out of CCAA protection as well as when COVID dies down.I'm bullish on Reitmans at 145000 shares with an average cost of 0.29$. I plan to sell half at 5$ and the rest at 10-15$ if they don't bring back dividends by then. I am not a day trader, I am not selling shares to try and make a 15$ profit, I'm in it for the long haul and I am willing to take on the risk.I fully understand that everyone is not in my situation and others may not want to take the risk. Do your research and if you can or want to invest based on your own situation then invest; if you can't or don't want to invest then simply don't invest. There are no crystal balls, information is based on my own research. If you're bullish or bearish on Reitmans tell us why!More,DoYourDue,,9,4
last year,Pretty flat lately and very low volume. Can’t wait until the moment of truth this coming quarter. So far the debt is going down and the profits are rising. Would be nice to see them clean house of the ancient execs who brought the company to this point though. How could they possibly know anything about modem conservative or young professionals business casual fashion tastes?,Nunyo Biness,,8,0
last year,4th quarter results April 19th and annual in May.,Joshua,,1,0
last year,Might be the best stock in my portfolio 🤯🔥,Dr,,1,0
last year,I love this stock.,Len,,2,0
last year,come on .45 lol,Alex,,1,0
last year,Ret-a.v in a nutshell today.. lol,James,,4,0
last year,This volum is rediculous. We need some publicity. How can RET-A go up if nobody buys.,Len,,3,0
last year,Buying every share I can get my hands on. Let's go!!!,Justin,,6,0
last year,We going a little slow right now but this obviously has a lot potential by summer,Ace,,5,0
last year,no reaon to sell this! buy and hold!,Thomas George,,0,0
last year,we now have peel region pushing to enter Red Zone both Mississauga mayor &amp; Brampton mayor. this should bring some momentum alongside with spring rollouts for their brand.,Money,,0,0
last year,,Money,,5,1
last year,Who else is watching the Gme rollercoaster today?  #offtopic,James,,0,0
last year,good news guys not sure if you guys heard but Alberta opened up aswell,Money,,0,0
last year,,Kozzy,,1,0
last year,what is the difference between ret-a.v vs ret.v .. I bought stocks under both the account however I see ret.a is not live today,Shahriar M,,0,0
last year,What’s happening price shows 0.46 I bought give from 0.4950,M,,0,0
last year,Why are there two stocks for reitmans?,Bill,,1,0
last year,Spring 2021 it’s going to go up, they have partnered up with two of the dragons from dragon den( Manjit Minhas and Lane Merrifield, as well as 13 other Canadian founder). I will say, this is going to the moon🚀,Jessica,,0,0
last year,https://www.bnnbloomberg.ca/investing/video/fairfax-financial-buys-more-share-of-reitmans~264939,Futurenurse,,0,0
last year,good morning everybody hoping for big gains this week 💪🏽 hold strong let's take this stock to the moon!,Money,,0,0
last year,any news about this stock??,Satinder Sahota,,1,0
last year,,Brian,,1,0
last year,"Rise Lord Reitman.",Brian,,2,0
last year,Toronto and peel going into grey zone starting Monday retail is opening with limited capacity 🙏,Money,,2,0
last year,,Brian,,3,0
last year,still holding not gonna sell till 2$,Money,,0,0
last year,an hour and no update; great.,Craig,,1,0
last year,today is a great day. I was able to double up for pennies.,Kasane,,3,0
last year,Sell me your #$%$ stocks.,Craig,,2,2
last year,Damn Dw guys I’m holding  we all should be Dw worry about a little drop it gonna return poor market in genreal rn,deshaun,,2,0
last year,Whats going on with the market this is nuts,Money,,1,0
last year,Guys the whole market is getting a beat. Just relax. Things are opening up again and the big boys want discount,vishesh,,3,1
last year,Oof, .42... hold everyone as the market cap dropped only 2-3 million xD,Mesoo,,0,1
last year,Idk if y'all know but RW&amp;CO just teamed up with Manjit from dragons den. Quarter 1 isn't even done yet and lots of companies are having a #$%$ first quarter(even the place I work at and were considered to be doing great). Summer is going to bring so many sales and it's going to increase stock price so I'm predicting by Q3 this will be up at least to $5 - $10 a share DON'T SELL,Stalk the,,5,0
last year,This feels like people are manipulating the share price so they can buy low.. stores are OPENING UP!  What other reason would their be for this huge dip,James,,4,0
last year,The down fall begins.,Bank Note Alby,,0,0
last year,LMAO WHY WOULD SOMEONE SELL at .45 HAHAHAHAHAAHAHAHA,James,,4,0
last year,I’m NOT selling either,  bought in at .175,  people are being unreasonable and irrational..  letting fear cloud their judgment,James,,4,0
last year,You only lose money when you sell, remember that,Ace,,0,0
last year,LMAO at everyone panic selling,Money,,3,0
last year,If only WSB would be interested in jacking up the price to mess with the shorts haha,James,,5,0
last year,Cities have yet to all open fully since lockdown, so relax peeps,Lita,,3,0
last year,That’s cute... shorts are trying to get the price lower...,James,,5,0
last year,Not selling,vishesh,,6,0
last year,Ladies and gentlemen is time to sell, if you want to keep the shirts on your back. This stock was a sinking ship since 2017.,Bank Note Alby,,0,7
last year,time to fly high.,Money,,0,0
last year,Get ready for a ride up,vishesh,,0,0
last year,Reitman's staff getting ready to re-open today at Markville Mall!!!,Brian,,7,0
last year,This is about to go down. Lol,Bank Note Alby,,0,0
last year,Hi everyone     I am totally new to all this     I brought few hundred chares of this company and few hundred of 3 others ....I understand nothing how to fallow all this market thing and by knowledge make money...I just hope that somehow it goes up and up and I cash in eventually some profits .   Can someone guide me and maybe private message me and talk about all this and teach me what and how I should do to make some money bottom line ...THANK YOU,Goran,,3,1
last year,This is definitely going to zero. Good luck to the pumpers, and bagholders.,ian,,2,8
last year,I love this. We now have Messo to educate. Messo what’s your take on this stock ?,vishesh,,2,0
last year,What price predications we thinking today? I’m assuming 0.54,Ace,,1,0
last year,EVERYBODY HIT THEIR SOCIAL MEDIA TO SAY: "REITMAAAAAAAN'S!!!" 💥🚀👀💭That Brian ain't lyin'!,Brian,,1,0
last year,@mesoo going around disliking all the comments ahaha who hurt you lmao,Money,,0,0
last year,This stock likes to stay in range for 1-2 weeks. Load up around .50c until we go to the next level which will be .75-.85.,vishesh,,4,1
last year,good morning everybody just a friendly reminder don't panic sell. hold and bear the fruit to your patience.,Money,,0,0
last year,Updated after-hours? At least it went up?,Craig,,0,0
last year,Trust the process guys HOLD!,Money,,7,1
last year,The price of the stock is what holders will sell at. Selling below 52 is crazy at this point.,Jack,,2,0
last year,anywhere that updates this lil guy a bit more frequent?,Craig,,1,0
last year,it a bargain,RC,,3,0
last year,buy the dip,RC,,3,0
last year,Any feelings about the sudden sell off?,Cody,,0,0
last year,Dips are like discounted prices,Ace,,3,1
last year,Buy the dips,Ace,,3,1
last year,now that York Region is open we have seen this stock go from low .20s to mid-high .50s with Peel region trying to open up this stock is definately bound to hit at the very least mid .70s,Money,,4,0
last year,I'm saying a prayer right now that Reitman#$%$ $1000 per share by 2024. ??,Brian,,4,0
last year,anyone here know where i can find a MACD chart for this?,Kozzy,,0,0
last year,I’d like to hear everyone’s thoughts on the stock today,  how is everyone feeling?, please reply and state your case,James,,0,0
last year,This is going no where but down. This is me watching it go to zero.,Bank Note Alby,,0,0
last year,It's way to early to sell, this spring and summer sales will go up. BUY and HOLD!,Thomas George,,0,0
last year,EOW estimate price anyone?? Curious to know what you guys think,Futurenurse,,0,0
last year,,Kozzy,,0,0
last year,How was everyone’s weekend?,James,,3,0
last year,buy the dips!,Money,,0,0
last year,,Kozzy,,5,0
last year,,Money,,5,0
last year,Hopefully we see some volume.,ME,,6,0
last year,Slow start.,Len,,0,0
last year,Good morning everyone !!! here's to the start of a wonderful week &amp; even better month!,Money,,0,0
last year,Working retail on a part-time basis (another sector) and it’s interesting how much people are spending and visiting malls in BC. Once Ontario and Alberta get up tot he level of openness of BC o wouldn’t be shocked to see this up towards 1.50 again.,Turner,,4,0
last year,Ai I’m holding  we still strong 💪 let pump those numbers as it goes,deshaun,,4,0
last year,Hello boys and girls. Let’s take some guesses for day end price. Winner get a W. James - 2W so far.,vishesh,,1,0
last year,In @ .19,harry,,0,0
last year,Intesting $RET-A.V,marc,,4,0
last year,hold strong errbody! big week next week!,Money,,4,1
last year,Holding strong. Wait what happens when they announce out of credit protection. News coming soon. Hold.,linda,,3,1
last year,im gonna guess a .63 finish today,Kozzy,,2,1
last year,Looks like it’s forming resistance around 0.54,Ace,,2,0
last year,1.00 + by summer hopefully, as COVID starts clearing up and stores start opening,Ace,,3,1
last year,This is going to be 0.60+ by closing,Ace,,4,1
last year,,Money,,0,0
last year,buy the dip so money,  vishes and James can sell at .60 again. Thumbs down this comment if that's your plan and if you are a simpleton. lol,RC,,1,2
last year,Everything?s down today. #$%$ Wish I could?ve cashed out my crypto to buy more right now. But those are down too.,vishesh,,2,0
last year,time to buy the dip,Money,,0,0
last year,The next dump will be the last.,RC,,1,3
last year,ouch,RC,,1,2
last year,OMEGALUL people..... stop selling hahahah just HOLD!  Who sold ... lol,James,,2,1
last year,All things aside, this company does close to 1 billion in revenue every year. Yes that’s right. That’s 1 billions dollars. 1 with 9 zeros.,vishesh,,2,2
last year,how are there 23 people commenting here? the volume on this is like $100k. this reeks of a pump and dump. company is a dumpster fire.,Ian,,2,8
last year,Damn it. i'm out at $.59 :(,seif,,0,4
last year,Now taking predictions for day end price!! Winner gets a hooray,vishesh,,0,0
last year,To see the charts past the 1 day and 5 day for this stock on yahoo. Simply open the big graph, pick your period from the bottom 1m 3m 6m 1 year. And then close the big chart. And bam you’ll have your chart history for this stock,vishesh,,1,0
last year,We are going to test .60 again. This is going to be third time and if it’s rejected let’s see how far down it goes to find support. My guess .50,vishesh,,1,0
last year,But if 2500 shares can make it go up or down 1 cent what happens when someone sells 25000 shares. There won't be enough demand for that volume and the price will tank. I'm just saying personally I wouldn't feel safe holding a large amount. And if I was I would be selling 2500 at a time at .58 just like someone keeps doing.,RC,,0,8
last year,I sold yesterday at high bought back in today at low.,Timothy,,0,6
last year,mid .70s next week!!!,Money,,0,0
last year,Omg seriously... who is selling right now.. this #$%$ is gonna go up in a couple days!!  Lol,James,,4,0
last year,Instead of letting your fear or greed control you, tell me, how is your day so far today?  #hold,James,,0,0
last year,,Money,,2,0
last year,The MOST IMPORTANT THING TO DO:  HOLD!!!,James,,3,0
last year,HOLD!!!,James,,0,0
last year,we all taking this to space!,Money,,5,0
last year,good morning everyone, keep your head in the game. don't listen to these random guys like RC &amp; Bank Roll Alby. don't panic sell. HOLD YOUR POSITIONS.,Money,,4,0
last year,Just got word that stores may open Finally coming by next week... time to get in before this goes up!!  For all you holding shares KEEP HOLDING,James,,2,0
last year,Paytience 🙏🙏,domingo,,2,0
last year,Vaughan mills and piazza is open. Just got news.,vishesh,,5,0
last year,We have a guy named RC here. He’s causing people to dump. He first writes to the moon. Then writes negative comments and deletes them and writes I told you so. So if you look at the forum you just see two messages because rest are deleted. Be aware of this guy RC,vishesh,,13,0
last year,We have 30 minutes left. Everyone post your day end prediction. Mines is 58cents.,vishesh,,0,0
last year,it was a good day today,Kasane,,0,0
last year,My Auntie works for Reitmans, was recently called back to work, and was told that she would have to hire more staff soon!!,James,,8,0
last year,I give this a price target of $1.20 cad by next week.,vishesh,,6,0
last year,Even if it was a Pump and dump, I don’t think it’s going to go under .40,Jessica,,0,0
last year,So much for that pump and dump idiot was talking about hahaha...,James,,0,0
last year,I have long bad habit finding value in underdogs.,vishesh,,0,0
last year,This was my first ever stock purchase. Bought at .17And got impatient and sold because there was no movement. Came back last week and said “let’s give this another chance” and look at this now!,Kyra,,3,0
last year,be patient all,this $Ret has potential to go up to $5 within a few months $.,hhhh,,10,0
last year,I hope everyone is still positive despite some comments. For those still holding, today's end doesn't determine the future price. It will go up eventually if it's not today. Still a decent gain from yesterday. Stay optimistic!,shay,,5,1
last year,I’ve never given so many downvotes in my life,vishesh,,5,2
last year,If this was a pump and dump scheme then you can see by the charts that the pump hasn’t even started yet. There’s only been two phases of accumulation. So if this is a pump and dump. This is only the first pump. Usually it’s followed by 2 or 3 more before the dump. I truly believe in this company but when I start seeing posts about pump and dump it makes me double think about my investment.,vishesh,,5,1
last year,,Money,,1,0
last year,Bank Note Alby and RC are the clear ones cause a panic in this forum. Please mute these guys,vishesh,,0,0
last year,there are many stock basher here wants your shares for cheap up up up hold.,hhhh,,7,0
last year,,Bank Note Alby,,0,4
last year,Will it keep falling?,Futurenurse,,0,0
last year,The company has gone bankrupt and the case filings are in Montreal court pending hearing in May. They have shut 50% of their stores and remaining will be shut by end of this year. Don’t buy this junk and hype.,Monty,,2,8
last year,,Money,,0,0
last year,Everyone who sold is gonna regret it in a few months once more Ontario stores open up and the price raising even more. Undervalued stock just trying to reach their potential.,shay,,4,0
last year,I bought the dip,RC,,0,2
last year,To the moon 🌙 ✨ ♥,RC,,0,1
last year,To the moon,reggifel1,,0,0
last year,Holding this. Stores in Ontario haven't even fully opened. Most still closed. They haven't even come back fully from covid.https://www.reitmans.com/en/stores-closure,Jack,,2,0
last year,,James,,1,0
last year,,James,,2,0
last year,Why are we up so much? Will there be a big dump??,Futurenurse,,1,1
last year,,TO THE MOON,,3,0
last year,up 200% im selling and buying the dip chia,devon,,0,2
last year,lol yah right,RC,,0,1
last year,sell before someone else does,devon,,0,3
last year,Volumes not good for this kind of movement. Pump and dump signs, some of you will get burned.,ASH,,2,4
last year,i used to have 100k shares at 0.11 CAD last year. Sold around .15 CAD. Congratulations to those who hold. This will hit 1+ CAD very soon.. GLTA..,Raj,,1,0
last year,Let’s take this to $1,TO THE MOON,,2,1
last year,If I buy now from0.59 it’s smart or no?,M,,2,1
last year,This could go back to 5.00,RC,,6,0
last year,Tried to buy at 0.25 missed out by a few minutes next day caught it at 35.. a bit late but it's been worth every penny!,Thomas George,,0,0
last year,HOLD! THIS IS PERFECT.,Braiden,,4,1
last year,wow, let's go guys!,Braiden,,2,0
last year,,Money,,0,0
last year,HOLD HOLD HOLD!,Tanmay,,1,0
last year,don't sell HOLD,Money,,0,0
last year,Company has a strong cash position and will only continue to go up.  Undervalued.,linda,,0,0
last year,,James,,0,0
last year,Does anyone know if there is a better app to use to see real time market prices for Canada?,James,,0,0
last year,Hello everyone!What do you think, will this hit $1 in near future?,Tanmay,,5,0
last year,I bought this stock when it was .185 per share... hope I goes even higher... tempted to sell right now for a nice profit but won’t... I’ll be holding them shares till it goes to at least 1$!    Stay strong and keep diamond hands!!,James,,3,0
last year,It might end between 0.50-0.60 today. Hold everyone!,shay,,12,0
last year,,Kozzy,,1,0
last year,,Money,,3,0
last year,,Money,,1,0
last year,alright who just sold for .39? dont come back,Tayler,,4,0
last year,Alright... If this goes up to 25$ a share, I will finally be in the green on my portfolio 😂.,K GM,,0,0
last year,my friend works here and she was called back to work last week and told me she has been super busy since people are excited to go out and shop again.,Josh,,0,0
last year,Since y’all enjoying this Check BKMT.V 🚀🚀. Let’s get both bags,TO THE MOON,,0,0
last year,These dang resistance,Jessica,,1,0
last year,,TO THE MOON,,0,0
last year,What if this company's Execs just grease themselves and stiff the shareholders with a quit? What's the probability of this here?,Brian,,0,0
last year,we going all the way!,Money,,0,0
last year,This is going down by Monday.,Bank Note Alby,,0,0
last year,,Money,,0,0
last year,Stop looking at it every minute. Let it do it’s own thing. Chill out  and enjoy the ride 🚀🚀,TO THE MOON,,6,1
last year,Relax people it didnt even break thru the first resistance. patience is key,TO THE MOON,,3,0
last year,,Kozzy,,0,0
last year,,TO THE MOON,,1,0
last year,I told everyone sell this garbage, now your fighting for bananas, baahhhh,Bank Note Alby,,0,2
last year,,Braiden,,2,0
last year,Looooooooong! 6k shares @ 0.18!!,NTK Ventures,,2,0
last year,this is the only stock that's green for me today lol bought In at .19,Tayler,,6,0
last year,i didnt expect that to hit my lowest sell limit...  whyyyy i just need to do something and try to play safe then it hit my lowest sell limit..,I,,0,0
last year,Jesus Christ hold on tight. I bought this a months ago and just dumped a bunch more in this morning.,Nunyo Biness,,2,0
last year,lol bank roll alby truly a hater trying to deter others from investing in this golden opportunity,Money,,0,0
last year,we going to the top baby,Money,,0,0
last year,Adding more 🚀 we shall see a break out at 0.4 tmr then the uptrend continues 🤞🏽🤞🏽,TO THE MOON,,0,0
last year,Please do your own research. I came on here 3 weeks ago and there wasn?t a single on here except one guy. Now we got a bunch of fools going to the moon to the moon. Please don?t #$%$ this up for the real investors that found real value in this stock,vishesh,,1,0
last year,Price/book: 0.64 (undervalued stock) Pre covid Stock for 5+ years holding price of $3-$5. Due to the market crash back in March  +  retail stores are closed around Canada stock got manipulated and went very low. REITMANS only operating as an online store for now. However, some cities in Ontario Canada started to reopen. For technical analysis the stock have been in upward trend for the past 3 months. Also, having bullish candles pattern. Little pullbacks are normal and u can’t assume a stock would directly shoot up with no pullbacks to tests supports (buy low sell high),TO THE MOON,,8,0
last year,DONT PANIC Little pull back to test the support (use this as a buying opportunity) 😋,TO THE MOON,,1,0
last year,Every stock has a hater and  bank note ably is the hater for this stock 🤣,TO THE MOON,,3,0
last year,,TO THE MOON,,0,0
last year,i think bank note bought the stock at .40 this morning and panic sell at .32 😂😂😂😂 good job..,I,,0,0
last year,we have some clown 😂😂😂😂..,I,,0,0
last year,0.4 by 12:45 PM EST🤞🏽🚀🚀,TO THE MOON,,2,0
last year,I mean, I love their dress shirts from RW&amp;Co. Thats the single reason I bought this stock when it bottomed. They come in just under the quality of a good Hugo Boss shirt and cost like 75$Most of my colleagues shop here for that same reason. Their E-commerce is also bangin'If they drop all other brands and focus on RW, it's a surefire way to go the lulu lemon route.More,Nunyo Biness,,5,0
last year,#$%$ me I knew I had 2 shares months ago I started looking to buy in last week and literally as I click buy it went up 40%,richard,,1,0
last year,Dear sellers I’m coming for ur shares. Currently holding 13.2k shares averaging 0.32. 😉😉This market isn’t for weak people.,TO THE MOON,,3,0
last year,Is there any news?,GreenMarty,,1,0
last year,#$%$ this shortie.. let this stock grow!!!,I,,0,0
last year,the Yahoo app doesn't like to show you that this stock was $3 before the pandemic,Colonel,,2,0
last year,THATS HOW YALL LOOK WHEN SELLING Now... weak handssss,TO THE MOON,,2,0
last year,guys you need to hold otherwise your giving your money to the shortie people!,I,,2,0
last year,MID DAYYYY DIP testing the support. DONT PANIC 😌,TO THE MOON,,2,0
last year,Got 2500 shares at $0.39 just now.Is it a good buy?,Tanmay,,5,2
last year,Buy the dip,TO THE MOON,,2,0
last year,looks interesting. I'll buy.,Colonel,,1,0
last year,,TO THE MOON,,1,0
last year,78% Return,Braiden,,5,0
last year,,I,,0,0
last year,lets go all aboard the space ship 🚀,Money,,1,0
last year,why is this stock going up?,Giwon,,2,0
last year,lets go!!!,I,,0,0
last year,See it closing @ 0.5,TO THE MOON,,0,0
last year,round 2, let's go,Braiden,,4,0
last year,To the moon,linda,,4,0
last year,,I,,0,0
last year,I?ve had 2 shares in this for 6 months #$%$ I could have made 60% profit ?,richard,,1,0
last year,bought all my shares for 16 cents a share. let's get it above a $1,Timothy,,3,0
last year,hold, we need to build this up.,Timothy,,3,0
last year,How high do y’all think this stock will go,Jessica,,1,0
last year,,Braiden,,2,0
last year,lol when it dip i bought more when i check it .29 d #$%$ ????,I,,0,0
last year,up 40% in 1 week,Braiden,,1,0
last year,those idiot are selling for a penny price!!!,I,,0,0
last year,,TO THE MOON,,1,0
last year,,Raj,,2,0
last year,Finally some movement! :),Mark,,1,0
last year,stop selling, we need this to go up... no reason to sell here, who sells on a 3 cents increase. come on, hold. They are announcing stuff in May. Hold till then.,Braiden,,7,0
last year,I've been tryna purchase this stock for the past 2 days wealthsimple simply isn't fulfilling my requests,Money,,0,0
last year,,Raj,,0,0
last year,We might see this 1$ by the end of the week..,Raj,,3,0
last year,Go Reitmans Go.... It's time to go to the moon.........,Raj,,3,0
last year,soon!!! do your DD..,I,,0,0
last year,Still messing around here check azn.v good luck. Last time this was up like this it dipped huge.,RC,,0,2
last year,anytime soon this one will go to the moon!! reopening soon!! and money will come... this is long term stock check the pre covid price and you will see theres a bigchance to 3ple your money!!,I,,0,0
